,filename,sentence,paragraph_index,year,date,paragraphs,num_char_sentence,total_chars
1684,https://www.cnb.cz/en/monetary-policy/bank-board-decisions/CNB-Board-decisions-1522310940000-00001/?tab=statement,"In February, inflation was markedly below the central bank’s forecast.",5.0,2018,29/3/2018,10.0,70.0,4018.0
1685,https://www.cnb.cz/en/monetary-policy/bank-board-decisions/CNB-Board-decisions-1522310940000-00001/?tab=statement,This was due mainly to lower-than-expected food price inflation.,5.0,2018,29/3/2018,10.0,64.0,4018.0
1686,https://www.cnb.cz/en/monetary-policy/bank-board-decisions/CNB-Board-decisions-1522310940000-00001/?tab=statement,"However, core inflation also fell somewhat short of the Czech National Bank’s expectations.",5.0,2018,29/3/2018,10.0,91.0,4018.0
1687,https://www.cnb.cz/en/monetary-policy/bank-board-decisions/CNB-Board-decisions-1522310940000-00001/?tab=statement,The growth of the Czech economy accelerated further in 2017 Q4. Its pace was only slightly below the central bank’s forecast.,6.0,2018,29/3/2018,10.0,125.0,4018.0
1688,https://www.cnb.cz/en/monetary-policy/bank-board-decisions/CNB-Board-decisions-1522310940000-00001/?tab=statement,This was linked with slightly slower-than-expected growth in household consumption.,6.0,2018,29/3/2018,10.0,83.0,4018.0
1689,https://www.cnb.cz/en/monetary-policy/bank-board-decisions/CNB-Board-decisions-1522310940000-00001/?tab=statement,"Nevertheless, its dynamics remain robust due to a strong labour market and ensuing rapid growth in household income.",6.0,2018,29/3/2018,10.0,116.0,4018.0
1690,https://www.cnb.cz/en/monetary-policy/bank-board-decisions/CNB-Board-decisions-1522310940000-00001/?tab=statement,"The deviations of the other demand components from the Czech National Bank’s forecast were generally insignificant and, moreover, offset each other to a large extent.",6.0,2018,29/3/2018,10.0,166.0,4018.0
1691,https://www.cnb.cz/en/monetary-policy/bank-board-decisions/CNB-Board-decisions-1522310940000-00001/?tab=statement,"According to monthly indicators, industrial production and retail sales continued to rise at roughly the same pace in January.",7.0,2018,29/3/2018,10.0,126.0,4018.0
1692,https://www.cnb.cz/en/monetary-policy/bank-board-decisions/CNB-Board-decisions-1522310940000-00001/?tab=statement,"Following a slowdown in December, growth in construction output accelerated again.",7.0,2018,29/3/2018,10.0,82.0,4018.0
1693,https://www.cnb.cz/en/monetary-policy/bank-board-decisions/CNB-Board-decisions-1522310940000-00001/?tab=statement,The economic sentiment of both households and corporations remains favourable.,7.0,2018,29/3/2018,10.0,78.0,4018.0
1694,https://www.cnb.cz/en/monetary-policy/bank-board-decisions/CNB-Board-decisions-1522310940000-00001/?tab=statement,These indicators suggest continued robust economic growth at the start of this year.,7.0,2018,29/3/2018,10.0,84.0,4018.0
1695,https://www.cnb.cz/en/monetary-policy/bank-board-decisions/CNB-Board-decisions-1522310940000-00001/?tab=statement,The labour market situation reflects the exceptionally good performance of the Czech economy over the last few years.,8.0,2018,29/3/2018,10.0,117.0,4018.0
1696,https://www.cnb.cz/en/monetary-policy/bank-board-decisions/CNB-Board-decisions-1522310940000-00001/?tab=statement,"Employment continued to increase year on year at the close of last year, although its growth moderated in line with the forecast.",8.0,2018,29/3/2018,10.0,129.0,4018.0
1697,https://www.cnb.cz/en/monetary-policy/bank-board-decisions/CNB-Board-decisions-1522310940000-00001/?tab=statement,"The long-running decrease in unemployment also continued into early 2018, albeit only to a small degree according to the monthly indicators.",8.0,2018,29/3/2018,10.0,140.0,4018.0
1698,https://www.cnb.cz/en/monetary-policy/bank-board-decisions/CNB-Board-decisions-1522310940000-00001/?tab=statement,This was also in line with the forecast.,8.0,2018,29/3/2018,10.0,40.0,4018.0
1699,https://www.cnb.cz/en/monetary-policy/bank-board-decisions/CNB-Board-decisions-1522310940000-00001/?tab=statement,A shortage of available labour force coupled with high labour demand led to a further sizeable increase in job vacancies to new historical highs.,8.0,2018,29/3/2018,10.0,145.0,4018.0
1700,https://www.cnb.cz/en/monetary-policy/bank-board-decisions/CNB-Board-decisions-1522310940000-00001/?tab=statement,"As expected, wage growth accelerated again in late 2017, although its pace in the private sector was slightly lower than the central bank had predicted.",8.0,2018,29/3/2018,10.0,152.0,4018.0
1701,https://www.cnb.cz/en/monetary-policy/bank-board-decisions/CNB-Board-decisions-1522310940000-00001/?tab=statement,"To sum up the important facts about recent developments in the Czech economy, GDP growth and wage growth in Q4 were only slightly below the forecast.",9.0,2018,29/3/2018,10.0,149.0,4018.0
1702,https://www.cnb.cz/en/monetary-policy/bank-board-decisions/CNB-Board-decisions-1522310940000-00001/?tab=statement,Inflation was markedly below the Czech National Bank’s forecast at the start of this year.,9.0,2018,29/3/2018,10.0,90.0,4018.0
1703,https://www.cnb.cz/en/monetary-policy/bank-board-decisions/CNB-Board-decisions-1522310940000-00001/?tab=statement,The share of unemployed persons has been in line with the forecast so far in Q1.,9.0,2018,29/3/2018,10.0,80.0,4018.0
1704,https://www.cnb.cz/en/monetary-policy/bank-board-decisions/CNB-Board-decisions-1522310940000-00001/?tab=statement,The Bank Board assessed the risks to the inflation forecast at the monetary policy horizon as being slightly anti-inflationary.,10.0,2018,29/3/2018,10.0,127.0,4018.0
1705,https://www.cnb.cz/en/monetary-policy/bank-board-decisions/CNB-Board-decisions-1522310940000-00001/?tab=statement,"Risks in this direction stem mainly from inflation, which decreased faster at the start of this year than the Czech National Bank had expected.",10.0,2018,29/3/2018,10.0,143.0,4018.0
1706,https://www.cnb.cz/en/monetary-policy/bank-board-decisions/CNB-Board-decisions-1522310940000-00001/?tab=statement,"However, more gradual appreciation of the koruna compared to the forecast may act in the opposite direction in the quarters ahead.",10.0,2018,29/3/2018,10.0,130.0,4018.0
1707,https://www.cnb.cz/en/monetary-policy/bank-board-decisions/CNB-Board-decisions-1517499600000-00001/?tab=statement,"At its meeting today, the CNB Bank Board unanimously increased the two-week repo rate by 25 basis points to 0.75%.",1.0,2018,1/2/2018,10.0,114.0,5318.0
1708,https://www.cnb.cz/en/monetary-policy/bank-board-decisions/CNB-Board-decisions-1517499600000-00001/?tab=statement,"At the same time, it increased the Lombard rate by 50 basis points to 1.50% and kept the discount rate unchanged at 0.05%.</",1.0,2018,1/2/2018,10.0,124.0,5318.0
1709,https://www.cnb.cz/en/monetary-policy/bank-board-decisions/CNB-Board-decisions-1517499600000-00001/?tab=statement,The decision adopted by the Bank Board is underpinned by a new macroeconomic forecast of the Czech National Bank.,2.0,2018,1/2/2018,10.0,113.0,5318.0
1710,https://www.cnb.cz/en/monetary-policy/bank-board-decisions/CNB-Board-decisions-1517499600000-00001/?tab=statement,Consistent with the forecast is a further rise in domestic market interest rates this year and especially next year.,2.0,2018,1/2/2018,10.0,116.0,5318.0
1711,https://www.cnb.cz/en/monetary-policy/bank-board-decisions/CNB-Board-decisions-1517499600000-00001/?tab=statement,"This, coupled with further appreciation of the koruna against the euro, will ensure that inflation returns to the target.",2.0,2018,1/2/2018,10.0,121.0,5318.0
1712,https://www.cnb.cz/en/monetary-policy/bank-board-decisions/CNB-Board-decisions-1517499600000-00001/?tab=statement,"According to the external assumptions of the new forecast, the current robust growth in economic activity in the effective euro area will gradually slow to 2%.",3.0,2018,1/2/2018,10.0,159.0,5318.0
1713,https://www.cnb.cz/en/monetary-policy/bank-board-decisions/CNB-Board-decisions-1517499600000-00001/?tab=statement,Growth in industrial producer prices will slacken temporarily at the start of this year.,3.0,2018,1/2/2018,10.0,88.0,5318.0
1714,https://www.cnb.cz/en/monetary-policy/bank-board-decisions/CNB-Board-decisions-1517499600000-00001/?tab=statement,"However, it will then recover again, owing among other factors to higher oil prices.",3.0,2018,1/2/2018,10.0,84.0,5318.0
1715,https://www.cnb.cz/en/monetary-policy/bank-board-decisions/CNB-Board-decisions-1517499600000-00001/?tab=statement,Accommodative monetary policy of the European Central Bank will foster a return of euro area inflation to 2% in late 2019. 3M EURIBOR market rates will not turn positive until the end of next year.,3.0,2018,1/2/2018,10.0,197.0,5318.0
1716,https://www.cnb.cz/en/monetary-policy/bank-board-decisions/CNB-Board-decisions-1517499600000-00001/?tab=statement,The expected outlook for the euro-dollar exchange rate is slightly below USD 1.20 to the euro.,3.0,2018,1/2/2018,10.0,94.0,5318.0
1717,https://www.cnb.cz/en/monetary-policy/bank-board-decisions/CNB-Board-decisions-1517499600000-00001/?tab=statement,The Brent crude oil price will gradually decline from its current elevated levels almost to USD 60 a barrel at the end of next year.,3.0,2018,1/2/2018,10.0,132.0,5318.0
1718,https://www.cnb.cz/en/monetary-policy/bank-board-decisions/CNB-Board-decisions-1517499600000-00001/?tab=statement,Domestic inflation will remain above the 2% target this year.,4.0,2018,1/2/2018,10.0,61.0,5318.0
1719,https://www.cnb.cz/en/monetary-policy/bank-board-decisions/CNB-Board-decisions-1517499600000-00001/?tab=statement,It will then return to the target at the start of next year.,4.0,2018,1/2/2018,10.0,60.0,5318.0
1720,https://www.cnb.cz/en/monetary-policy/bank-board-decisions/CNB-Board-decisions-1517499600000-00001/?tab=statement,"The currently strong inflation pressures, stemming from faster growth of the domestic economy and wages, will ease gradually.",4.0,2018,1/2/2018,10.0,125.0,5318.0
1721,https://www.cnb.cz/en/monetary-policy/bank-board-decisions/CNB-Board-decisions-1517499600000-00001/?tab=statement,"In 2018, this will be due mainly to a strengthening anti-inflationary effect of import prices, which will reflect appreciation of the koruna.",4.0,2018,1/2/2018,10.0,141.0,5318.0
1722,https://www.cnb.cz/en/monetary-policy/bank-board-decisions/CNB-Board-decisions-1517499600000-00001/?tab=statement,"At the same time, the one-off price factors that increased inflation last year will fully disappear.",4.0,2018,1/2/2018,10.0,100.0,5318.0
1723,https://www.cnb.cz/en/monetary-policy/bank-board-decisions/CNB-Board-decisions-1517499600000-00001/?tab=statement,"However, faster growth in administered prices will cause headline inflation to stay above the 2% target this year.",4.0,2018,1/2/2018,10.0,114.0,5318.0
1724,https://www.cnb.cz/en/monetary-policy/bank-board-decisions/CNB-Board-decisions-1517499600000-00001/?tab=statement,Inflation will be just below the target over the monetary policy horizon.,4.0,2018,1/2/2018,10.0,73.0,5318.0
1725,https://www.cnb.cz/en/monetary-policy/bank-board-decisions/CNB-Board-decisions-1517499600000-00001/?tab=statement,"The growth of the Czech economy will slow compared to last year, but it will exceed 3% nonetheless.",5.0,2018,1/2/2018,10.0,99.0,5318.0
1726,https://www.cnb.cz/en/monetary-policy/bank-board-decisions/CNB-Board-decisions-1517499600000-00001/?tab=statement,"The economy will continue to be supported by growth in external demand, robust consumption of Czech households and generally strong domestic investment activity.",5.0,2018,1/2/2018,10.0,161.0,5318.0
1727,https://www.cnb.cz/en/monetary-policy/bank-board-decisions/CNB-Board-decisions-1517499600000-00001/?tab=statement,Rising labour demand coupled with an increasingly distinct shortage of available labour will manifest itself in continued rapid wage growth.,5.0,2018,1/2/2018,10.0,140.0,5318.0
1728,https://www.cnb.cz/en/monetary-policy/bank-board-decisions/CNB-Board-decisions-1517499600000-00001/?tab=statement,"Starting with this forecast, the Czech National Bank is returning to the publication of numerical forecasts for the koruna-euro exchange rate.",6.0,2018,1/2/2018,10.0,142.0,5318.0
1729,https://www.cnb.cz/en/monetary-policy/bank-board-decisions/CNB-Board-decisions-1517499600000-00001/?tab=statement,"Like the interest rate forecast, the exchange rate outlook does not constitute any commitment by the Czech National Bank, nor can it be interpreted as the preferred or desired exchange rate level.",6.0,2018,1/2/2018,10.0,196.0,5318.0
1730,https://www.cnb.cz/en/monetary-policy/bank-board-decisions/CNB-Board-decisions-1517499600000-00001/?tab=statement,"Like the forecasts for all other variables, the exchange rate forecast is conditional on the assumptions of the forecast, including the outlooks for developments abroad.",6.0,2018,1/2/2018,10.0,169.0,5318.0
1731,https://www.cnb.cz/en/monetary-policy/bank-board-decisions/CNB-Board-decisions-1517499600000-00001/?tab=statement,"Unexpected shocks may cause the actual exchange rate to deviate in either direction from the forecast, sometimes significantly.",6.0,2018,1/2/2018,10.0,127.0,5318.0
1732,https://www.cnb.cz/en/monetary-policy/bank-board-decisions/CNB-Board-decisions-1517499600000-00001/?tab=statement,"However, its publication will give the market a useful guide to the future monetary policy stance, as it did before November 2013.",6.0,2018,1/2/2018,10.0,130.0,5318.0
1733,https://www.cnb.cz/en/monetary-policy/bank-board-decisions/CNB-Board-decisions-1517499600000-00001/?tab=statement,A deviation of the actual exchange rate from the forecasted path may point to a need to change the outlook for the interest rate component of the monetary conditions.,6.0,2018,1/2/2018,10.0,166.0,5318.0
1734,https://www.cnb.cz/en/monetary-policy/bank-board-decisions/CNB-Board-decisions-1517499600000-00001/?tab=statement,"According to the new forecast, the koruna will appreciate further against the euro.",7.0,2018,1/2/2018,10.0,83.0,5318.0
1735,https://www.cnb.cz/en/monetary-policy/bank-board-decisions/CNB-Board-decisions-1517499600000-00001/?tab=statement,Its forecasted appreciation in the course of this year will mainly reflect a widening of the interest rate differential vis-à-vis the euro area and the impact of continued asset purchases by the European Central Bank.,7.0,2018,1/2/2018,10.0,217.0,5318.0
1736,https://www.cnb.cz/en/monetary-policy/bank-board-decisions/CNB-Board-decisions-1517499600000-00001/?tab=statement,"Ongoing real convergence of the Czech economy towards the euro area countries, associated with rising labour productivity, will act in the same direction over the entire forecast horizon.",7.0,2018,1/2/2018,10.0,187.0,5318.0
1737,https://www.cnb.cz/en/monetary-policy/bank-board-decisions/CNB-Board-decisions-1517499600000-00001/?tab=statement,"Next year, however, the koruna will firm only modestly to around CZK 24.5 to the euro.",7.0,2018,1/2/2018,10.0,86.0,5318.0
1738,https://www.cnb.cz/en/monetary-policy/bank-board-decisions/CNB-Board-decisions-1517499600000-00001/?tab=statement,"This will reflect, among other factors, the assumed shift of the European Central Bank’s monetary policy towards normal.",7.0,2018,1/2/2018,10.0,120.0,5318.0
1739,https://www.cnb.cz/en/monetary-policy/bank-board-decisions/CNB-Board-decisions-1517499600000-00001/?tab=statement,"According to the forecast, the return of inflation very close to the target will be fostered by a rise in domestic market interest rates in addition to appreciation of the koruna.",8.0,2018,1/2/2018,10.0,179.0,5318.0
1740,https://www.cnb.cz/en/monetary-policy/bank-board-decisions/CNB-Board-decisions-1517499600000-00001/?tab=statement,"However, this rise will be slowed in 2018 by continued very accommodative European Central Bank monetary policy, which will add to the appreciation pressures on the koruna in the next few quarters.",8.0,2018,1/2/2018,10.0,197.0,5318.0
1741,https://www.cnb.cz/en/monetary-policy/bank-board-decisions/CNB-Board-decisions-1517499600000-00001/?tab=statement,"During 2019, domestic interest rates will converge smoothly to their assumed long-run neutral level, owing, among other things, to foreign rates turning positive again.",8.0,2018,1/2/2018,10.0,168.0,5318.0
1742,https://www.cnb.cz/en/monetary-policy/bank-board-decisions/CNB-Board-decisions-1517499600000-00001/?tab=statement,"Compared to the previous forecast, the inflation outlook is slightly lower over the monetary policy horizon.",9.0,2018,1/2/2018,10.0,108.0,5318.0
1743,https://www.cnb.cz/en/monetary-policy/bank-board-decisions/CNB-Board-decisions-1517499600000-00001/?tab=statement,"By contrast, the forecasted growth of the Czech economy is slightly higher this year and the next.",9.0,2018,1/2/2018,10.0,98.0,5318.0
1744,https://www.cnb.cz/en/monetary-policy/bank-board-decisions/CNB-Board-decisions-1517499600000-00001/?tab=statement,"The pace of growth in interest rates is somewhat more gradual in 2019, while the koruna-euro exchange rate forecast for next year has moved to a rather stronger level.",9.0,2018,1/2/2018,10.0,167.0,5318.0
1745,https://www.cnb.cz/en/monetary-policy/bank-board-decisions/CNB-Board-decisions-1517499600000-00001/?tab=statement,The Bank Board assessed the risks to the inflation forecast at the monetary policy horizon as being balanced.,10.0,2018,1/2/2018,10.0,109.0,5318.0
1746,https://www.cnb.cz/en/monetary-policy/bank-board-decisions/CNB-Board-decisions-1517499600000-00001/?tab=statement,"At the same time, it stated that there are two bidirectional uncertainties of the forecast.",10.0,2018,1/2/2018,10.0,91.0,5318.0
1747,https://www.cnb.cz/en/monetary-policy/bank-board-decisions/CNB-Board-decisions-1517499600000-00001/?tab=statement,The first one is associated with the strength of current and future domestic inflation pressures.,10.0,2018,1/2/2018,10.0,97.0,5318.0
1748,https://www.cnb.cz/en/monetary-policy/bank-board-decisions/CNB-Board-decisions-1517499600000-00001/?tab=statement,"The second, general, uncertainty concerns the exchange rate path.",10.0,2018,1/2/2018,10.0,65.0,5318.0
1749,,,,,,,,
1750,https://www.cnb.cz/en/monetary-policy/bank-board-decisions/CNB-Board-decisions-2017-1513868400000-00001/?tab=statement,"<At its meeting today, the Bank Board of the Czech National Bank left interest rates unchanged.",2.0,2017,21/12/2017,10.0,95.0,4279.0
1751,https://www.cnb.cz/en/monetary-policy/bank-board-decisions/CNB-Board-decisions-2017-1513868400000-00001/?tab=statement,"The two-week repo rate thus remains at 0.50%, the discount rate at 0.05% and the Lombard rate at 1%.",2.0,2017,21/12/2017,10.0,100.0,4279.0
1752,https://www.cnb.cz/en/monetary-policy/bank-board-decisions/CNB-Board-decisions-2017-1513868400000-00001/?tab=statement,Five members voted in favour of this decision.,2.0,2017,21/12/2017,10.0,46.0,4279.0
1753,https://www.cnb.cz/en/monetary-policy/bank-board-decisions/CNB-Board-decisions-2017-1513868400000-00001/?tab=statement,Two members voted for raising the two-week repo rate to 0.75%.</,2.0,2017,21/12/2017,10.0,64.0,4279.0
1754,https://www.cnb.cz/en/monetary-policy/bank-board-decisions/CNB-Board-decisions-2017-1513868400000-00001/?tab=statement,"According to the current forecast, inflation will stay above the 2% target for most of 2018.",3.0,2017,21/12/2017,10.0,92.0,4279.0
1755,https://www.cnb.cz/en/monetary-policy/bank-board-decisions/CNB-Board-decisions-2017-1513868400000-00001/?tab=statement,"It will then return to the target at the monetary policy horizon, i.e. in late 2018 and early 2019.",3.0,2017,21/12/2017,10.0,99.0,4279.0
1756,https://www.cnb.cz/en/monetary-policy/bank-board-decisions/CNB-Board-decisions-2017-1513868400000-00001/?tab=statement,"Following the November rise in interest rates, a continued increase in domestic market interest rates towards their assumed long-run level of 3% is consistent with the forecast.",3.0,2017,21/12/2017,10.0,177.0,4279.0
1757,https://www.cnb.cz/en/monetary-policy/bank-board-decisions/CNB-Board-decisions-2017-1513868400000-00001/?tab=statement,The rates are expected to approach this level at the end of 2019.,3.0,2017,21/12/2017,10.0,65.0,4279.0
1758,https://www.cnb.cz/en/monetary-policy/bank-board-decisions/CNB-Board-decisions-2017-1513868400000-00001/?tab=statement,The Bank Board assessed the risks to the current inflation forecast as being balanced and insignificant.,3.0,2017,21/12/2017,10.0,104.0,4279.0
1759,https://www.cnb.cz/en/monetary-policy/bank-board-decisions/CNB-Board-decisions-2017-1513868400000-00001/?tab=statement,The outlook for growth in foreign economic activity this year and the next has increased compared to the assumption of the current forecast.,4.0,2017,21/12/2017,10.0,140.0,4279.0
1760,https://www.cnb.cz/en/monetary-policy/bank-board-decisions/CNB-Board-decisions-2017-1513868400000-00001/?tab=statement,"This shift, coupled with a higher oil price outlook, has led to an upward revision of expected producer price inflation in the euro area this year and the next.",4.0,2017,21/12/2017,10.0,160.0,4279.0
1761,https://www.cnb.cz/en/monetary-policy/bank-board-decisions/CNB-Board-decisions-2017-1513868400000-00001/?tab=statement,"By contrast, the increase in producer prices expected for 2019 has declined.",4.0,2017,21/12/2017,10.0,76.0,4279.0
1762,https://www.cnb.cz/en/monetary-policy/bank-board-decisions/CNB-Board-decisions-2017-1513868400000-00001/?tab=statement,The outlook for euro interest rates has shifted slightly lower in reaction to the European Central Bank’s October decision to extend the asset purchase programme.,4.0,2017,21/12/2017,10.0,162.0,4279.0
1763,https://www.cnb.cz/en/monetary-policy/bank-board-decisions/CNB-Board-decisions-2017-1513868400000-00001/?tab=statement,The market outlook for Brent crude oil prices has increased compared to the forecast assumptions as a result of the extension of the agreement of oil producers to curb production until 2018.,4.0,2017,21/12/2017,10.0,190.0,4279.0
1764,https://www.cnb.cz/en/monetary-policy/bank-board-decisions/CNB-Board-decisions-2017-1513868400000-00001/?tab=statement,The outlook for the euro-dollar exchange rate is almost unchanged.,4.0,2017,21/12/2017,10.0,66.0,4279.0
1765,https://www.cnb.cz/en/monetary-policy/bank-board-decisions/CNB-Board-decisions-2017-1513868400000-00001/?tab=statement,"In Q4 so far, domestic inflation has been in the upper half of the tolerance band around the Czech National Bank’s 2% target.",5.0,2017,21/12/2017,10.0,125.0,4279.0
1766,https://www.cnb.cz/en/monetary-policy/bank-board-decisions/CNB-Board-decisions-2017-1513868400000-00001/?tab=statement,"In October and November, the inflation forecast materialised in terms of both the recorded figures and their structure.",5.0,2017,21/12/2017,10.0,119.0,4279.0
1767,https://www.cnb.cz/en/monetary-policy/bank-board-decisions/CNB-Board-decisions-2017-1513868400000-00001/?tab=statement,Core inflation and food prices are still the biggest contributors to inflation.,5.0,2017,21/12/2017,10.0,79.0,4279.0
1768,https://www.cnb.cz/en/monetary-policy/bank-board-decisions/CNB-Board-decisions-2017-1513868400000-00001/?tab=statement,"The annual growth of the Czech economy accelerated further to 5% in Q3, also in line with the forecast.",6.0,2017,21/12/2017,10.0,103.0,4279.0
1769,https://www.cnb.cz/en/monetary-policy/bank-board-decisions/CNB-Board-decisions-2017-1513868400000-00001/?tab=statement,"All expenditure components contributed to the rise in domestic economic activity, in particular household consumption.",6.0,2017,21/12/2017,10.0,118.0,4279.0
1770,https://www.cnb.cz/en/monetary-policy/bank-board-decisions/CNB-Board-decisions-2017-1513868400000-00001/?tab=statement,Its continued robust increase reflects solid wage growth and ongoing employment growth.,6.0,2017,21/12/2017,10.0,87.0,4279.0
1771,https://www.cnb.cz/en/monetary-policy/bank-board-decisions/CNB-Board-decisions-2017-1513868400000-00001/?tab=statement,"A higher contribution of investment, especially in machinery and equipment, was also recorded.",6.0,2017,21/12/2017,10.0,94.0,4279.0
1772,https://www.cnb.cz/en/monetary-policy/bank-board-decisions/CNB-Board-decisions-2017-1513868400000-00001/?tab=statement,This may have a favourable effect on future productivity growth.,6.0,2017,21/12/2017,10.0,64.0,4279.0
1773,https://www.cnb.cz/en/monetary-policy/bank-board-decisions/CNB-Board-decisions-2017-1513868400000-00001/?tab=statement,"According to monthly indicators, industrial production and retail sales continued to rise apace.",7.0,2017,21/12/2017,10.0,96.0,4279.0
1774,https://www.cnb.cz/en/monetary-policy/bank-board-decisions/CNB-Board-decisions-2017-1513868400000-00001/?tab=statement,"In addition, construction output recorded a slight recovery.",7.0,2017,21/12/2017,10.0,60.0,4279.0
1775,https://www.cnb.cz/en/monetary-policy/bank-board-decisions/CNB-Board-decisions-2017-1513868400000-00001/?tab=statement,The previous long-running decrease in civil engineering output dissipated.,7.0,2017,21/12/2017,10.0,74.0,4279.0
1776,https://www.cnb.cz/en/monetary-policy/bank-board-decisions/CNB-Board-decisions-2017-1513868400000-00001/?tab=statement,The economic sentiment of both households and corporations remains high.,7.0,2017,21/12/2017,10.0,72.0,4279.0
1777,https://www.cnb.cz/en/monetary-policy/bank-board-decisions/CNB-Board-decisions-2017-1513868400000-00001/?tab=statement,These indicators suggest continued robust economic growth at the close of this year.,7.0,2017,21/12/2017,10.0,84.0,4279.0
1778,https://www.cnb.cz/en/monetary-policy/bank-board-decisions/CNB-Board-decisions-2017-1513868400000-00001/?tab=statement,Labour market indicators remain very strong.,8.0,2017,21/12/2017,10.0,44.0,4279.0
