,filename,sentence,paragraph_index,year,date,paragraphs,num_char_sentence,total_chars
0,https://www.cnb.cz/en/monetary-policy/bank-board-decisions/CNB-Board-decisions-1659624480000/?tab=statement,"At its meeting today, the Bank Board kept interest rates unchanged.",1.0,2022,4/8/2022,15.0,67.0,4345.0
1,https://www.cnb.cz/en/monetary-policy/bank-board-decisions/CNB-Board-decisions-1659624480000/?tab=statement,"The two-week repo rate remains at 7%, the discount rate at 6% and the Lombard rate at 8%.",1.0,2022,4/8/2022,15.0,89.0,4345.0
2,https://www.cnb.cz/en/monetary-policy/bank-board-decisions/CNB-Board-decisions-1659624480000/?tab=statement,"Five members voted in favour of this decision, and two members voted for increasing rates by one percentage point.</",1.0,2022,4/8/2022,15.0,116.0,4345.0
3,https://www.cnb.cz/en/monetary-policy/bank-board-decisions/CNB-Board-decisions-1659624480000/?tab=statement,The CNB’s interest rates are at a level that is dampening domestic demand pressures.,2.0,2022,4/8/2022,15.0,84.0,4345.0
4,https://www.cnb.cz/en/monetary-policy/bank-board-decisions/CNB-Board-decisions-1659624480000/?tab=statement,They are slowing growth in loans to households and firms and hence also in the quantity of money in the economy.,2.0,2022,4/8/2022,15.0,112.0,4345.0
5,https://www.cnb.cz/en/monetary-policy/bank-board-decisions/CNB-Board-decisions-1659624480000/?tab=statement,The Bank Board agreed that long-term price stability is also contingent on moderate wage bargaining demands and responsible fiscal policy.,2.0,2022,4/8/2022,15.0,138.0,4345.0
6,https://www.cnb.cz/en/monetary-policy/bank-board-decisions/CNB-Board-decisions-1659624480000/?tab=statement,The Bank Board will wait for further data and will assess them.,2.0,2022,4/8/2022,15.0,63.0,4345.0
7,https://www.cnb.cz/en/monetary-policy/bank-board-decisions/CNB-Board-decisions-1659624480000/?tab=statement,It will decide at the next meeting whether rates will remain unchanged or increase.,2.0,2022,4/8/2022,15.0,83.0,4345.0
8,https://www.cnb.cz/en/monetary-policy/bank-board-decisions/CNB-Board-decisions-1659624480000/?tab=statement,The decision adopted by the Bank Board is underpinned by a new macroeconomic forecast.,3.0,2022,4/8/2022,15.0,86.0,4345.0
9,https://www.cnb.cz/en/monetary-policy/bank-board-decisions/CNB-Board-decisions-1659624480000/?tab=statement,"In the baseline scenario of the forecast, the monetary policy horizon is shifted to 18–24 months ahead due to extraordinary cost pressures amid exceptionally high uncertainty.",3.0,2022,4/8/2022,15.0,175.0,4345.0
10,https://www.cnb.cz/en/monetary-policy/bank-board-decisions/CNB-Board-decisions-1659624480000/?tab=statement,The Bank Board also discussed other scenarios.,3.0,2022,4/8/2022,15.0,46.0,4345.0
11,https://www.cnb.cz/en/monetary-policy/bank-board-decisions/CNB-Board-decisions-1659624480000/?tab=statement,The Czech National Bank will continue to prevent excessive fluctuations of the koruna.,4.0,2022,4/8/2022,15.0,86.0,4345.0
12,https://www.cnb.cz/en/monetary-policy/bank-board-decisions/CNB-Board-decisions-1659624480000/?tab=statement,The Czech economy is facing both strong cost inflation pressures from the external environment and demand pressures from the domestic economy.,5.0,2022,4/8/2022,15.0,142.0,4345.0
13,https://www.cnb.cz/en/monetary-policy/bank-board-decisions/CNB-Board-decisions-1659624480000/?tab=statement,"Household consumption, which is crucial for the future course of demand-pull inflation, is being dampened by high energy and food prices, negative sentiment and higher interest rates.",6.0,2022,4/8/2022,15.0,183.0,4345.0
14,https://www.cnb.cz/en/monetary-policy/bank-board-decisions/CNB-Board-decisions-1659624480000/?tab=statement,"On the other hand, unemployment remains low.",7.0,2022,4/8/2022,15.0,44.0,4345.0
15,https://www.cnb.cz/en/monetary-policy/bank-board-decisions/CNB-Board-decisions-1659624480000/?tab=statement,Industrial production has so far been resilient to the increased costs and supply chain problems.,7.0,2022,4/8/2022,15.0,97.0,4345.0
16,https://www.cnb.cz/en/monetary-policy/bank-board-decisions/CNB-Board-decisions-1659624480000/?tab=statement,"However, external demand is now having a negative effect on GDP. Leading indicators point to a further slowdown in external demand.",7.0,2022,4/8/2022,15.0,131.0,4345.0
17,https://www.cnb.cz/en/monetary-policy/bank-board-decisions/CNB-Board-decisions-1659624480000/?tab=statement,The effect of fiscal policy on economic activity is now broadly neutral.,8.0,2022,4/8/2022,15.0,72.0,4345.0
18,https://www.cnb.cz/en/monetary-policy/bank-board-decisions/CNB-Board-decisions-1659624480000/?tab=statement,"According to our new forecast, inflation will rise further in the coming few months.",9.0,2022,4/8/2022,15.0,84.0,4345.0
19,https://www.cnb.cz/en/monetary-policy/bank-board-decisions/CNB-Board-decisions-1659624480000/?tab=statement,The rise will be due mainly to gas and electricity prices.,9.0,2022,4/8/2022,15.0,58.0,4345.0
20,https://www.cnb.cz/en/monetary-policy/bank-board-decisions/CNB-Board-decisions-1659624480000/?tab=statement,We expect inflation to reach around 20% in the autumn and to average 16.5% for the year as a whole (in our spring forecast we expected 13.1%).,9.0,2022,4/8/2022,15.0,142.0,4345.0
21,https://www.cnb.cz/en/monetary-policy/bank-board-decisions/CNB-Board-decisions-1659624480000/?tab=statement,"According to the forecast, inflation should decline to around 2% in a year and a half.",9.0,2022,4/8/2022,15.0,86.0,4345.0
22,https://www.cnb.cz/en/monetary-policy/bank-board-decisions/CNB-Board-decisions-1659624480000/?tab=statement,GDP grew by 3.5% last year.,10.0,2022,4/8/2022,15.0,27.0,4345.0
23,https://www.cnb.cz/en/monetary-policy/bank-board-decisions/CNB-Board-decisions-1659624480000/?tab=statement,"According to the forecast, economic growth will drop to 2.3% this year (the spring forecast for GDP growth this year was 0.8%).",10.0,2022,4/8/2022,15.0,127.0,4345.0
24,https://www.cnb.cz/en/monetary-policy/bank-board-decisions/CNB-Board-decisions-1659624480000/?tab=statement,A further slowdown to 1.1% is expected for next year (the spring forecast was 3.6%).,10.0,2022,4/8/2022,15.0,84.0,4345.0
25,https://www.cnb.cz/en/monetary-policy/bank-board-decisions/CNB-Board-decisions-1659624480000/?tab=statement,We expect domestic demand to slow.,10.0,2022,4/8/2022,15.0,34.0,4345.0
26,https://www.cnb.cz/en/monetary-policy/bank-board-decisions/CNB-Board-decisions-1659624480000/?tab=statement,"Household consumption will be hit by a decline in real income, as wage growth will not cover growth in living costs.",10.0,2022,4/8/2022,15.0,116.0,4345.0
27,https://www.cnb.cz/en/monetary-policy/bank-board-decisions/CNB-Board-decisions-1659624480000/?tab=statement,"Firms are facing rising costs of energy and other commodities and materials, and will rein in investment for that reason as well.",10.0,2022,4/8/2022,15.0,129.0,4345.0
28,https://www.cnb.cz/en/monetary-policy/bank-board-decisions/CNB-Board-decisions-1659624480000/?tab=statement,"According to the baseline scenario of the forecast, three-month market interest rates (3M PRIBOR) will be broadly stable initially and decline gradually next year.",11.0,2022,4/8/2022,15.0,163.0,4345.0
29,https://www.cnb.cz/en/monetary-policy/bank-board-decisions/CNB-Board-decisions-1659624480000/?tab=statement,The forecast expects the koruna exchange rate to depreciate modestly in the next few quarters.,12.0,2022,4/8/2022,15.0,94.0,4345.0
30,https://www.cnb.cz/en/monetary-policy/bank-board-decisions/CNB-Board-decisions-1659624480000/?tab=statement,"As far as the external environment is concerned, our new forecast assumes that the inflation pressures will be stronger this year.",13.0,2022,4/8/2022,15.0,130.0,4345.0
31,https://www.cnb.cz/en/monetary-policy/bank-board-decisions/CNB-Board-decisions-1659624480000/?tab=statement,"A deterioration in economic sentiment and growth in households’ living costs and firms’ expenses, coupled with monetary policy tightening by major central banks, will gradually lead to a downturn in global economic activity and a decrease in inflation pressures in the years ahead.",13.0,2022,4/8/2022,15.0,281.0,4345.0
32,https://www.cnb.cz/en/monetary-policy/bank-board-decisions/CNB-Board-decisions-1659624480000/?tab=statement,The Bank Board assessed the risks and uncertainties of the baseline scenario of the forecast as being significant and going in both directions.,14.0,2022,4/8/2022,15.0,143.0,4345.0
33,https://www.cnb.cz/en/monetary-policy/bank-board-decisions/CNB-Board-decisions-1659624480000/?tab=statement,"A further rise in commodity prices, a threat of inflation expectations becoming unanchored, a related risk of a wage-inflation spiral and easier fiscal policy are upside risks to inflation.",14.0,2022,4/8/2022,15.0,189.0,4345.0
34,https://www.cnb.cz/en/monetary-policy/bank-board-decisions/CNB-Board-decisions-1659624480000/?tab=statement,"By contrast, the growing likelihood of recession abroad and a stronger-than-forecasted downturn in domestic consumer and investment demand are downside risks.",14.0,2022,4/8/2022,15.0,158.0,4345.0
35,https://www.cnb.cz/en/monetary-policy/bank-board-decisions/CNB-Board-decisions-1659624480000/?tab=statement,"The general uncertainties of the outlook include the future course of the war in Ukraine, the availability and prices of energy, the future monetary policy stance abroad and the duration of the disruptions to global supply chains.",14.0,2022,4/8/2022,15.0,230.0,4345.0
36,https://www.cnb.cz/en/monetary-policy/bank-board-decisions/CNB-Board-decisions-1659624480000/?tab=statement,The Bank Board assures the public that the CNB’s actions will be sufficient to restore price stability in accordance with its statutory mandate.,15.0,2022,4/8/2022,15.0,144.0,4345.0
37,https://www.cnb.cz/en/monetary-policy/bank-board-decisions/CNB-Board-decisions-1659624480000/?tab=statement,"In addition, the Bank Board is ready to react appropriately to any materialisation of the risks of the forecast.",15.0,2022,4/8/2022,15.0,112.0,4345.0
38,https://www.cnb.cz/en/monetary-policy/bank-board-decisions/CNB-Board-decisions-1655909280000/?tab=statement,"At its meeting today, the Bank Board of the Czech National Bank increased the two-week repo rate to 7.00%, i.e. by 1.25 percentage points.",1.0,2022,22/6/2022,12.0,138.0,6082.0
39,https://www.cnb.cz/en/monetary-policy/bank-board-decisions/CNB-Board-decisions-1655909280000/?tab=statement,"At the same time, it increased the discount rate to 6.00% and the Lombard rate to 8.00%.",1.0,2022,22/6/2022,12.0,88.0,6082.0
40,https://www.cnb.cz/en/monetary-policy/bank-board-decisions/CNB-Board-decisions-1655909280000/?tab=statement,Five members voted in favour of this decision and two members voted for leaving rates unchanged.</,1.0,2022,22/6/2022,12.0,98.0,6082.0
41,https://www.cnb.cz/en/monetary-policy/bank-board-decisions/CNB-Board-decisions-1655909280000/?tab=statement,This decision of the Bank Board is underpinned by the spring macroeconomic forecast and by an assessment of information obtained since it was prepared.,2.0,2022,22/6/2022,12.0,151.0,6082.0
42,https://www.cnb.cz/en/monetary-policy/bank-board-decisions/CNB-Board-decisions-1655909280000/?tab=statement,Consistent with the baseline scenario of the spring forecast is a further sharp rise in market interest rates.,2.0,2022,22/6/2022,12.0,110.0,6082.0
43,https://www.cnb.cz/en/monetary-policy/bank-board-decisions/CNB-Board-decisions-1655909280000/?tab=statement,The Bank Board assessed the risks and uncertainties of the spring forecast in light of the new information as being markedly inflationary and acting towards a need for further significant tightening of monetary policy.,2.0,2022,22/6/2022,12.0,218.0,6082.0
44,https://www.cnb.cz/en/monetary-policy/bank-board-decisions/CNB-Board-decisions-1655909280000/?tab=statement,The war in Ukraine and anti-epidemic measures in China are dampening the growth of the global economy.,3.0,2022,22/6/2022,12.0,102.0,6082.0
45,https://www.cnb.cz/en/monetary-policy/bank-board-decisions/CNB-Board-decisions-1655909280000/?tab=statement,"The euro area countries have so far withstood the adverse geopolitical developments, so the GDP outlook for the effective euro area has shifted slightly higher for this year.",3.0,2022,22/6/2022,12.0,174.0,6082.0
46,https://www.cnb.cz/en/monetary-policy/bank-board-decisions/CNB-Board-decisions-1655909280000/?tab=statement,"By contrast, the outlook for 2023 has worsened slightly.",3.0,2022,22/6/2022,12.0,56.0,6082.0
47,https://www.cnb.cz/en/monetary-policy/bank-board-decisions/CNB-Board-decisions-1655909280000/?tab=statement,"The complicated situation with supplies of materials and components, coupled with the price of oil, which is higher than in the spring forecast, is reflected in a higher outlook for industrial producer prices.",3.0,2022,22/6/2022,12.0,209.0,6082.0
48,https://www.cnb.cz/en/monetary-policy/bank-board-decisions/CNB-Board-decisions-1655909280000/?tab=statement,Consumer price inflation has also been revised upwards.,3.0,2022,22/6/2022,12.0,55.0,6082.0
49,https://www.cnb.cz/en/monetary-policy/bank-board-decisions/CNB-Board-decisions-1655909280000/?tab=statement,"The European Central Bank is expected to raise interest rates several times in the months ahead, so the outlook for foreign market rates is slightly higher.",3.0,2022,22/6/2022,12.0,156.0,6082.0
50,https://www.cnb.cz/en/monetary-policy/bank-board-decisions/CNB-Board-decisions-1655909280000/?tab=statement,Both the current Brent crude oil price and its outlook are higher than assumed by the current forecast.,4.0,2022,22/6/2022,12.0,103.0,6082.0
51,https://www.cnb.cz/en/monetary-policy/bank-board-decisions/CNB-Board-decisions-1655909280000/?tab=statement,The expected euro-dollar exchange rate is weaker over the entire forecast horizon due to more forceful monetary policy tightening by the Fed.,4.0,2022,22/6/2022,12.0,141.0,6082.0
52,https://www.cnb.cz/en/monetary-policy/bank-board-decisions/CNB-Board-decisions-1655909280000/?tab=statement,"Domestic inflation increased significantly further during Q2, reaching 16% in May.",5.0,2022,22/6/2022,12.0,82.0,6082.0
53,https://www.cnb.cz/en/monetary-policy/bank-board-decisions/CNB-Board-decisions-1655909280000/?tab=statement,It was about one percentage point above the forecast.,5.0,2022,22/6/2022,12.0,53.0,6082.0
54,https://www.cnb.cz/en/monetary-policy/bank-board-decisions/CNB-Board-decisions-1655909280000/?tab=statement,More than one-half of this was due to higher-than-expected core inflation caused by unexpectedly strong growth in prices of both tradables and non-tradables.,5.0,2022,22/6/2022,12.0,157.0,6082.0
55,https://www.cnb.cz/en/monetary-policy/bank-board-decisions/CNB-Board-decisions-1655909280000/?tab=statement,Imputed rent and prices in restaurants and cafés are the biggest contributors to the growth in services prices.,5.0,2022,22/6/2022,12.0,111.0,6082.0
56,https://www.cnb.cz/en/monetary-policy/bank-board-decisions/CNB-Board-decisions-1655909280000/?tab=statement,Fuel prices were also higher than expected in May.,5.0,2022,22/6/2022,12.0,50.0,6082.0
57,https://www.cnb.cz/en/monetary-policy/bank-board-decisions/CNB-Board-decisions-1655909280000/?tab=statement,Growth in food prices and administered prices was only slightly higher than in the spring forecast.,5.0,2022,22/6/2022,12.0,99.0,6082.0
58,https://www.cnb.cz/en/monetary-policy/bank-board-decisions/CNB-Board-decisions-1655909280000/?tab=statement,"According to the spring forecast, inflation will be in double figures this year but will fall quickly in the first half of next year and return close to the 2% target in late 2023.",5.0,2022,22/6/2022,12.0,180.0,6082.0
59,https://www.cnb.cz/en/monetary-policy/bank-board-decisions/CNB-Board-decisions-1655909280000/?tab=statement,Annual GDP growth was one percentage point faster than forecasted in 2022 Q1. The deviation from the forecast was due almost solely to stronger-than-expected investment activity.,6.0,2022,22/6/2022,12.0,178.0,6082.0
60,https://www.cnb.cz/en/monetary-policy/bank-board-decisions/CNB-Board-decisions-1655909280000/?tab=statement,This occurred despite rapid growth in prices of capital goods and a rise in uncertainty connected with the war in Ukraine.,6.0,2022,22/6/2022,12.0,122.0,6082.0
61,https://www.cnb.cz/en/monetary-policy/bank-board-decisions/CNB-Board-decisions-1655909280000/?tab=statement,"The dynamics of exports and imports were also higher than forecasted, while the contribution of net exports was broadly as expected.",6.0,2022,22/6/2022,12.0,132.0,6082.0
62,https://www.cnb.cz/en/monetary-policy/bank-board-decisions/CNB-Board-decisions-1655909280000/?tab=statement,Household consumption and additions to inventories were in line with the projection.,6.0,2022,22/6/2022,12.0,84.0,6082.0
63,https://www.cnb.cz/en/monetary-policy/bank-board-decisions/CNB-Board-decisions-1655909280000/?tab=statement,"By contrast, growth in government consumption lagged behind expectations.",6.0,2022,22/6/2022,12.0,73.0,6082.0
64,https://www.cnb.cz/en/monetary-policy/bank-board-decisions/CNB-Board-decisions-1655909280000/?tab=statement,"According to the spring forecast, the Czech economy will slow markedly this year and even decline slightly in year-on-year terms in the second half of the year.",6.0,2022,22/6/2022,12.0,160.0,6082.0
65,https://www.cnb.cz/en/monetary-policy/bank-board-decisions/CNB-Board-decisions-1655909280000/?tab=statement,Economic growth will recover next year.,6.0,2022,22/6/2022,12.0,39.0,6082.0
66,https://www.cnb.cz/en/monetary-policy/bank-board-decisions/CNB-Board-decisions-1655909280000/?tab=statement,"Industrial production dropped further year on year in April, but this was mostly due to base effects.",7.0,2022,22/6/2022,12.0,101.0,6082.0
67,https://www.cnb.cz/en/monetary-policy/bank-board-decisions/CNB-Board-decisions-1655909280000/?tab=statement,Leading indicators are signalling no major weakening of industrial activity for now.,7.0,2022,22/6/2022,12.0,84.0,6082.0
68,https://www.cnb.cz/en/monetary-policy/bank-board-decisions/CNB-Board-decisions-1655909280000/?tab=statement,"Growth in construction output slowed year on year in April, as did growth in retail sales.",7.0,2022,22/6/2022,12.0,90.0,6082.0
69,https://www.cnb.cz/en/monetary-policy/bank-board-decisions/CNB-Board-decisions-1655909280000/?tab=statement,The tightness in the domestic labour market is still increasing slightly.,8.0,2022,22/6/2022,12.0,73.0,6082.0
70,https://www.cnb.cz/en/monetary-policy/bank-board-decisions/CNB-Board-decisions-1655909280000/?tab=statement,"The share of unemployed persons declined slightly in April and May, whereas the forecast had expected it to increase.",8.0,2022,22/6/2022,12.0,117.0,6082.0
71,https://www.cnb.cz/en/monetary-policy/bank-board-decisions/CNB-Board-decisions-1655909280000/?tab=statement,This was due to higher employment of refugees from Ukraine.,8.0,2022,22/6/2022,12.0,59.0,6082.0
72,https://www.cnb.cz/en/monetary-policy/bank-board-decisions/CNB-Board-decisions-1655909280000/?tab=statement,"Average wage growth in market sectors remained buoyant in Q1, despite being slightly slower than forecasted.",8.0,2022,22/6/2022,12.0,108.0,6082.0
73,https://www.cnb.cz/en/monetary-policy/bank-board-decisions/CNB-Board-decisions-1655909280000/?tab=statement,"So far in Q2, the koruna has been 2.5% weaker against the euro compared with the spring forecast.",9.0,2022,22/6/2022,12.0,97.0,6082.0
74,https://www.cnb.cz/en/monetary-policy/bank-board-decisions/CNB-Board-decisions-1655909280000/?tab=statement,"Despite a rising interest rate differential, this is due to a sharp weakening of the domestic currency in May, which reflected a change in financial market sentiment regarding the future course of domestic interest rates.",9.0,2022,22/6/2022,12.0,221.0,6082.0
75,https://www.cnb.cz/en/monetary-policy/bank-board-decisions/CNB-Board-decisions-1655909280000/?tab=statement,Further depreciation of the koruna is being prevented by foreign exchange market interventions by the Czech National Bank. ,9.0,2022,22/6/2022,12.0,123.0,6082.0
76,https://www.cnb.cz/en/monetary-policy/bank-board-decisions/CNB-Board-decisions-1655909280000/?tab=statement,"To sum up the materialisation of the spring forecast, inflation in May and economic growth in Q1 were both roughly one percentage point higher.",10.0,2022,22/6/2022,12.0,143.0,6082.0
77,https://www.cnb.cz/en/monetary-policy/bank-board-decisions/CNB-Board-decisions-1655909280000/?tab=statement,"By contrast, the average wage in the economy in Q1 and the share of unemployed persons so far in Q2 were lower.  ",10.0,2022,22/6/2022,12.0,113.0,6082.0
78,https://www.cnb.cz/en/monetary-policy/bank-board-decisions/CNB-Board-decisions-1655909280000/?tab=statement,The Bank Board assessed the risks and uncertainties of the spring forecast as being markedly inflationary and acting towards a need for further significant tightening of monetary policy.,11.0,2022,22/6/2022,12.0,186.0,6082.0
79,https://www.cnb.cz/en/monetary-policy/bank-board-decisions/CNB-Board-decisions-1655909280000/?tab=statement,"In particular, higher price growth at home and abroad is having an inflationary effect.",11.0,2022,22/6/2022,12.0,87.0,6082.0
80,https://www.cnb.cz/en/monetary-policy/bank-board-decisions/CNB-Board-decisions-1655909280000/?tab=statement,"This is due, among other things, to a sharp rise in energy and commodity prices amid concerns about Russian supplies being cut off.",11.0,2022,22/6/2022,12.0,131.0,6082.0
81,https://www.cnb.cz/en/monetary-policy/bank-board-decisions/CNB-Board-decisions-1655909280000/?tab=statement,The upside risks also include a weaker koruna exchange rate and the threat of inflation expectations becoming unanchored from the CNB’s 2% target.,11.0,2022,22/6/2022,12.0,146.0,6082.0
82,https://www.cnb.cz/en/monetary-policy/bank-board-decisions/CNB-Board-decisions-1655909280000/?tab=statement,Another inflationary risk is the possibility of less restrictive fiscal policy this year and the next.,11.0,2022,22/6/2022,12.0,102.0,6082.0
83,https://www.cnb.cz/en/monetary-policy/bank-board-decisions/CNB-Board-decisions-1655909280000/?tab=statement,The uncertainties include the future course of the war in Ukraine and the future monetary policy stance abroad.  ,11.0,2022,22/6/2022,12.0,113.0,6082.0
84,https://www.cnb.cz/en/monetary-policy/bank-board-decisions/CNB-Board-decisions-1655909280000/?tab=statement,"In this situation, the Bank Board decided to increase interest rates further.",12.0,2022,22/6/2022,12.0,77.0,6082.0
85,https://www.cnb.cz/en/monetary-policy/bank-board-decisions/CNB-Board-decisions-1655909280000/?tab=statement,This is in response to a continued marked increase in inflation pressures in the Czech economy.,12.0,2022,22/6/2022,12.0,95.0,6082.0
86,https://www.cnb.cz/en/monetary-policy/bank-board-decisions/CNB-Board-decisions-1655909280000/?tab=statement,Restoring price stability soon is now the Czech National Bank’s absolute priority and is a necessary condition for the long-term prosperity of the Czech economy.,12.0,2022,22/6/2022,12.0,161.0,6082.0
87,https://www.cnb.cz/en/monetary-policy/bank-board-decisions/CNB-Board-decisions-1655909280000/?tab=statement,Future monetary policy steps will depend on incoming new information and future forecasts.,12.0,2022,22/6/2022,12.0,90.0,6082.0
88,https://www.cnb.cz/en/monetary-policy/bank-board-decisions/CNB-Board-decisions-1655909280000/?tab=statement,The Bank Board also decided to keep the CNB’s strategy of current foreign exchange interventions unchanged.,12.0,2022,22/6/2022,12.0,107.0,6082.0
89,https://www.cnb.cz/en/monetary-policy/bank-board-decisions/CNB-Board-decisions-1655909280000/?tab=statement,"The CNB has sufficient international reserves, even by international comparison, to fulfil its monetary policy objectives and other duties.",12.0,2022,22/6/2022,12.0,139.0,6082.0
90,https://www.cnb.cz/en/monetary-policy/bank-board-decisions/CNB-Board-decisions-1651762080000/?tab=statement,"At its meeting today, the Bank Board of the Czech National Bank increased the two-week repo rate to 5.75%, i.e. by 0.75 percentage point.",1.0,2022,5/5/2022,13.0,137.0,9199.0
91,https://www.cnb.cz/en/monetary-policy/bank-board-decisions/CNB-Board-decisions-1651762080000/?tab=statement,"At the same time, it increased the discount rate to 4.75% and the Lombard rate to 6.75%.",1.0,2022,5/5/2022,13.0,88.0,9199.0
92,https://www.cnb.cz/en/monetary-policy/bank-board-decisions/CNB-Board-decisions-1651762080000/?tab=statement,Five members voted in favour of this decision and two members voted for leaving rates unchanged.</,1.0,2022,5/5/2022,13.0,98.0,9199.0
93,https://www.cnb.cz/en/monetary-policy/bank-board-decisions/CNB-Board-decisions-1651762080000/?tab=statement,The decision adopted by the Bank Board is underpinned by a new macroeconomic forecast.,2.0,2022,5/5/2022,13.0,86.0,9199.0
94,https://www.cnb.cz/en/monetary-policy/bank-board-decisions/CNB-Board-decisions-1651762080000/?tab=statement,Consistent with the baseline scenario of the spring forecast is a further sharp rise in market interest rates.,2.0,2022,5/5/2022,13.0,110.0,9199.0
95,https://www.cnb.cz/en/monetary-policy/bank-board-decisions/CNB-Board-decisions-1651762080000/?tab=statement,"In the baseline scenario, the central bank sets interest rates in order to achieve the 2% target at the standard monetary policy horizon.",2.0,2022,5/5/2022,13.0,137.0,9199.0
96,https://www.cnb.cz/en/monetary-policy/bank-board-decisions/CNB-Board-decisions-1651762080000/?tab=statement,"However, the Bank Board decided to tighten monetary policy more moderately.",2.0,2022,5/5/2022,13.0,75.0,9199.0
