,filename,sentence,paragraph_index,year,date,is_table,paragraphs,num_char_sentence,total_chars
342,./Czechia/tk_03sz2011_aj.pdf," The first-round effect on inflation amounts to roughly 1.1;p.p.  the largest  part is due to food prices (0.6,p.p.)  while the rest is due to administered  prices (0.3 p.p.) and adjusted inflation excluding fuels (0.2 ",14,2011,2011/05/05,0,17,219,2659
343,./Czechia/tk_03sz2011_aj.pdf, Monetary policy of the CNB does not respond to the first-round effects of  indirect tax ,15,2011,2011/05/05,0,17,89,2659
345,./Czechia/tk_03sz2011_aj.pdf," In,2012  GDP is roughly 0.4 p.p. lower on average compared to the  baseline ",16,2011,2011/05/05,0,17,77,2659
346,./Czechia/tk_03sz2011_aj.pdf, Lower economic activity is reflected in slightly lower  monetary-policy relevant inflation and consequently in marginally lower  interest ,16,2011,2011/05/05,0,17,139,2659
347,./Czechia/tk_03sz2011_aj.pdf, The exchange rate forecast does not differ noticeably from  the baseline ,16,2011,2011/05/05,0,17,74,2659
348,./Czechia/tk_03sz2011_aj.pdf," 14 Headline inflation in the alternative  scenario of the forecast      II/0  I IV I/1  I I IV I/1  I I IV I/1  I I IV  lte rn  tiv        rio     lin        rio 15 Thank you for your attention More information about the  forecast can be found at :http //www.cnb.cz/en/monetary_policy/forecast/ and in Inflation Report,II/2011  to be published 13 May ",17,2011,2011/05/05,0,17,352,2659
349,./Czechia/tk_04sz2011_aj.pdf, Press conference of the  CNB Bank Board 4th Situation Report on  Economic and Monetary  Developments 23 June 2011 The monetary policy decision taken  and the ratio of the votes cast  At the close of the meeting the Board decided by   majority vote to leave the two-week repo rate unchanged  at ,1,2011,2011/06/23,0,8,295,2194
350,./Czechia/tk_04sz2011_aj.pdf," Five members voted in favour of this,decision  and two  members voted for increasing rates by 0.25 percentage  ",2,2011,2011/06/23,0,8,112,2194
351,./Czechia/tk_04sz2011_aj.pdf,  Reasons for the decision  Headline and monetary-policy relevant inflation will be close to  the inflation target over the monetary policy ,3,2011,2011/06/23,0,8,140,2194
352,./Czechia/tk_04sz2011_aj.pdf, Consistent with the forecast is broad stability of market  interest rates in the near future and  gradual rise in rates  starting in 2011 ,4,2011,2011/06/23,0,8,139,2194
353,./Czechia/tk_04sz2011_aj.pdf, Risks to the forecast are balanced for monetary-policy  relevant ,5,2011,2011/06/23,0,8,66,2194
355,./Czechia/tk_04sz2011_aj.pdf, Its growth was driven mainly by net exports  and to  lesser extent by gross capital;formation   April industrial production indicates  continuing albeit slowing recovery  (4.7%;y-o-y  0.3% in m-o-m s.a.;terms)   Total employment increased in 2011 Q1 in y-o-y terms (by ,6,2011,2011/06/23,0,8,270,2194
356,./Czechia/tk_04sz2011_aj.pdf, The  seasonally adjusted ILO unemployment rate decreased moderately quarter  on quarter and the registered unemployment rate fell in April and;May   Y-o-y nominal wage growth accelerated in 2011 Q1;(2.1%)   High growth in industrial producer prices (6.2% in May) and agricultural  producer prices (31.5% in May) reflects developments in global commodity  ,6,2011,2011/06/23,0,8,356,2194
357,./Czechia/tk_04sz2011_aj.pdf,"  Comparison of actual data  with the CNB forecast 10 forecast 9.0  8.6 actual data      2.8  2.3 2.1 2.0 1.7  1.4   GDP,(Q1  2011) Inflation (May 2011) Average wage   Unemployment,(Q2 ,(Q1 2011) 2011):Note  for,unemployment   comparison of May data with the forecast for the whole quarter  Major risks to the forecast Risks to the forecast are balanced  for monetary-policy relevant ",7,2011,2011/06/23,0,8,384,2194
358,./Czechia/tk_04sz2011_aj.pdf, Major risks on the:upside   higher current inflation  less anti-inflationary domestic economic environment  VAT increase in 2012 is  risk for headline inflation Major risks on the:downside   lower foreign interest rate outlook  debt crisis in some euro area countries  Thank you for your attention Minutes of the today’s  meeting and the Graph of  Risks to the Inflation  Projection (GRIP) will be  released on  July 2011 at :http:,8,2011,2011/06/23,0,8,432,2194
359,./Czechia/tk_08sz2009_aj.pdf," Press Conference of the CNB Bank Board 8th Situation Report on Economic  and Monetary Developments 16th December 2009 The  monetary  policy  decision  taken   and  the  ratio  of  the  votes  cast At the close of the meeting the Board decided by   majority vote to lower the CNB two-week repo rate by  0.25 percentage point to,1%  effective 17 December  ",1,2009,2009/12/16,0,6,355,2068
360,./Czechia/tk_08sz2009_aj.pdf, At the same time it decided to lower Lombard  rate by the same amount to ,1,2009,2009/12/16,0,6,74,2068
362,./Czechia/tk_08sz2009_aj.pdf," Four members voted in favour  of this,decision  and three members voted for leaving  interest rates ",1,2009,2009/12/16,0,6,101,2068
363,./Czechia/tk_08sz2009_aj.pdf, Reasons  for  the  decision  Inflation is close to the inflation target in the monetary-policy ,1,2009,2009/12/16,0,6,96,2068
364,./Czechia/tk_08sz2009_aj.pdf, Consistent with the forecast is  decline in market interest rates this year  followed by  gradual rise in ,2,2009,2009/12/16,0,6,107,2068
365,./Czechia/tk_08sz2009_aj.pdf, New information is generally in line with forecast though some risks that are  slightly on the up side appeared (higher inflation and somewhat weaker  koruna exchange ,3,2009,2009/12/16,0,6,168,2068
366,./Czechia/tk_08sz2009_aj.pdf, Despite slightly pro-inflationary risks the bank board decided in line with the  forecast to cut the interest ,4,2009,2009/12/16,0,6,111,2068
368,./Czechia/tk_08sz2009_aj.pdf, Both  exports (-11.2 %) and imports (-21.1 %) are further markedly;declining   Developments on the labour market correspond to falling economic  ,4,2009,2009/12/16,0,6,146,2068
369,./Czechia/tk_08sz2009_aj.pdf, Employment further declined (-1.9  annually) and registered  unemployment continued to grow moderately in November (8.9 ,4,2009,2009/12/16,0,6,121,2068
370,./Czechia/tk_08sz2009_aj.pdf," Annual growth in nominal wages that increased in Q3 (4.8 %) after its  rapid slowdown in,H1  2009 (3.0  and 3.1 %) is an;exception   November drop in industrial producer prices (-2.4 %) and agricultural  producer prices (-16 %) manifest persisting anti-inflationary effects of  commodities‘ and food ",5,2009,2009/12/16,0,6,301,2068
371,./Czechia/tk_08sz2009_aj.pdf, Comparison  of  actual  data  with the  CNB forecast 10 9.2 8.9 actual data forecast   4.8  2.7  0.5 0.1  -2 -4 -4.1 -4.9 -6 GDP inflation average wage unemployment Major  risks of  the  forecast Risks are moderately on the ,5,2009,2009/12/16,0,6,225,2068
372,./Czechia/tk_08sz2009_aj.pdf," Major risk on the down:side   outlook for the external,developments  especially interest rates Major risks on the up:side   higher November inflation and its outlook for the near future  slightly weaker koruna exchange ",6,2009,2009/12/16,0,6,220,2068
373,./Czechia/TK_07SZ2008_AJ.pdf," Press Conference of the CNB Bank Board 7th Situation Report on Economic  and Monetary Developments  November 2008 The  monetary  policy  decision  taken   and  the  ratio  of  the  votes  cast At the close of the meeting the Board decided by  majority  vote to decrease the CNB two-week repo rate by 0.75  percentage point to,2.75%  effective  November ",1,2008,2008/11/06,0,7,354,1642
374,./Czechia/TK_07SZ2008_AJ.pdf," Four members voted in favour of this,decision  one member voted for decreasing rate by 0.50 percentage ",1,2008,2008/11/06,0,7,104,1642
375,./Czechia/TK_07SZ2008_AJ.pdf," At the same  time it decided to decrease the discount rate and Lombard  rate by the same,amount  to 1.75% and 3.75% ",1,2008,2008/11/06,0,7,117,1642
378,./Czechia/TK_07SZ2008_AJ.pdf," Compared to the previous,forecast  the forecast for both headline and  monetary-policy relevant inflation is ",2,2008,2008/11/06,0,7,110,1642
379,./Czechia/TK_07SZ2008_AJ.pdf, At the monetary policy  horizon monetary-policy relevant inflation is the same as headline  ,2,2008,2008/11/06,0,7,93,1642
380,./Czechia/TK_07SZ2008_AJ.pdf," Compared to the previous,forecast  the interest rate path lies ",3,2008,2008/11/06,0,7,64,1642
383,./Czechia/TK_07SZ2008_AJ.pdf," Change  in  the  communication  of   the  CNB  forecast  Starting from the first forecast in 2009 the CNB will publish its  forecast for nominal exchange rate CZK/EUR in numerical,form  as   fan ",4,2008,2008/11/06,0,7,196,1642
384,./Czechia/TK_07SZ2008_AJ.pdf, The decision follows from the CNB positive experience of   publishing the forecast-consistent interest rate ,5,2008,2008/11/06,0,7,109,1642
385,./Czechia/TK_07SZ2008_AJ.pdf, The disclosure of the CZK/EUR exchange rate forecast in numerical  form will mean that full transparency of the CNB forecast will be  ,6,2008,2008/11/06,0,7,135,1642
386,./Czechia/TK_07SZ2008_AJ.pdf, The CNB will become the only central bank in the world to  publish  forecast for an exchange rate vis-à-vis  specific currency ,6,2008,2008/11/06,0,7,128,1642
387,./Czechia/TK_07SZ2008_AJ.pdf," Similarly to the forecast of other,variables  the exchange rate outlook is conditional on forecast assumptions and information available at  the time when the forecast is drawn ",7,2008,2008/11/06,0,7,178,1642
388,./Czechia/tk_07sz2013_aj.pdf, Press conference of the CNB Bank Board 7th Situation Report on  Economic and Monetary  Developments  November 2013 The monetary policy decision and  the stance of the CNB  At the close of the meeting the Board decided unanimously to leave  the two-week repo rate unchanged at ,1,2013,2013/11/07,0,20,277,4002
389,./Czechia/tk_07sz2013_aj.pdf, Interest rates will remain at current levels (i.e. at technical zero) over   longer horizon until inflation pressures increase ,2,2013,2013/11/07,0,20,128,4002
390,./Czechia/tk_07sz2013_aj.pdf, The  existing forecast does not predict such an increase in inflation pressures and no tangible risk in this direction can be identified  ,2,2013,2013/11/07,0,20,139,4002
391,./Czechia/tk_07sz2013_aj.pdf, The Board also decided to start using the exchange rate as an  additional instrument for easing the monetary ,3,2013,2013/11/07,0,20,110,4002
392,./Czechia/tk_07sz2013_aj.pdf, The CNB  will intervene on the FX market to weaken the koruna so that the exchange rate of the koruna against the euro is close to  CZK ,3,2013,2013/11/07,0,20,137,4002
393,./Czechia/tk_07sz2013_aj.pdf," 2 Reasons for the decision within  the context of the forecast  Consistent with the forecast is  significant decline in market interest rates  well below,zero  followed by  rise in rates above the current levels only at  the end of ",4,2013,2013/11/07,0,20,233,4002
394,./Czechia/tk_07sz2013_aj.pdf," Given the zero lower bound on interest,rates  this points to  significant need  to ease monetary policy using other ",5,2013,2013/11/07,0,20,117,4002
395,./Czechia/tk_07sz2013_aj.pdf, An alternative scenario quantifying the use of the exchange rate of the  koruna confirms that  sustained weakening of the exchange rate is an  effective instrument for accelerating the return of inflation towards the ,6,2013,2013/11/07,0,20,218,4002
396,./Czechia/tk_07sz2013_aj.pdf, 3 The exchange rate as an additional  monetary policy instrument  So far the CNB has used its standard instruments to ease the  monetary ,7,2013,2013/11/07,0,20,138,4002
397,./Czechia/tk_07sz2013_aj.pdf," The key monetary policy rate was lowered ,gradually  reaching the technical zero bound in autumn ",7,2013,2013/11/07,0,20,98,4002
398,./Czechia/tk_07sz2013_aj.pdf," In order to avoid long-term undershooting of the inflation target and  to speed up the return to the situation in which it will be able to use  its standard,instrument  i.e. interest,rates  the CNB has started to  use the exchange rate as an additional monetary policy ",8,2013,2013/11/07,0,20,270,4002
399,./Czechia/tk_07sz2013_aj.pdf, The CNB is resolved to intervene on the FX market in such volumes  and for such duration as needed to reach the desired exchange rate  level with the aim of hitting its inflation target in the ,9,2013,2013/11/07,0,20,194,4002
400,./Czechia/tk_07sz2013_aj.pdf," The baseline versus alternative  scenario of the forecast  Consistent with the baseline scenario of the forecast is   decline in market interest,rates  which cannot occur in,practice   pointing to  need to use  different monetary policy  ",9,2013,2013/11/07,0,20,239,4002
401,./Czechia/tk_07sz2013_aj.pdf," As  result of the Bank Board’s decision to start using the  exchange,rate  the alternative scenario becomes the most  probable description of expected future economic  ",10,2013,2013/11/07,0,20,169,4002
402,./Czechia/tk_07sz2013_aj.pdf, The following slides describe first the baseline scenario and  then the alternative ,11,2013,2013/11/07,0,20,85,4002
403,./Czechia/tk_07sz2013_aj.pdf," The message of the forecast  (baseline scenario with negative rates)  Food prices and administered prices together with tax changes continue to be the source  of current,inflation  but their contribution is ",11,2013,2013/11/07,0,20,208,4002
405,./Czechia/tk_07sz2013_aj.pdf, At the beginning of 2014 inflation will fall to zero due to an unwinding of the effects of  VAT changes and  drop in administered ,12,2013,2013/11/07,0,20,131,4002
406,./Czechia/tk_07sz2013_aj.pdf, In the following period inflation will grow  again towards the ,12,2013,2013/11/07,0,20,64,4002
408,./Czechia/tk_07sz2013_aj.pdf,",However   gradual recovery has already been  observed since 2013 Q2. Next,year  the economy will grow by 1.5% and  the growth will  accelerate to 3% in ",13,2013,2013/11/07,0,20,153,4002
410,./Czechia/tk_07sz2013_aj.pdf, At the longer end of the  forecast it will appreciate only very ,14,2013,2013/11/07,0,20,65,4002
411,./Czechia/tk_07sz2013_aj.pdf," Consistent with the forecast is  significant decline in market interest rates well below ,zero  followed by  rise in rates above the current levels only at the end of ",15,2013,2013/11/07,0,20,168,4002
414,./Czechia/tk_07sz2013_aj.pdf," In the alternative,scenario  the exchange rate takes over the  stabilising role of monetary ",18,2013,2013/11/07,0,20,93,4002
415,./Czechia/tk_07sz2013_aj.pdf, The CNB will intervene on the  foreign exchange market to weaken the koruna so that the  exchange rate of the koruna against the euro is close to  CZK ,18,2013,2013/11/07,0,20,152,4002
416,./Czechia/tk_07sz2013_aj.pdf, This facilitates an earlier return of headline and monetary-policy  relevant inflation to the 2% target compared to the baseline  scenario even with interest rates being at the zero lower ,19,2013,2013/11/07,0,20,189,4002
417,./Czechia/tk_07sz2013_aj.pdf," At  shorter,horizon  GDP growth recovers more quickly  compared to the baseline ",20,2013,2013/11/07,0,20,81,4002
419,./Czechia/tk_08sz2012_aj.pdf, Press conference of the  CNB Bank Board 8th Situation Report on  Economic and Monetary  Developments 19 December 2012 The monetary policy decision taken  and the ratio of the votes cast   At the close of the meeting the Board decided  unanimously to leave the two-week repo rate unchanged  at ,1,2012,2012/12/19,0,12,294,2195
420,./Czechia/tk_08sz2012_aj.pdf,"  Reasons for the decision   Next,year  headline inflation will be slightly above the CNB’s inflation  target owing to tax,changes  whereas monetary-policy relevant  inflation will be in the lower half of the tolerance band over the whole  forecast horizon including the monetary policy ",2,2012,2012/12/19,0,12,287,2195
421,./Czechia/tk_08sz2012_aj.pdf," Consistent with the forecast is  decline in market interest,rates   followed by  rise in rates in ",3,2012,2012/12/19,0,12,99,2195
422,./Czechia/tk_08sz2012_aj.pdf, The overall risks to the inflation forecast are slightly on the ,4,2012,2012/12/19,0,12,65,2195
424,./Czechia/tk_08sz2012_aj.pdf," Developments in industrial,production  construction output and retail sales  in October continue to indicate subdued economic ",5,2012,2012/12/19,0,12,127,2195
425,./Czechia/tk_08sz2012_aj.pdf," The labour market exhibits signs of:slump    Total employment saw y-o-y growth in 2012,Q3  but it declined when converted to full-  time ",6,2012,2012/12/19,0,12,138,2195
426,./Czechia/tk_08sz2012_aj.pdf, Unemployment continued to rise in terms of both the s.a. general unemployment rate in  Q3 and the s.a. registered unemployment rate in October and ,7,2012,2012/12/19,0,12,148,2195
427,./Czechia/tk_08sz2012_aj.pdf, Y-o-y growth in the average nominal wage again decelerated markedly in 2012 ,8,2012,2012/12/19,0,12,77,2195
428,./Czechia/tk_08sz2012_aj.pdf, The inflationary effects of external cost-push factors weakened  somewhat due to slightly lower oil ,9,2012,2012/12/19,0,12,101,2195
429,./Czechia/tk_08sz2012_aj.pdf,"  Comparison of actual data  with the CNB forecast 10 9.0 9.1 forecast actual data    3.0 2.7 2.4  1.4  -0.8 -1.3 -2 GDP,(Q3  2012) Inflation (November Average wage   Unemployment,(Q4  2012),(Q3 2012) 2012):Note  in,percentages  for unemployment comparison of expected outcome with forecast for the respective quarter   Major risks to the forecast The overall risks to the inflation forecast are slightly on the  ",10,2012,2012/12/19,0,12,413,2195
430,./Czechia/tk_08sz2012_aj.pdf, Risks on the:downside    weaker domestic economic activity and slower wage growth   domestic price developments   developments abroad  Risks on the:upside    currently higher agricultural commodity prices The koruna exchange rate partially offsets anti-inflationary domestic  ,11,2012,2012/12/19,0,12,277,2195
431,./Czechia/tk_08sz2012_aj.pdf,  Thank you for your attention Minutes of the today’s meeting and  the Graph of Risks to the Inflation  Projection (GRIP) will be released  on 31 December 2012 at :http:,12,2012,2012/12/19,0,12,169,2195
436,./Czechia/tk_06sz2011_aj.pdf, Press conference of the  CNB Bank Board 6th Situation Report on  Economic and Monetary  Developments 2 September 2011 The monetary policy decision taken  and the ratio of the votes cast  At the close of the meeting the Board decided  unanimously to leave the two-week repo rate unchanged  at ,1,2011,2011/09/22,0,12,293,2220
437,./Czechia/tk_06sz2011_aj.pdf,  Reasons for the decision  Monetary-policy relevant inflation will be close to the inflation  target over the entire forecast ,2,2011,2011/09/22,0,12,127,2220
438,./Czechia/tk_06sz2011_aj.pdf, Headline inflation will be temporarily slightly above 3% due to  VAT ,2,2011,2011/09/22,0,12,70,2220
439,./Czechia/tk_06sz2011_aj.pdf, Consistent with the forecast is broad stability of market  interest rates at the start of the forecast horizon and  gradual  rise in rates starting in late 2011/early ,3,2011,2011/09/22,0,12,168,2220
440,./Czechia/tk_06sz2011_aj.pdf, The risks to the forecast are slightly on the downside for  inflation and substantially on the downside for interest ,4,2011,2011/09/22,0,12,118,2220
443,./Czechia/tk_06sz2011_aj.pdf, July industrial production (4.4%;y-o-y  0.1% m-o-m) indicates slowing ,6,2011,2011/09/22,0,12,71,2220
445,./Czechia/tk_06sz2011_aj.pdf, The  seasonally adjusted ILO unemployment rate was flat at 7% in q-o-q ,7,2011,2011/09/22,0,12,72,2220
446,./Czechia/tk_06sz2011_aj.pdf, The seasonally adjusted registered unemployment rate slightly decreased in  July and ,8,2011,2011/09/22,0,12,86,2220
448,./Czechia/tk_06sz2011_aj.pdf,",Decelerating  albeit still,high  growth in industrial producer prices (5.7%) and  agricultural producer prices (16.4%) in August mainly reflects the gradually  fading effects of the recent surge in global commodity ",10,2011,2011/09/22,0,12,216,2220
449,./Czechia/tk_06sz2011_aj.pdf,"  Comparison of actual data  with the CNB forecast  8.4 8.4 forecast  actual data      2.5 2.5 2.2 2.1 2.0  1.7   GDP,(Q2  2011) Inflation (August 2011) Average wage   Unemployment,(Q3 ,(Q2 2011) 2011):Note  for,unemployment  comparison of August data with the forecast for the whole quarter  Major risks to the forecast The risks to the forecast are slightly on the downside for  inflation and substantially on the downside for interest  ",11,2011,2011/09/22,0,12,439,2220
450,./Czechia/tk_06sz2011_aj.pdf, Major risk on the:upside   weaker koruna exchange rate Major risk on the downside (for interest:rates)   lower foreign interest rates outlook  condition of the financial sector and public finances in developed  countries  Thank you for your attention Minutes of the today’s meeting and  the Graph of Risks to the Inflation  Projection (GRIP) will be released  on 30 September 2011 at :http:,12,2011,2011/09/22,0,12,391,2220
451,./Czechia/tk_01sz2011_aj.pdf, Press conference of the CNB Bank Board 1st Situation Report on  Economic and Monetary  Developments  February 2011 The monetary policy decision taken and the ratio of the votes cast  At the close of the meeting the Bank Board decided by   majority vote to leave the two-week repo rate unchanged  at ,1,2011,2011/02/03,0,10,300,1565
452,./Czechia/tk_01sz2011_aj.pdf," Four board members voted in favour of this,decision  and  three members voted for increasing rates by 0.25  percentage ",2,2011,2011/02/03,0,10,120,1565
453,./Czechia/tk_01sz2011_aj.pdf,  Reasons for the decision   Headline and monetary-policy relevant inflation will be close  to the inflation target over the monetary policy ,3,2011,2011/02/03,0,10,141,1565
454,./Czechia/tk_01sz2011_aj.pdf," Consistent with the forecast is stability of market interest  rates close to their current levels,initially  followed by   gradual rise in rates as from the end of ",4,2011,2011/02/03,0,10,165,1565
455,./Czechia/tk_01sz2011_aj.pdf," Risks to the forecast are significant in both,directions   associated with external,developments  and balanced  ",5,2011,2011/02/03,0,10,113,1565
456,./Czechia/tk_01sz2011_aj.pdf,  The message of the forecast  Headline inflation is currently close to the inflation target and will remain  at this level over the entire ,6,2011,2011/02/03,0,10,140,1565
457,./Czechia/tk_01sz2011_aj.pdf, Monetary-policy relevant inflation will grow at the beginning of this;year   thereafter it will be close to the target together with headline ,7,2011,2011/02/03,0,10,143,1565
458,./Czechia/tk_01sz2011_aj.pdf," Economic growth will slow this year due to fiscal,restriction  fading  investment in solar power stations and,re-stocking  and  slowdown in  external ",8,2011,2011/02/03,0,10,151,1565
460,./Czechia/tk_01sz2011_aj.pdf, The nominal exchange rate is gradually appreciating over the forecast  ,9,2011,2011/02/03,0,10,72,1565
461,./Czechia/tk_01sz2011_aj.pdf," Consistent with the forecast is stability of market interest rates close to  their current levels,initially  followed by  gradual rise in rates as from  the end of ",10,2011,2011/02/03,0,10,165,1565
464,./Czechia/TK_05SZ2008_AJ.pdf," Press Conference of the CNB Bank Board 5th Situation Report on Economic  and Monetary Developments  August 2008 The  monetary  policy  decision  taken   and  the  ratio  of  the  votes  cast At the close of the meeting the Board decided  unanimously to decrease the CNB two-week repo rate by 0.25 percentage point to,3.50%  effective  August ",1,2008,2008/08/07,0,4,343,796
465,./Czechia/TK_05SZ2008_AJ.pdf," At the same time it decided to  decrease the discount rate and Lombard rate by the  same,amount  to 2.50% and 4.50% ",1,2008,2008/08/07,0,4,117,796
468,./Czechia/TK_05SZ2008_AJ.pdf," Compared to the previous,forecast  the rate of economic growth is  lower in both 2008 and ",2,2008,2008/08/07,0,4,91,796
469,./Czechia/TK_05SZ2008_AJ.pdf," Compared to the previous,forecast  the forecast for both headline and  monetary-policy relevant inflation is ",3,2008,2008/08/07,0,4,110,796
470,./Czechia/TK_05SZ2008_AJ.pdf," Compared to the previous,forecast  the interest rate path is falling  less ",4,2008,2008/08/07,0,4,76,796
473,./Czechia/tk_01sz2013_aj.pdf, Press conference of the  CNB Bank Board 1st Situation Report on  Economic and Monetary  Developments  February 2013 The monetary policy decision taken  and the ratio of the votes cast   At the close of the meeting the Board decided  unanimously to leave the two-week repo rate unchanged  at ,1,2013,2013/02/06,0,13,292,1751
474,./Czechia/tk_01sz2013_aj.pdf,  Reasons for the decision   Headline inflation will be close to the 2% target this ,2,2013,2013/02/06,0,13,84,1751
475,./Czechia/tk_01sz2013_aj.pdf," In early ,2014  after the effects of the increase in both VAT rates of  ",2,2013,2013/02/06,0,13,73,1751
477,./Czechia/tk_01sz2013_aj.pdf, Monetary-policy relevant inflation will be in the lower half of the  tolerance band over the entire ,4,2013,2013/02/06,0,13,101,1751
478,./Czechia/tk_01sz2013_aj.pdf," Consistent with the forecast is  slight decline in market interest ,rates  followed by  rise in rates as from ",5,2013,2013/02/06,0,13,111,1751
480,./Czechia/tk_01sz2013_aj.pdf,"  The message of the forecast  baseline scenario   Tax,changes  food price growth and gradually fading import price growth are the  sources of currently observed ",7,2013,2013/02/06,0,13,162,1751
482,./Czechia/tk_01sz2013_aj.pdf, Headline inflation will be close to the CNB’s 2% target this year despite the increase  in both VAT rates of  ,8,2013,2013/02/06,0,13,111,1751
483,./Czechia/tk_01sz2013_aj.pdf, Monetary-policy relevant inflation will be in the lower half  of the tolerance band around the target over the whole forecast ,8,2013,2013/02/06,0,13,127,1751
484,./Czechia/tk_01sz2013_aj.pdf," This,year  GDP will drop by 0.3% amid markedly restrictive domestic fiscal policy and  only gradual recovery in external ",9,2013,2013/02/06,0,13,122,1751
486,./Czechia/tk_01sz2013_aj.pdf, The koruna exchange rate to the euro will appreciate very slightly from current ,10,2013,2013/02/06,0,13,81,1751
