,filename,sentence,paragraph_index,year,date,is_table,paragraphs,num_char_sentence,total_chars
177,./Czechia/tk_06sz2012_aj.pdf, Risks on the:downside   stronger koruna exchange rate  weaker domestic economic activity and slower wage growth  domestic price developments Risk on the:upside   higher world prices of energy and agricultural commodities  Thank you for your attention Minutes of the today’s meeting and  the Graph of Risks to the Inflation  Projection (GRIP) will be released  on  October 2012 at :http:,14,2012,2012/09/27,0,14,387,2333
180,./Czechia/tk_01sz2012_aj.pdf, Press conference of the  CNB Bank Board 1st Situation Report on  Economic and Monetary  Developments  February 2012 The monetary policy decision taken  and the ratio of the votes cast   At the close of the meeting the Board decided  unanimously to leave the two-week repo rate unchanged  at ,1,2012,2012/02/02,0,14,292,2095
182,./Czechia/tk_01sz2012_aj.pdf, Vice-Governor Mojmír Hampl did not attend the meeting  and did not take part in the ,3,2012,2012/02/02,0,14,85,2095
183,./Czechia/tk_01sz2012_aj.pdf,  Reasons for the decision   Monetary-policy relevant inflation will be close to the target over  the entire forecast ,4,2012,2012/02/02,0,14,118,2095
184,./Czechia/tk_01sz2012_aj.pdf," Headline inflation will rise  temporarily to just above 3% in 2012 owing to  VAT,increase   but will fall back below the target at the start of ",4,2012,2012/02/02,0,14,145,2095
185,./Czechia/tk_01sz2012_aj.pdf, Consistent with the forecast is stability of market interest rates  in the near future and  modest decline ,5,2012,2012/02/02,0,14,108,2095
187,./Czechia/tk_01sz2012_aj.pdf,  The message of the forecast  baseline scenario   Domestic factors (weak domestic demand and moderate wage growth) are currently  curbing ,7,2012,2012/02/02,0,14,139,2095
188,./Czechia/tk_01sz2012_aj.pdf, Food prices and the gradual pass-through of the depreciated  exchange rate to prices are the main sources of ,7,2012,2012/02/02,0,14,110,2095
189,./Czechia/tk_01sz2012_aj.pdf," Headline inflation will rise temporarily to just above 3% in 2012 owing to  VAT ,increase  but will fall back below the target at the start of ",8,2012,2012/02/02,0,14,144,2095
190,./Czechia/tk_01sz2012_aj.pdf, Monetary-policy relevant inflation will be close to the target over the entire forecast  ,9,2012,2012/02/02,0,14,90,2095
191,./Czechia/tk_01sz2012_aj.pdf, The Czech economy will stagnate this year as  result of marked slowdown in  external demand and continuing domestic fiscal ,10,2012,2012/02/02,0,14,124,2095
192,./Czechia/tk_01sz2012_aj.pdf," Next,year  in  connection with an external demand,recovery  GDP growth will reach ",10,2012,2012/02/02,0,14,83,2095
193,./Czechia/tk_01sz2012_aj.pdf," In the,forecast  the nominal exchange rate is gradually appreciating from its currently  weakened ",11,2012,2012/02/02,0,14,99,2095
194,./Czechia/tk_01sz2012_aj.pdf, Consistent with the forecast is stability of market interest rates in the near future and   modest decline ,12,2012,2012/02/02,0,14,108,2095
196,./Czechia/tk_01sz2012_aj.pdf," Downside:risks    additional fiscal consolidation measures Upside:risks    faster growth in food prices Two-sided:risks    economic developments abroad   koruna exchange rate 13 Thank you for your attention More information about the forecast  can be found at :http //www.cnb.cz/en/monetary_policy/forecast/ and in Inflation Report,I/2012   to be published 10 February ",14,2012,2012/02/02,0,14,370,2095
197,./Czechia/TK_10SZ2007_AJ.pdf," Press Conference of the CNB Bank Board 10th Situation Report on Economic  and Monetary Developments 25 October 2007 The  monetary  policy  decision  taken   and  the  ratio  of  the  votes  cast After discussing the situation,report  the Board decided by   majority vote to leave the CNB two-week repo rate  unchanged at ",1,2007,2007/10/25,0,5,322,1483
198,./Czechia/TK_10SZ2007_AJ.pdf, Five members voted in favour of this  decision and two members voted for increasing rates by 0.25  of  percentage ,1,2007,2007/10/25,0,5,115,1483
200,./Czechia/TK_10SZ2007_AJ.pdf," Comparison  with  the  July forecast  Compared to the July,forecast  the rate of growth is lower in ",1,2007,2007/10/25,0,5,101,1483
202,./Czechia/TK_10SZ2007_AJ.pdf," Unlike in the July,forecast  the effect of the real economy will be  slightly anti-inflationary in ",2,2007,2007/10/25,0,5,100,1483
203,./Czechia/TK_10SZ2007_AJ.pdf," At the end of,2009 ,however  it will be  modestly inflationary ",2,2007,2007/10/25,0,5,64,1483
204,./Czechia/TK_10SZ2007_AJ.pdf," Compared to the July,forecast  inflation is substantially higher in 2008  due to one-off factors  primarily increases in administered prices and  tax ",3,2007,2007/10/25,0,5,151,1483
205,./Czechia/TK_10SZ2007_AJ.pdf," At the monetary policy horizon (2008 4Q  2009,Q1)   inflation lies initially above the upper boundary of the tolerance band  for the inflation,target  falling into the upper part of the band ",3,2007,2007/10/25,0,5,192,1483
206,./Czechia/TK_10SZ2007_AJ.pdf," Monetary-policy relevant inflation (i.e. inflation adjusted for the first- round effects of changes in indirect taxes),is  on the,contrary  below the  July forecast and slightly above the inflation ",4,2007,2007/10/25,0,5,199,1483
208,./Czechia/TK_10SZ2007_AJ.pdf, Major risks and:uncertainties   second-round impacts of tax changes  faster growth in food prices  stronger CZK/EUR exchange rate  slower economic growth abroad (relative to existing ,5,2007,2007/10/25,0,5,184,1483
212,./Czechia/tk_04sz2013_aj.pdf, Press conference of the  CNB Bank Board 4th Situation Report on  Economic and Monetary  Developments 27 June 2013 The monetary policy decision and  the stance of the CNB   At the close of the meeting the Board decided unanimously to  leave the two-week repo rate unchanged at ,1,2013,2013/06/27,0,13,277,2578
213,./Czechia/tk_04sz2013_aj.pdf, Interest rates will remain at current levels (i.e. at technical zero)  over  longer horizon until inflation pressures increase  ,2,2013,2013/06/27,0,13,129,2578
214,./Czechia/tk_04sz2013_aj.pdf, The CNB is ready to use foreign exchange interventions if  further monetary policy easing becomes ,3,2013,2013/06/27,0,13,99,2578
216,./Czechia/tk_04sz2013_aj.pdf,"  Reasons for the decision within  the context of the forecast   Consistent with the forecast is  slight decline in market interest ,rates  followed by  rise in rates in ",4,2013,2013/06/27,0,13,170,2578
217,./Czechia/tk_04sz2013_aj.pdf, The current Inflation Report II/2013 forecast does not predict an  increase in inflation pressures and no tangible risks of such an  increase in inflation pressures can be identified ,5,2013,2013/06/27,0,13,184,2578
218,./Czechia/tk_04sz2013_aj.pdf," The overall risks to the inflation forecast are on the,downside   respectively tilted towards the need for easier monetary conditions in  comparison with the ",6,2013,2013/06/27,0,13,159,2578
220,./Czechia/tk_04sz2013_aj.pdf," Developments in industrial,production  construction output and retail sales  excluding the automotive segment in April continue to indicate subdued economic  ",8,2013,2013/06/27,0,13,159,2578
221,./Czechia/tk_04sz2013_aj.pdf," On the,contrary  there are some signs of economic recovery (growth in  exports and export,orders  developments of some GDP,components  and  further  increase in consumer ",8,2013,2013/06/27,0,13,171,2578
222,./Czechia/tk_04sz2013_aj.pdf, Labour market broadly stagnated in 2013:Q1   Total employment saw  surprising y-o-y ,9,2013,2013/06/27,0,13,85,2578
225,./Czechia/tk_04sz2013_aj.pdf, The latter two indicators have exhibited only marginal  changes so far during ,9,2013,2013/06/27,0,13,79,2578
226,./Czechia/tk_04sz2013_aj.pdf," Y-o-y growth in the average nominal wage in the business sector was negative in 2013,Q1  which  was influenced by tax ",10,2013,2013/06/27,0,13,119,2578
228,./Czechia/tk_04sz2013_aj.pdf, Cost-push pressures (though weakening) are apparent from agricultural producer  prices ,11,2013,2013/06/27,0,13,88,2578
229,./Czechia/tk_04sz2013_aj.pdf,"  Comparison of actual data  with the CNB forecast  7.6 7.7 forecast actual data    1.6 1.3 0.1  -0.4 -2 -1.5 -2.2 -4 GDP,(Q1 2013)  Inflation (May 2013)  Average wage,(Q1 2013)  Share of unemployed persons,(Q2 2013) :Note  in,percentages  for share of unemployed persons comparison of s.a. outcomes in April and May with  forecast for the,Q2  2013   Risks to the forecast The risks to the forecast are tilted towards the need for  easier monetary conditions in comparison  with the ",12,2013,2013/06/27,0,13,483,2578
230,./Czechia/tk_04sz2013_aj.pdf, Risk in the above-mentioned:direction    lower domestic inflation  Thank you for your attention Minutes of the today’s meeting and  the Graph of Risks to the Inflation  Projection (GRIP) will be released  on  July 2013 at :http:,13,2013,2013/06/27,0,13,229,2578
231,./Czechia/tk_03sz2013_aj.pdf, Press conference of the  CNB Bank Board 3rd Situation Report on  Economic and Monetary  Developments  May 2013 The monetary policy decision and  the stance of the CNB   At the close of the meeting the Board decided unanimously to  leave the two-week repo rate unchanged at ,1,2013,2013/05/02,0,13,274,1955
232,./Czechia/tk_03sz2013_aj.pdf, Interest rates will remain at current levels (i.e. at technical zero)  over  longer horizon until inflation pressures increase  ,2,2013,2013/05/02,0,13,129,1955
233,./Czechia/tk_03sz2013_aj.pdf, The CNB is ready to use foreign exchange interventions if  further monetary policy easing becomes ,3,2013,2013/05/02,0,13,99,1955
234,./Czechia/tk_03sz2013_aj.pdf," 2 Reasons for the decision within  the context of the forecast   Consistent with the forecast is  slight decline in market interest ,rates  followed by  rise in rates in ",4,2013,2013/05/02,0,13,171,1955
235,./Czechia/tk_03sz2013_aj.pdf, The new forecast does not predict an increase in inflation pressures  and no tangible risks of such an increase in inflation pressures can  be identified ,5,2013,2013/05/02,0,13,155,1955
237,./Czechia/tk_03sz2013_aj.pdf, 3 The message of the forecast   Tax changes and growth in administered prices are again the sources of current  ,7,2013,2013/05/02,0,13,113,1955
239,./Czechia/tk_03sz2013_aj.pdf, Headline inflation will be slightly below the CNB’s 2% target this year and next  ,8,2013,2013/05/02,0,13,83,1955
240,./Czechia/tk_03sz2013_aj.pdf, Monetary-policy relevant inflation will be close to the lower boundary of the  tolerance band this year and then return slowly to the ,8,2013,2013/05/02,0,13,135,1955
241,./Czechia/tk_03sz2013_aj.pdf," This,year  GDP will drop by 0.5% amid ongoing fiscal consolidation and an only  gradual recovery in external ",9,2013,2013/05/02,0,13,110,1955
243,./Czechia/tk_03sz2013_aj.pdf, The exchange rate of the koruna against the euro will appreciate very slowly from   weak initial ,10,2013,2013/05/02,0,13,98,1955
244,./Czechia/tk_03sz2013_aj.pdf," Consistent with the forecast is  slight decline in market interest,rates  followed by   rise in rates in ",11,2013,2013/05/02,0,13,106,1955
246,./Czechia/tk_03sz2013_aj.pdf," Risks on the:downside    outlook for foreign variables ,EURIBOR  oil prices   domestic economic developments   increased competition in some oligopolistic industries 13 Thank you for your attention More information about the forecast  can be found at :http //www.cnb.cz/en/monetary_policy/forecast/ and in Inflation Report,II/2013   to be published 10 May ",13,2013,2013/05/02,0,13,357,1955
252,./Czechia/tk_05sz2011_aj.pdf, Press conference of the CNB Bank Board 5th Situation Report on  Economic and Monetary  Developments  August 2011 The monetary policy decision taken and the ratio of the votes cast  At the close of the meeting the Bank Board decided by   majority vote to leave the two-week repo rate unchanged  at ,1,2011,2011/08/04,0,13,298,2034
253,./Czechia/tk_05sz2011_aj.pdf," Five members voted in favour of this,decision  and two  members voted for increasing rates by 0.25 percentage  ",2,2011,2011/08/04,0,13,112,2034
254,./Czechia/tk_05sz2011_aj.pdf,  Reasons for the decision   Monetary-policy relevant inflation will be close to the  inflation target over the entire forecast ,3,2011,2011/08/04,0,13,128,2034
255,./Czechia/tk_05sz2011_aj.pdf, Headline  inflation will be temporarily slightly above 3% due to  VAT  ,3,2011,2011/08/04,0,13,72,2034
256,./Czechia/tk_05sz2011_aj.pdf, Consistent with the forecast is broad stability of market  interest rates at the start of the forecast horizon and   gradual rise in rates starting in late 2011/early ,4,2011,2011/08/04,0,13,168,2034
257,./Czechia/tk_05sz2011_aj.pdf, The  rates do not react to the first-round effects of the VAT  ,4,2011,2011/08/04,0,13,64,2034
259,./Czechia/tk_05sz2011_aj.pdf,"  The message of the forecast  Inflation pressures from the domestic economy are currently not,significant   commodity prices and food prices are the main source of ",6,2011,2011/08/04,0,13,165,2034
260,./Czechia/tk_05sz2011_aj.pdf," Headline inflation will be just above 3% in 2012 owing to the VAT,increase  but will  return to the target at the start of ",7,2011,2011/08/04,0,13,124,2034
261,./Czechia/tk_05sz2011_aj.pdf, Monetary-policy relevant inflation will be close to the target over the entire forecast  horizon (low second-round effects of the VAT changes are ,8,2011,2011/08/04,0,13,147,2034
262,./Czechia/tk_05sz2011_aj.pdf," Economic growth in the Czech Republic will slow this year due to fiscal,consolidation   slower growth in external demand and fading investment in ",9,2011,2011/08/04,0,13,147,2034
264,./Czechia/tk_05sz2011_aj.pdf, The nominal exchange rate is gradually appreciating over the forecast ,10,2011,2011/08/04,0,13,71,2034
265,./Czechia/tk_05sz2011_aj.pdf, Consistent with the forecast is broad stability of market interest rates at the start of  the forecast horizon and  gradual rise in rates starting in late 2011/early ,11,2011,2011/08/04,0,13,167,2034
267,./Czechia/tk_05sz2011_aj.pdf," Downside:risk   lower foreign interest rates Upside:risk   weaker koruna exchange rate 13 Thank you for your attention More information about the  forecast can be found at :http //www.cnb.cz/en/monetary_policy/forecast/ and in Inflation Report,III/2011  to be published 12 August ",13,2011,2011/08/04,0,13,281,2034
268,./Czechia/tk_02sz2011_aj.pdf, Press conference of the  CNB Bank Board 2nd Situation Report on  Economic and Monetary  Developments 24 March 2011 The monetary policy decision taken  and the ratio of the votes cast  At the close of the meeting the Bank Board decided by   majority vote to leave the two-week repo rate unchanged  at ,1,2011,2011/03/24,0,7,301,1607
269,./Czechia/tk_02sz2011_aj.pdf, Five board members voted in favour of this decision and  one member voted for increasing interest rates by 0.25  percentage ,2,2011,2011/03/24,0,7,125,1607
270,./Czechia/tk_02sz2011_aj.pdf,"  Reasons for the decision  According to the,forecast  headline and monetary-policy  relevant inflation will be close to the inflation target over the  monetary policy ",3,2011,2011/03/24,0,7,168,1607
271,./Czechia/tk_02sz2011_aj.pdf," Consistent with the forecast is stability of market interest rates  close to their current levels,initially  followed by  gradual rise  in rates as from the end of ",4,2011,2011/03/24,0,7,165,1607
272,./Czechia/tk_02sz2011_aj.pdf, Risks to the forecast are on the upside for headline inflation (due to VAT increase in 2012) and roughly balanced for  monetary-policy relevant ,5,2011,2011/03/24,0,7,145,1607
274,./Czechia/tk_02sz2011_aj.pdf," Its growth was driven mainly by investment in  inventories and to  lesser extent by net;exports   January industrial production indicates  continuing recovery (16.9%;y-o-y   3.4% in,m-o-m  s.a.;terms)   The situation on the labour market has ",6,2011,2011/03/24,0,7,243,1607
275,./Czechia/tk_02sz2011_aj.pdf," Total employment   declined  in Q4 (-0.2%,y-o-y)  ILO unemployment fell slightly ",6,2011,2011/03/24,0,7,82,1607
277,./Czechia/tk_02sz2011_aj.pdf, Major risks on the:upside   higher world commodity prices and foreign interest rate outlook  VAT increase in 2012 and impact on inflation expectations Major risks on the:downside   weaker inflationary pressures from domestic economy  slightly stronger koruna exchange rate  Thank you for your attention Minutes of the today’s  meeting will be released on   April 2011 at :http:,7,2011,2011/03/24,0,7,378,1607
282,./Czechia/TK_01SZ2007_EN.pdf," Press Conference of the CNB  Bank Board 1st Situation Report on Economic  and Monetary Developments 25 January 2007 The monetary policy decision taken  and the ratio of the votes cast At the close of the,meeting  the Board decided to  leave the CNB two-week repo rate unchanged at  2.50 ",1,2007,2007/01/25,0,4,288,1447
286,./Czechia/TK_01SZ2007_EN.pdf, Compared to the  October forecast the rate of growth is slightly lower in 2007 and ,2,2007,2007/01/25,0,4,84,1447
287,./Czechia/TK_01SZ2007_EN.pdf, Expected inflation pressures from the real economy are similar compared to the October forecast for the beginning of the forecasting ,3,2007,2007/01/25,0,4,134,1447
288,./Czechia/TK_01SZ2007_EN.pdf," They grow in the beginning of the year,2007  but decline during the ",3,2007,2007/01/25,0,4,69,1447
290,./Czechia/TK_01SZ2007_EN.pdf," Compared to the October,forecast  inflation is lower in 2007 and 2008 but  this difference gradually decreases during ",4,2007,2007/01/25,0,4,119,1447
291,./Czechia/TK_01SZ2007_EN.pdf, Inflation at the monetary  policy horizon (2008 H1) remains in the upper part of the tolerance band  of the inflation ,4,2007,2007/01/25,0,4,119,1447
292,./Czechia/TK_01SZ2007_EN.pdf, The January forecast   Forecast for inflation (CPI):in    December 2007 (+4 quarters)  2.4  3.8    June 2008 (+6 quarters)  2.8  4.2         Forecast for GDP growth:in    2007                                                    4.4   6.2    2008                                                    3.1   6.5  Major uncertainties of the forecast  lower oil and petrol prices  foreign economic outlook  koruna exchange rate development  revision of the consumer basket  future fiscal ,4,2007,2007/01/25,0,4,481,1447
297,./Czechia/tk_02sz2013_aj.pdf, Press conference of the  CNB Bank Board 2nd Situation Report on  Economic and Monetary  Developments 28 March 2013 The monetary policy decision and  the stance of the CNB   At the close of the meeting the Board decided unanimously to  leave the two-week repo rate unchanged at ,1,2013,2013/03/28,0,10,278,1531
298,./Czechia/tk_02sz2013_aj.pdf, Interest rates will remain at current levels (i.e. at technical zero)  over  longer horizon until inflation pressures increase  ,2,2013,2013/03/28,0,10,129,1531
299,./Czechia/tk_02sz2013_aj.pdf," In line with previous,communication  the CNB is ready to use  foreign exchange interventions if further monetary policy easing  becomes ",3,2013,2013/03/28,0,10,137,1531
300,./Czechia/tk_02sz2013_aj.pdf,"  Reasons for the decision within  the context of the forecast   Consistent with the forecast is  slight decline in market interest ,rates  followed by  rise in rates as from ",4,2013,2013/03/28,0,10,175,1531
301,./Czechia/tk_02sz2013_aj.pdf, The current Inflation Report I/2013 forecast does not predict an  increase in inflation pressures and no tangible risks of such an  increase in inflation pressures can be identified at ,5,2013,2013/03/28,0,10,186,1531
304,./Czechia/tk_02sz2013_aj.pdf," Developments in industrial,production  construction output and retail  sales in January continue to indicate subdued economic ",7,2013,2013/03/28,0,10,127,1531
305,./Czechia/tk_02sz2013_aj.pdf, The labour market exhibits signs of:weakness   Total employment saw y-o-y growth in 2012 Q4 but continued to decline when  converted into full-time ,8,2013,2013/03/28,0,10,149,1531
306,./Czechia/tk_02sz2013_aj.pdf, Unemployment (s.a.) rose in terms of both the  general unemployment rate in 2012 Q4 and the share of unemployed persons in  January and February ,8,2013,2013/03/28,0,10,146,1531
307,./Czechia/tk_02sz2013_aj.pdf," Y-o-y growth in the average nominal wage markedly accelerated in 2012,Q4  which ,was ,however  affected by tax ",9,2013,2013/03/28,0,10,112,1531
308,./Czechia/tk_02sz2013_aj.pdf, Cost-push pressures are apparent from agricultural producer prices  ,10,2013,2013/03/28,0,10,69,1531
310,./Czechia/tk_05sz2013_aj.pdf, Press conference of the   CNB Bank Board 5th Situation Report on  Economic and Monetary  Developments  August 2013     The monetary policy decision and  the stance of the CNB  At the close of the meeting the Board decided unanimously to  leave  the two-week repo rate unchanged at ,1,2013,2013/08/01,0,15,282,2326
311,./Czechia/tk_05sz2013_aj.pdf, Interest rates will remain at current levels (i.e. at technical zero)  over   longer horizon until inflation pressures increase  ,2,2013,2013/08/01,0,15,130,2326
312,./Czechia/tk_05sz2013_aj.pdf, The likelihood of launching foreign exchange interventions to  ease  monetary policy has increased ,3,2013,2013/08/01,0,15,100,2326
313,./Czechia/tk_05sz2013_aj.pdf," 2 Reasons for the decision within  the context of the forecast  Consistent with the forecast is  decline in market interest rates to ,zero   followed by  noticeable rise in rates only in ",4,2013,2013/08/01,0,15,188,2326
314,./Czechia/tk_05sz2013_aj.pdf," Given the zero lower bound on monetary policy,rates  this points to   nee  for easing monetary policy using other ",5,2013,2013/08/01,0,15,115,2326
315,./Czechia/tk_05sz2013_aj.pdf, The new forecast does not predict an increase in inflation pressures  and   tangible risks of such an increase in inflation pressures can  be identified ,6,2013,2013/08/01,0,15,154,2326
316,./Czechia/tk_05sz2013_aj.pdf, The risks to the new forecast are skewed towards  need for easier  mone tary ,7,2013,2013/08/01,0,15,78,2326
317,./Czechia/tk_05sz2013_aj.pdf, 3 The message of the forecast  Food prices continue to be the source of current ,8,2013,2013/08/01,0,15,81,2326
318,./Czechia/tk_05sz2013_aj.pdf, The contribution of tax changes  and administered prices has ,8,2013,2013/08/01,0,15,62,2326
320,./Czechia/tk_05sz2013_aj.pdf," Headline inflation will be below the CNB’s 2% target this,year  monetary-policy relevant  inflation will be below the lower boundary of the tolerance ",9,2013,2013/08/01,0,15,151,2326
321,./Czechia/tk_05sz2013_aj.pdf," At the monetary policy     ,horizon  headline and monetary-policy will gradually approach the target ",9,2013,2013/08/01,0,15,102,2326
322,./Czechia/tk_05sz2013_aj.pdf," This,year  GDP will drop by 1.5% overall and  gradual recovery will be seen from 2013  Q2. Next,year  GDP will grow by approximately 2% due to accelerating external demand    amid an unwinding dampening effect of domestic fiscal ",10,2013,2013/08/01,0,15,230,2326
324,./Czechia/tk_05sz2013_aj.pdf, The exchange rate of the koruna against the euro has weakened and will appreciate only  very slowly over the forecast ,11,2013,2013/08/01,0,15,119,2326
325,./Czechia/tk_05sz2013_aj.pdf," Consistent with the forecast is  decline in market interest rates to,zero  followed by   noticeable rise in rates only in ",12,2013,2013/08/01,0,15,123,2326
327,./Czechia/tk_05sz2013_aj.pdf," Risks in this:direction   energy prices     risk of unfulfilled expectations of an economic recovery  in the  euro area   13 Thank you for your attention More information about the forecast  can be found at :http //www.cnb.cz/en/monetary_policy/forecast/ and in Inflation Report,III/2013    to be published  August ",14,2013,2013/08/01,0,15,316,2326
329,./Czechia/tk_03sz2011_aj.pdf, Press conference of the CNB Bank Board 3rd Situation Report on  Economic and Monetary  Developments  May 2011 The monetary policy decision taken and the ratio of the votes cast  At the close of the meeting the Bank Board decided by   majority vote to leave the two-week repo rate unchanged  at ,1,2011,2011/05/05,0,17,295,2659
330,./Czechia/tk_03sz2011_aj.pdf," Five members voted in favour of this,decision  and two  members voted for increasing rates by 0.25 percentage  ",2,2011,2011/05/05,0,17,112,2659
331,./Czechia/tk_03sz2011_aj.pdf,  Reasons for the decision  Headline and monetary-policy relevant inflation will be close  to the inflation target over the monetary policy ,3,2011,2011/05/05,0,17,140,2659
332,./Czechia/tk_03sz2011_aj.pdf, Consistent with the forecast is broad stability of market  interest rates in the near future and  gradual rise in rates  starting in 2011 ,4,2011,2011/05/05,0,17,139,2659
333,./Czechia/tk_03sz2011_aj.pdf, The risks to the forecast for monetary-policy relevant  inflation are ,5,2011,2011/05/05,0,17,71,2659
334,./Czechia/tk_03sz2011_aj.pdf,  The message of the forecast  No inflation pressures from the domestic economy are ,6,2011,2011/05/05,0,17,84,2659
335,./Czechia/tk_03sz2011_aj.pdf, Both headline and monetary-policy relevant inflation will be close to the  inflation target over the entire forecast ,7,2011,2011/05/05,0,17,118,2659
336,./Czechia/tk_03sz2011_aj.pdf," Economic growth will slow this year due to fiscal,restriction  fading  investment in inventories and slower growth in economic activity ",8,2011,2011/05/05,0,17,137,2659
338,./Czechia/tk_03sz2011_aj.pdf, The nominal exchange rate is gradually appreciating over the forecast  ,10,2011,2011/05/05,0,17,72,2659
339,./Czechia/tk_03sz2011_aj.pdf, Consistent with the forecast is broad stability of market interest rates in  the near future and  gradual rise in rates starting in 2011 ,11,2011,2011/05/05,0,17,138,2659
341,./Czechia/tk_03sz2011_aj.pdf, Upside:risks   less anti-inflationary domestic economic environment Downside:risks   debt crisis in some euro area countries 13 Alternative scenario of the forecast  The alternative scenario captures the effects of  planned change in the  reduced VAT rate (from 10% to 14% with effect from  January ,13,2011,2011/05/05,0,17,300,2659
