,filename,sentence,paragraph_index,paragraphs,num_char_sentence,total_chars
149,C:/Modeling/ETA/Czechia/tk_02sz2012_aj.pdf,"• Y-o-y growth in industrial producer prices slowed in February, whereas agricultural producer prices declined y-o-y.",10.0,11.0,117.0,3673.0
150,C:/Modeling/ETA/Czechia/tk_02sz2012_aj.pdf,"7 Comparison of actual data  with the CNB forecast 10 9.4 9.1 forecast 9 actual data 8 7 6 5 4 3.7 3.4 2.8 3 2.0 2 1 0.7 0.6 0 GDP (Q4, 2011) Inflation (February 2012) Average wage   Unemployment (Q1, (Q4,2011) 2012) Note: in percentages, for unemployment comparison of expected outcome with forecast for the respective quarter  8 Major risks to the forecast The risks to the forecast are balanced Major risk on the upside: • higher observed inflation and its short-term outlook due mainly  to food and fuel prices Major risks on the downside: • stronger koruna exchange rate • lower foreign interest rate outlook 9 Thank you for your attention Minutes of the today’s meeting and  the Graph of Risks to the Inflation  Projection (GRIP) will be released  on 6 April 2012 at  http://www.cnb.cz/en/monetary_policy/bank_board_minutes/",11.0,11.0,830.0,3673.0
151,C:/Modeling/ETA/Czechia/tk_02sz2013_aj.pdf,Press conference of the  CNB Bank Board 2nd Situation Report on  Economic and Monetary  Developments 28 March 2013 The monetary policy decision and  the stance of the CNB •  At the close of the meeting the Board decided unanimously to  leave the two-week repo rate unchanged at 0.05%.,1.0,11.0,284.0,3587.0
152,C:/Modeling/ETA/Czechia/tk_02sz2013_aj.pdf,•  Interest rates will remain at current levels (i.e. at technical zero)  over a longer horizon until inflation pressures increase  significantly.,2.0,11.0,146.0,3587.0
153,C:/Modeling/ETA/Czechia/tk_02sz2013_aj.pdf,"•  In line with previous communication, the CNB is ready to use  foreign exchange interventions if further monetary policy easing  becomes necessary.",3.0,11.0,149.0,3587.0
154,C:/Modeling/ETA/Czechia/tk_02sz2013_aj.pdf,"2 Reasons for the decision within  the context of the forecast •  Consistent with the forecast is a slight decline in market interest  rates, followed by a rise in rates as from mid-2014.",4.0,11.0,187.0,3587.0
155,C:/Modeling/ETA/Czechia/tk_02sz2013_aj.pdf,•  The current Inflation Report I/2013 forecast does not predict an  increase in inflation pressures and no tangible risks of such an  increase in inflation pressures can be identified at present.,5.0,11.0,196.0,3587.0
156,C:/Modeling/ETA/Czechia/tk_02sz2013_aj.pdf,"3 The inflation forecast and  expected outcome in 2013 Q1  6 Monetary  policy 5 horizon   4 3 Inflation target 2 1 0 -1 I/11 II III IV I/12 II III IV I/13 II III IV I/14 II III 90% 70% 50% 30% confidence interval 4 The external environment (i) Comparison between the current forecast assumptions and the March  outlook based on Consensus Forecasts survey and market expectations for  the effective euro area 3 current forecast CF_03 2.2 2.2 2.1 2.1 2.1 2.0 2 1.8 1.8 1.7 1.6 1 0.6 0.5 0.4 0.4 0.3 0.2 0 2013 2014 2013 2014 2013 2014 2013 2014 Consumer prices Producer prices GDP 3M EURIBOR 5 The external environment (ii) Comparison between the current forecast assumptions and the March  outlook based on Consensus Forecasts survey and market expectations 1.35 130 current forecast current forecast CF_03 CF_03 120 1.31 108.8 109.2 110 102.9 102.8 1.30 100 1.29 90 1.26 80 1.25 1.24 70 60 50 1.20 2013 2014 2013 2014 Brent oil (USD/barrel) USD/EUR  6 Developments in the domestic economy since  the Board’s previous monetary meeting •  The Czech economy declined both in y-o-y and q-o-q terms in 2012 Q4,  s.a., more markedly than forecasted.",6.0,11.0,1143.0,3587.0
157,,,,,,
158,C:/Modeling/ETA/Czechia/tk_02sz2013_aj.pdf,"•  Developments in industrial production, construction output and retail  sales in January continue to indicate subdued economic activity.",7.0,11.0,138.0,3587.0
159,C:/Modeling/ETA/Czechia/tk_02sz2013_aj.pdf,•  The labour market exhibits signs of weakness: • Total employment saw y-o-y growth in 2012 Q4 but continued to decline when  converted into full-time equivalents.,8.0,11.0,164.0,3587.0
160,C:/Modeling/ETA/Czechia/tk_02sz2013_aj.pdf,Unemployment (s.a.) rose in terms of both the  general unemployment rate in 2012 Q4 and the share of unemployed persons in  January and February 2013.,8.0,11.0,150.0,3587.0
161,C:/Modeling/ETA/Czechia/tk_02sz2013_aj.pdf,"• Y-o-y growth in the average nominal wage markedly accelerated in 2012 Q4, which  was, however, affected by tax optimisation.",9.0,11.0,126.0,3587.0
162,C:/Modeling/ETA/Czechia/tk_02sz2013_aj.pdf,•  Cost-push pressures are apparent from agricultural producer prices  only.,10.0,11.0,76.0,3587.0
163,C:/Modeling/ETA/Czechia/tk_02sz2013_aj.pdf,"7 Comparison of actual data  with the CNB forecast 10 forecast 7.9 8.0 8 actual data 6 3.7 4 2.0 2.1 1.7 2 0 -2 -1.4 -1.7 -4 GDP (Q4,2012)  Inflation (February 2013)  Average wage (Q4,2012)  Share of unemployed persons (Q1,2013)  Note: in percentages, for share of unemployed persons comparison of outcomes in January and February with  forecast for the Q1, 2013  8 Risks to the forecast The risks to the forecast are tilted towards slightly  easier monetary conditions Risks in the above-mentioned direction: •  domestic economic activity •  domestic inflation •  developments abroad 9 Thank you for your attention Minutes of the today’s meeting and  the Graph of Risks to the Inflation  Projection (GRIP) will be released  on 5 April 2013 at  http://www.cnb.cz/en/monetary_policy/bank_board_minutes/",11.0,11.0,801.0,3587.0
164,,,,,,
165,,,,,,
166,,,,,,
167,C:/Modeling/ETA/Czechia/TK_03SZ2008_EN.pdf,Press Conference of the CNB Bank Board 3rd Situation Report on Economic  and Monetary Developments 7 May 2008 TThhee  mmoonneettaarryy  ppoolliiccyy  ddeecciissiioonn  ttaakkeenn   aanndd  tthhee  rraattiioo  ooff  tthhee  vvootteess  ccaasstt At the close of the meeting the Board decided by a majority vote to leave the two-week repo rate  unchanged at 3.75 %.,1.0,4.0,362.0,4904.0
168,C:/Modeling/ETA/Czechia/TK_03SZ2008_EN.pdf,"Six members voted in favour  of this decision, and one member voted for  increasing rates by 0.25 percentage point.",1.0,4.0,115.0,4904.0
169,C:/Modeling/ETA/Czechia/TK_03SZ2008_EN.pdf,"TThhee  eexxtteerrnnaall  eennvviirroonnmmeenntt Comparison between the actual and previous forecast assumptions 2008 2009   Effective indicator of consumer prices in the euro area    1.SR 2008 2.2 1.8   (percentages) 3.SR 2008 2.6 2.0   Effective indicator of producer prices in the euro area  1.SR 2008 2.4 1.8   (percentages) 3.SR 2008 3.5 2.2   Effective indicator of GDP in the euro area (percentages) 1.SR 2008 2.0 2.0 3.SR 2008 1.8 1.7   Price of Brent crude oil (USD/barrel) 1.SR 2008 92.1 88.7 3.SR 2008 104.8 105.4   Price of petrol (USD/t) 1.SR 2008 822.6 826.4 3.SR 2008 895.2 934.8   USD/EUR exchange rate (level) 1.SR 2008 1.46 1.38 3.SR 2008 1.53 1.44   1Y EURIBOR  (percentages) 1.SR 2008 3.9 4.0 3.SR 2008 4.1 4.0 TThhee  ffoorreeccaasstt  ffoorr  hheeaaddlliinnee  iinnffllaattiioonn 8 Monetary  policy 7 horizon   6 5 4 Inflation target 3 2 1 0 II III IV I/07 II III IV I/08  II III IV I/09 II III IV 90% 70% 50% 30% confidence interval TThhee  ffoorreeccaasstt  ffoorr  mmoonneettaarryy--ppoolliiccyy   rreelleevvaanntt  iinnffllaattiioonn   8 Monetary  7 policy horizon   6 5 4 Inflation target 3 2 1 0 II III IV I/07 II III IV I/08  II III IV I/09 II III IV 90% 70% 50% 30% confidence interval TThhee  ffoorreeccaasstt  ffoorr  GGDDPP 9 8 7 6 5 4 3 2 1 0 II III IV I/07 II III IV I/08  II III IV I/09 II III IV 90% 70% 50% 30%  confidence interval TThhee  ffoorreeccaasstt  ffoorr  iinntteerreesstt rraatteess ((33MM  PPRRIIBBOORR)) 7 6 5 4 3 2 1 0 II III IV I/0 7 II III IV I/08   II III IV I/0 9 II III IV 9 0 % 7 0 % 5 0 % 3 0 %  c o n f id e n c e  in terv a l Consistent with the macroeconomic forecast and its assumptions is  broad stability in nominal interest rates initially, followed by a decline  still in 2008 and stability in 2009.",1.0,4.0,1766.0,4904.0
170,C:/Modeling/ETA/Czechia/TK_03SZ2008_EN.pdf,"FFoorreeccaasstt  iinn  nnuummbbeerrss   Forecast for headline inflation in:   2009, Q1 (+4 quarters)  2.9 %   2009, Q3 (+6 quarters) 2.2 %    Forecast for monetary-policy relevant inflation in:   2009, Q1 (+4 quarters)           2.4 %   2009, Q3 (+6 quarters) 2.2 %      Forecast for GDP growth in:   2008                                               4.7 %   2009                                                 4.0 %   Forecast for nominal interest rates (3M PRIBOR) in:   2009, Q1 (+4 quarters)           2.8 %   2009, Q3 (+6 quarters) 2.8 %  CCoommppaarriissoonn  wwiitthh  tthhee  pprreevviioouuss   ffoorreeccaasstt • Compared to the previous forecast, the rate of economic growth is higher  in 2008 and lower in 2009.",1.0,4.0,725.0,4904.0
171,C:/Modeling/ETA/Czechia/TK_03SZ2008_EN.pdf,"• Compared to the previous forecast, the forecast for headline inflation is  on average slightly lower.",2.0,4.0,103.0,4904.0
172,C:/Modeling/ETA/Czechia/TK_03SZ2008_EN.pdf,"The same is true for monetary-policy relevant  inflation which is equal to the headline inflation from 2009, Q3.",2.0,4.0,112.0,4904.0
173,C:/Modeling/ETA/Czechia/TK_03SZ2008_EN.pdf,"• Compared to the previous forecast, the forecast-consistent interest rate  path is slightly lower for most of the period.",3.0,4.0,122.0,4904.0
174,C:/Modeling/ETA/Czechia/TK_03SZ2008_EN.pdf,MMaajjoorr  uunncceerrttaaiinnttiieess  ooff  tthhee  ffoorreeccaasstt Risks are rather on upside.,3.0,4.0,98.0,4904.0
175,C:/Modeling/ETA/Czechia/TK_03SZ2008_EN.pdf,Major risks and uncertainties: - higher impact of cost shocks on prices in other segments  and on inflation expectations - slower reaction of the real economic activity to tightening  of the exchange rate component of monetary policy conditions - koruna exchange rate developments - situation on labour market  - external developments TThhee  aalltteerrnnaattiivvee  ffoorreeccaasstt ((mmooddeell  gg33)) ffoorr  hheeaaddlliinnee aanndd  mmoonneettaarryy  ppoolliiccyy--rreelleevvaanntt  iinnffllaattiioonn 8 Monetary  8 Monetary  7 policy 7 policy horizon   6 6 horizon  5 5 4 4 Inflation target Inflation target 3 3 2 2 1 1 0 0 II III IV I/07 II III IV I/08  II III IV I/09 II III IV II III IV I/07 II III IV I/08  II III IV I/09 II III IV 90% 70% 90% 70% 50% 30% confidence interval 50% 30% confidence interval Baseline scenario Alternative scenario Baseline scenario Alternative scenario TThhee  aalltteerrnnaattiivvee  ffoorreeccaasstt ((mmooddeell  gg33)) ffoorr  iinntteerreesstt   rraatteess  ((33MM  PPRRIIBBOORR))  aanndd  GGDDPP  ggrroowwtthh 7 9 6 8 7 5 6 4 5 3 4 3 2 2 1 1 0 0 II III IV I/07 II III IV I/08  II III IV I/09 II III IV II III IV I/07 II III IV I/08  II III IV I/09 II III IV 90% 70% 90% 70% 50% 30% confidence interval 50% 30% confidence interval Baseline scenario Alternative scenario Baseline scenario Alternative scenario The interest rate path consistent with the alternative scenario is roughly  the same as in the baseline scenario in 2008 and somewhat higher in 2009.,4.0,4.0,1501.0,4904.0
176,C:/Modeling/ETA/Czechia/tk_03sz2009_aj.pdf,"Press Conference of the CNB Bank Board 3rd Situation Report on Economic  and Monetary Developments May 7, 2009 TThhee  mmoonneettaarryy  ppoolliiccyy  ddeecciissiioonn  ttaakkeenn   aanndd  tthhee  rraattiioo  ooff  tthhee  vvootteess  ccaasstt At the close of the meeting the Board decided by a  majority vote to decrease the CNB two-week repo  rate by 0.25 percentage point to 1.50 %,  effective  11 May 2004.",1.0,8.0,411.0,4518.0
177,C:/Modeling/ETA/Czechia/tk_03sz2009_aj.pdf,"At the same time it decided to  decrease the discount rate and Lombard rate by the  same amount, to 0.50 % and 2.50 % respectively.",1.0,8.0,131.0,4518.0
178,C:/Modeling/ETA/Czechia/tk_03sz2009_aj.pdf,"Five members voted in favour of this decision, and  two members voted for leaving interest rates  unchanged.",2.0,8.0,108.0,4518.0
179,C:/Modeling/ETA/Czechia/tk_03sz2009_aj.pdf,MMeessssaaggee  ooff  tthhee  ffoorreeccaasstt • Headline (and monetary-policy relevant) inflation will  continue declining this year but will remain in positive  figures.,2.0,8.0,171.0,4518.0
180,C:/Modeling/ETA/Czechia/tk_03sz2009_aj.pdf,Next year inflation will again start rising and will  approach the 2% inflation target at the end of 2010.,2.0,8.0,106.0,4518.0
181,C:/Modeling/ETA/Czechia/tk_03sz2009_aj.pdf,"• The domestic economic activity will decline this year by 2,4%  but the economy will return to modest growth in 2010.",3.0,8.0,118.0,4518.0
182,C:/Modeling/ETA/Czechia/tk_03sz2009_aj.pdf,• The nominal exchange rate will initially correct its losses from beginning of the year and afterwards will be broadly flat.,4.0,8.0,125.0,4518.0
183,C:/Modeling/ETA/Czechia/tk_03sz2009_aj.pdf,• Consistent with the forecast is a decline in market interest  rates this year followed by a modest rise in 2010.,5.0,8.0,114.0,4518.0
184,C:/Modeling/ETA/Czechia/tk_03sz2009_aj.pdf,"TThhee  eexxtteerrnnaall  eennvviirroonnmmeenntt Comparison between the actual and previous forecast assumptions 2009 2010   Effective indicator of consumer prices in the euro area    3.SR 2009 1.0 1.6   (percentages) 1.SR 2009 1.0 1.6   Effective indicator of producer prices in the euro area  3.SR 2009 -1.6 1.3   (percentages) 1.SR 2009 0.9 1.9   Effective indicator of GDP in the euro area (percentages) 3.SR 2009 -3.3 0.7 1.SR 2009 -1.5 0.8   Price of Brent crude oil (USD/barrel) 3.SR 2009 52.7 63.3 1.SR 2009 51.4 61.8   USD/EUR exchange rate (level) 3.SR 2009 1.32 1.33 1.SR 2009 1.33 1.33   3M EURIBOR (percentages) 3.SR 2009 1.3 1.9 1.SR 2009 1,8 2,5 TThhee  ffoorreeccaasstt  ffoorr  hheeaaddlliinnee  iinnffllaattiioonn 8 Monetary  policy horizon   6 4 Inflation target 2 0 -2 II/07 III IV I/08  II III IV I/09 II III IV I/10 II III IV 90% 70% 50% 30% confidence interval TThhee  ffoorreeccaasstt  ffoorr  mmoonneettaarryy--ppoolliiccyy   rreelleevvaanntt  iinnffllaattiioonn   8 Monetary  policy horizon   6 4 Inflation target 2 0 -2 II/07 III IV I/08  II III IV I/09 II III IV I/10 II III IV 90% 70% 50% 30% confidence interval TThhee  ffoorreeccaasstt  ffoorr  GGDDPP 8 6 4 2 0 -2 -4 -6 II/07 III IV I/08  II III IV I/09 II III IV I/10 II III IV 90% 70% 50% 30% confidence interval TThhee  ffoorreeccaasstt  ffoorr  iinntteerreesstt rraatteess ((33MM  PPRRIIBBOORR)) 6 5 4 3 2 1 0 II/07 III IV I/08  II III IV I/09 II III IV I/10 II III IV 90% 70% 50% 30% confidence interval TThhee  ffoorreeccaasstt  ffoorr  eexxcchhaannggee  rraattee ((CCZZKK//EEUURR,,  qquuaarrtteerrllyy  aavveerraaggeess)) 30 28 26 24 22 20 II/07 III IV I/08  II III IV I/09 II III IV I/10 II III IV 90% 70% 50% 30% confidence interval FFoorreeccaasstt  iinn  nnuummbbeerrss   Headline inflation in:   2010, Q2                                              1.1 %   2010, Q3 1.7 %    Monetary-policy relevant inflation in:   2010, Q2   1.4 %   2010, Q3 1.7 %      GDP growth in:   2009                                                           -2.4 %   2010                                                            1.4 %   Nominal interest rates (3M PRIBOR) in:   2010, Q2 2.0 %   2010, Q3 2.1 %    Exchange rates (CZK/EUR) in:   2009                                26.6 CZK/EUR   2010                                       25.9 CZK/EUR CCoommppaarriissoonn  wwiitthh  tthhee  pprreevviioouuss   ffoorreeccaasstt • Compared to the previous forecast, the economic recession in 2009  is markedly deeper due to foreign economic developments, whereas in 2010 the economic growth is slightly stronger.",5.0,8.0,2584.0,4518.0
185,C:/Modeling/ETA/Czechia/tk_03sz2009_aj.pdf,"• Compared to the previous projection, the forecast for both headline  and monetary-policy relevant inflation is higher in 2009 but, on the  contrary, lower in 2010.",6.0,8.0,165.0,4518.0
186,C:/Modeling/ETA/Czechia/tk_03sz2009_aj.pdf,"• Compared to the previous forecast, the interest rate path lies lower  over the forecasted horizon.",7.0,8.0,100.0,4518.0
187,C:/Modeling/ETA/Czechia/tk_03sz2009_aj.pdf,• The CZK/EUR exchange rate outlook is weaker than in the previous  forecast.,8.0,8.0,77.0,4518.0
188,C:/Modeling/ETA/Czechia/tk_03sz2009_aj.pdf,"MMaajjoorr  rriisskkss  ooff  tthhee  ffoorreeccaasstt Forecast risks are balanced, a high degree of uncertainty persists Inflation risks on the down side: - deeper and longer-lasting depression in economies abroad Inflation risks on the up side: - smaller drop in growth of nominal wages in domestic economy",8.0,8.0,308.0,4518.0
189,C:/Modeling/ETA/Czechia/tk_03sz2010_aj.pdf,"Press conference of the CNB Bank Board 3rd Situation Report on  Economic and Monetary  Developments May 6, 2010 The monetary policy decision taken and the ratio of the votes cast • Six out of seven Bank Board members attended the  meeting.",1.0,16.0,239.0,4119.0
190,C:/Modeling/ETA/Czechia/tk_03sz2010_aj.pdf,• At the close of the meeting the Bank Board decided by a  majority vote to lower the two-week repo rate by 0.25  percentage point to 0.75 %.,2.0,16.0,141.0,4119.0
191,C:/Modeling/ETA/Czechia/tk_03sz2010_aj.pdf,"At the same time, it decided to cut the Lombard rate by the same amount, to 1.75 %.",2.0,16.0,83.0,4119.0
192,,,,,,
193,C:/Modeling/ETA/Czechia/tk_03sz2010_aj.pdf,"• Four board members voted in favour of this decision, and two members voted for leaving interest rates unchanged.",4.0,16.0,114.0,4119.0
194,C:/Modeling/ETA/Czechia/tk_03sz2010_aj.pdf,2 Reasons for the decision • Headline and monetary-policy relevant inflation will be  slightly below the 2% target at the monetary policy  horizon.,5.0,16.0,147.0,4119.0
195,C:/Modeling/ETA/Czechia/tk_03sz2010_aj.pdf,• Consistent with the forecast is initially a moderate decline in market interest rates followed by stability and gradual  rise in rates since 2011.,6.0,16.0,148.0,4119.0
196,,,,,,
197,C:/Modeling/ETA/Czechia/tk_03sz2010_aj.pdf,3 The message of the forecast • Headline inflation will rise during 2010 and will exceed the CNB’s target at the  end of the year due to already realized indirect taxes changes.,8.0,16.0,177.0,4119.0
198,C:/Modeling/ETA/Czechia/tk_03sz2010_aj.pdf,In 2011  inflation will decline slightly below the CNB‘s inflation target.,8.0,16.0,74.0,4119.0
199,C:/Modeling/ETA/Czechia/tk_03sz2010_aj.pdf,• Monetary-policy relevant inflation will initially be lower than headline inflation  and will be approaching the target from below over the monetary policy  horizon (2011 Q2 and Q3).,9.0,16.0,183.0,4119.0
200,C:/Modeling/ETA/Czechia/tk_03sz2010_aj.pdf,"• GDP will grow over the entire forecast horizon, but the growth rate in 2010  will be hampered by a temporary decline in domestic consumption and  slowdown in foreign demand.",10.0,16.0,175.0,4119.0
201,C:/Modeling/ETA/Czechia/tk_03sz2010_aj.pdf,Both factors will unwind in 2011 and GDP  growth will start to accelerate.,10.0,16.0,74.0,4119.0
202,C:/Modeling/ETA/Czechia/tk_03sz2010_aj.pdf,• Nominal exchange rate is gradually appreciating over the forecast horizon.,11.0,16.0,76.0,4119.0
203,C:/Modeling/ETA/Czechia/tk_03sz2010_aj.pdf,• Consistent with the forecast is initially a moderate decline in market interest  rates followed by stability and a gradual rise in rates since 2011.,12.0,16.0,150.0,4119.0
204,C:/Modeling/ETA/Czechia/tk_03sz2010_aj.pdf,"4 The external environment (i) Comparison between the new and previous forecasts 3 2.3 new forecast previous forecast 2.0 2.0 2 1.9 1.8 1.7 1.6 1.5 1.5 1.5 2 1.2 1.1 1.1 1 0.9 0.8 0.6 1 0 2010 2011 2010 2011 2010 2011 2010 2011 Consumer prices Producer pricees GDP 3M EURIBOR 5 The external environment (ii) Comparison between the new and previous forecasts 100 new forecast 1,50 new forecast previous forecast previous forecast 90,1 1,45 88,9 90 1,45 84,2 83,6 1,42 80 1,40 1,35 70 1,35 1,33 60 1,30 50 1,25 40 1,20 2010 2011 2010 2011 Brent oil (USD/barel) USD/EUR  6 The forecast for headline inflation 8 Monetary  policy horizon   6 4 Inflation target 2 0 -2 II/08 III IV I/09 II III IV I/10 II III IV I/11 II III IV 90% 70% 50% 30% confidence interval 7 The forecast for monetary-policy  relevant inflation 8 Monetary  policy horizon   6 4 Inflation target 2 0 -2 II/08 III IV I/09 II III IV I/10 II III IV I/11 II III IV 90% 70% 50% 30% confidence interval 8 The forecast for GDP 10 8 6 4 2 0 -2 -4 -6 II/08 III IV I/09 II III IV I/10 II III IV I/11 II III IV 90% 70% 50% 30% confidence interval 9 The forecast for interest rates (3M PRIBOR) 6 5 4 3 2 1 0 II/08 III IV I/09 II III IV I/10 II III IV I/11 II III IV 90% 70% 50% 30% confidence interval 10 The forecast for exchange rate CZK/EUR (quarterly averages) 30 28 26 24 22 20 II/08 III IV I/09 II III IV I/10 II III IV I/11 II III IV 90% 70% 50% 30% confidence interval 11 Comparison with the  previous forecast 3 28 2.5 2.1 2.1 2.1 25.3 25.5 25.2 1.9 24.9 1.8 1.8 1.8 2 25 1.4 1.4 1.4 1.1 1 22 0 19 -1 16 -2 13 -3 10 -4 7 new forecast previous forecast -5 4 II/2011 III/2011 2010 2011 2010 2011 2010 2011 CZK/EUR (right axis) Consumer prices GDP 3M PRIBOR 12 Major risks to the forecast Forecast risks are seen as balanced.",13.0,16.0,1785.0,4119.0
205,C:/Modeling/ETA/Czechia/tk_03sz2010_aj.pdf,• Upside risk relates to exchange rate developments • Downside risk stems from the global economic outlook with respect to Czech exports.,14.0,16.0,137.0,4119.0
206,C:/Modeling/ETA/Czechia/tk_03sz2010_aj.pdf,• Uncertainty going in both directions exists regarding current financial market developments in connection with the fiscal situation.,15.0,16.0,134.0,4119.0
207,C:/Modeling/ETA/Czechia/tk_03sz2010_aj.pdf,"13 Thank you for your attention More information about the  forecast can be found at  http://www.cnb.cz/en/monetary _policy/forecast/ and in Inflation Report II/2010,  to be published 14th May,  2010.",16.0,16.0,200.0,4119.0
208,C:/Modeling/ETA/Czechia/tk_03sz2011_aj.pdf,Press conference of the CNB Bank Board 3rd Situation Report on  Economic and Monetary  Developments 5 May 2011 The monetary policy decision taken and the ratio of the votes cast • At the close of the meeting the Bank Board decided by a  majority vote to leave the two-week repo rate unchanged  at 0.75%.,1.0,17.0,303.0,4738.0
209,C:/Modeling/ETA/Czechia/tk_03sz2011_aj.pdf,"• Five members voted in favour of this decision, and two  members voted for increasing rates by 0.25 percentage  point.",2.0,17.0,119.0,4738.0
210,C:/Modeling/ETA/Czechia/tk_03sz2011_aj.pdf,2 Reasons for the decision • Headline and monetary-policy relevant inflation will be close  to the inflation target over the monetary policy horizon.,3.0,17.0,149.0,4738.0
211,C:/Modeling/ETA/Czechia/tk_03sz2011_aj.pdf,• Consistent with the forecast is broad stability of market  interest rates in the near future and a gradual rise in rates  starting in 2011 Q4.,4.0,17.0,144.0,4738.0
212,C:/Modeling/ETA/Czechia/tk_03sz2011_aj.pdf,• The risks to the forecast for monetary-policy relevant  inflation are balanced.,5.0,17.0,81.0,4738.0
213,C:/Modeling/ETA/Czechia/tk_03sz2011_aj.pdf,3 The message of the forecast • No inflation pressures from the domestic economy are apparent.,6.0,17.0,94.0,4738.0
214,C:/Modeling/ETA/Czechia/tk_03sz2011_aj.pdf,• Both headline and monetary-policy relevant inflation will be close to the  inflation target over the entire forecast horizon.,7.0,17.0,127.0,4738.0
215,C:/Modeling/ETA/Czechia/tk_03sz2011_aj.pdf,"• Economic growth will slow this year due to fiscal restriction, fading  investment in inventories and slower growth in economic activity abroad.",8.0,17.0,145.0,4738.0
216,C:/Modeling/ETA/Czechia/tk_03sz2011_aj.pdf,A more robust economic recovery is expected to reappear in 2012.,9.0,17.0,64.0,4738.0
217,C:/Modeling/ETA/Czechia/tk_03sz2011_aj.pdf,• The nominal exchange rate is gradually appreciating over the forecast  horizon.,10.0,17.0,81.0,4738.0
218,C:/Modeling/ETA/Czechia/tk_03sz2011_aj.pdf,• Consistent with the forecast is broad stability of market interest rates in  the near future and a gradual rise in rates starting in 2011 Q4.,11.0,17.0,143.0,4738.0
