,filename,sentence,paragraph_index,year,date,is_table,paragraphs,num_char_sentence,total_chars
487,./Czechia/tk_01sz2013_aj.pdf," Consistent with the forecast is  slight decline in market interest,rates  followed by   rise in rates as from ",11,2013,2013/02/06,0,13,111,1751
489,./Czechia/tk_01sz2013_aj.pdf," 13 Thank you for your attention More information about the forecast  can be found at :http //www.cnb.cz/en/monetary_policy/forecast/ and in Inflation Report,I/2013   to be published 15 February ",13,2013,2013/02/06,0,13,195,1751
490,./Czechia/tk_06sz2013_aj.pdf, Press conference of the  CNB Bank Board 6th Situation Report on  Economic and Monetary  Developments 26 September 2013 The monetary policy decision and  the stance of the CNB  At the close of the meeting the Board decided unanimously to  leave the two-week repo rate unchanged at ,1,2013,2013/09/26,0,14,281,2181
491,./Czechia/tk_06sz2013_aj.pdf, Interest rates will remain at current levels (i.e. at technical zero)  over  longer horizon until inflation pressures increase  ,2,2013,2013/09/26,0,14,129,2181
492,./Czechia/tk_06sz2013_aj.pdf, The CNB is ready to use the exchange rate if further monetary  policy easing becomes ,3,2013,2013/09/26,0,14,86,2181
493,./Czechia/tk_06sz2013_aj.pdf, The probability of launching  foreign exchange interventions has not changed and remains  ,3,2013,2013/09/26,0,14,91,2181
494,./Czechia/tk_06sz2013_aj.pdf,"  Reasons for the decision within  the context of the forecast  Consistent with the forecast is  decline in market interest rates to ,zero  followed by  noticeable rise in rates only in ",4,2013,2013/09/26,0,14,186,2181
495,./Czechia/tk_06sz2013_aj.pdf," Given the zero lower bound on monetary policy,rates  this points to   need for easing monetary policy using other ",5,2013,2013/09/26,0,14,115,2181
496,./Czechia/tk_06sz2013_aj.pdf, The current Inflation Report III/2013 forecast does not predict an  increase in inflation pressures and no tangible risks of such an increase in inflation pressures can be identified ,6,2013,2013/09/26,0,14,184,2181
497,./Czechia/tk_06sz2013_aj.pdf," The risks to the inflation forecast are slightly on the,downside  tilted  towards the need for slightly easier monetary ",7,2013,2013/09/26,0,14,121,2181
501,./Czechia/tk_06sz2013_aj.pdf, The labour market broadly stagnated in 2013:Q2   Total employment ,10,2013,2013/09/26,0,14,67,2181
503,./Czechia/tk_06sz2013_aj.pdf, The share of unemployed persons has been slightly increasing ,10,2013,2013/09/26,0,14,62,2181
504,./Czechia/tk_06sz2013_aj.pdf," The average nominal wage grew by just 1.2%,y-o-y  with faster growth in the non- business sector than in the business ",11,2013,2013/09/26,0,14,119,2181
505,./Czechia/tk_06sz2013_aj.pdf, No cost-push inflation pressures are apparent and the outlook for  administered prices is shifting ,12,2013,2013/09/26,0,14,100,2181
506,./Czechia/tk_06sz2013_aj.pdf,"  Comparison of actual data  with the CNB forecast:Note  in,percentages  for share of unemployed persons comparison of s.a. outcomes in July and August with  forecast for 2013 Q3  Risks to the forecast The risks to the forecast are tilted towards  need for  slightly easier monetary ",13,2013,2013/09/26,0,14,283,2181
507,./Czechia/tk_06sz2013_aj.pdf, Risks in this:direction   lower domestic inflation and administered price outlook  lower wage growth  Thank you for your attention Minutes of the today’s meeting and  the Graph of Risks to the Inflation  Projection (GRIP) will be released  on  October 2013 at :http:,14,2013,2013/09/26,0,14,267,2181
511,./Czechia/tk_08sz2010_aj.pdf, Press conference of the  CNB Bank Board 8th Situation Report on  Economic and Monetary  Developments 2 December 2010 The monetary policy decision taken  and the ratio of the votes cast   At the close of the meeting the Bank Board decided by   majority vote to leave the two-week repo rate unchanged  at ,1,2010,2010/12/22,0,8,304,2054
512,./Czechia/tk_08sz2010_aj.pdf, Six board members voted in favour of this decision and  one member voted for increasing rates by 0.25  percentage ,2,2010,2010/12/22,0,8,115,2054
513,./Czechia/tk_08sz2010_aj.pdf,"  Reasons for the decision   According to the,forecast  headline and monetary-policy  relevant inflation will be close to the 2% target at the  monetary policy ",3,2010,2010/12/22,0,8,160,2054
514,./Czechia/tk_08sz2010_aj.pdf," Consistent with the forecast is stability of market interest  rates close to their current levels,initially  followed by   gradual rise in rates at the longer end of the ",4,2010,2010/12/22,0,8,171,2054
517,./Czechia/tk_08sz2010_aj.pdf," Its growth was driven mainly by investments in  inventories and solar power;stations   Annual growth in industrial production in October (6.9%) indicates   continuing,recovery  but production fell slightly in m-o-m terms;(-0.3%)   The situation on the labour market has ",6,2010,2010/12/22,0,8,271,2054
518,./Czechia/tk_08sz2010_aj.pdf," The drop in total  employment almost halted in Q3,(-0.2%)  ILO unemployment stagnated  (7.2%) and seasonally adjusted registered unemployment even slightly  increased in the course of ",6,2010,2010/12/22,0,8,185,2054
520,./Czechia/tk_08sz2010_aj.pdf," In,November  growth in industrial producer prices (2.7%) and agricultural  producer prices (23.4%) was in line with growing global commodity prices.     Comparison of actual data  with the CNB forecast 10 forecast 8.8 8.9  actual data      2.8  2.7 2.6 2.1 2.0 2.0    GDP,(Q3 2010) inflation (November average wage   unemployment  2010),(Q3 2010),(Q4 2010):Note  for,unemployment   comparison of November data with the forecast for the whole quarter  Major risks to the forecast Forecast risks are balanced Major risks on the:downside    Slower-than-expected nominal wage growth Major risk on the:upside    Growing world commodity prices   Currently weaker koruna exchange rate  Thank you for your attention Minutes of the today’s  meeting will be released on   January 2011 at :http:",8,2010,2010/12/22,0,8,785,2054
521,./Czechia/TK_04SZ2007_EN.pdf," Press Conference of the CNB Bank Board 4th Situation Report on Economic  and Monetary Developments 26 April 2007 The  monetary  policy  decision  taken   and  the  ratio  of  the  votes  cast After discussing the situation,report  the Board decided by   majority vote to leave the CNB two-week repo rate  unchanged at ",1,2007,2007/04/26,0,5,319,1149
522,./Czechia/TK_04SZ2007_EN.pdf," Four members voted in favour of this ,decision  and two members voted for increasing rates by  0.25 of  percentage ",1,2007,2007/04/26,0,5,116,1149
524,./Czechia/TK_04SZ2007_EN.pdf, Comparison  with  the  January   forecast  Compared to the January forecast the rate of growth is higher in 2007 and ,1,2007,2007/04/26,0,5,118,1149
525,./Czechia/TK_04SZ2007_EN.pdf," The real economy will generate inflationary pressures in 2007 and ,2008  whereas according to the January forecast it was only in  ",2,2007,2007/04/26,0,5,132,1149
526,./Czechia/TK_04SZ2007_EN.pdf," Compared to the January,forecast  inflation is initially,higher  but  starting from 3Q 2008 ",3,2007,2007/04/26,0,5,93,1149
527,./Czechia/TK_04SZ2007_EN.pdf, At the monetary policy horizon (2Q-3Q 2008) inflation adjusted for  the first-round effect of indirect taxes (which is relevant for  monetary policy) is in the lower part of the tolerance band of the  inflation ,4,2007,2007/04/26,0,5,212,1149
529,./Czechia/TK_04SZ2007_EN.pdf, Major risks and:uncertainties   new data from domestic economy since the forecast elaboration  external developments  the fiscal reform  exchange rate of the ,5,2007,2007/04/26,0,5,159,1149
530,./Czechia/tk_07sz2011_aj.pdf, Press conference of the CNB Bank Board 7th Situation Report on  Economic and Monetary  Developments  November 2011 The monetary policy decision taken and the ratio of the votes cast  At the close of the meeting the Board decided  by  majority vote to leave the two-week repo rate  unchanged at ,1,2011,2011/11/03,0,19,295,2860
531,./Czechia/tk_07sz2011_aj.pdf," Six members voted in favour of this,decision  and one  member voted for lowering rates by 0.25 percentage  ",2,2011,2011/11/03,0,19,108,2860
532,./Czechia/tk_07sz2011_aj.pdf,  Reasons for the decision  Monetary-policy relevant inflation will be slightly below the  target over the entire forecast ,3,2011,2011/11/03,0,19,123,2860
533,./Czechia/tk_07sz2011_aj.pdf," Headline inflation will rise temporarily to just below 3% in 2012 owing to  VAT ,increase  but will fall back below the target at the start of ",3,2011,2011/11/03,0,19,144,2860
534,./Czechia/tk_07sz2011_aj.pdf, Consistent with the forecast is  slight decline in market interest  rates at the start of the forecast and flat rates until late  2012/early ,4,2011,2011/11/03,0,19,142,2860
535,./Czechia/tk_07sz2011_aj.pdf, The risks to the forecast are skewed towards stable interest  rates in line with the “euro area stagnation” alternative scenario  (see ,5,2011,2011/11/03,0,19,136,2860
536,./Czechia/tk_07sz2011_aj.pdf,"  The message of the forecast  baseline scenario  Inflation pressures from the domestic economy are currently not,significant   commodity prices and food prices are still the main source of ",6,2011,2011/11/03,0,19,190,2860
537,./Czechia/tk_07sz2011_aj.pdf," Headline inflation will rise temporarily to just below 3% in 2012 owing to   VAT,increase  but will fall back below the target at the start of ",7,2011,2011/11/03,0,19,144,2860
538,./Czechia/tk_07sz2011_aj.pdf, Monetary-policy relevant inflation will be slightly below the target over the  entire forecast ,8,2011,2011/11/03,0,19,96,2860
539,./Czechia/tk_07sz2011_aj.pdf, Economic growth in the Czech Republic will continue to slow this ,9,2011,2011/11/03,0,19,66,2860
540,./Czechia/tk_07sz2011_aj.pdf, It will  slow further (to 1.2%) next year as  result of euro area ,9,2011,2011/11/03,0,19,67,2860
542,./Czechia/tk_07sz2011_aj.pdf, The nominal exchange rate is appreciating in the forecast as from the  beginning of ,11,2011,2011/11/03,0,19,85,2860
543,./Czechia/tk_07sz2011_aj.pdf, Consistent with the forecast is  slight decline in market interest rates at the  start of the forecast and flat rates until late 2012/early ,12,2011,2011/11/03,0,19,141,2860
545,./Czechia/tk_07sz2011_aj.pdf, The alternative scenario simulates such foreign  developments that would correspond to the market outlook for euro  interest ,13,2011,2011/11/03,0,19,126,2860
546,./Czechia/tk_07sz2011_aj.pdf," In this,scenario  GDP growth in the euro area slows to almost zero in  ",14,2011,2011/11/03,0,19,72,2860
547,./Czechia/tk_07sz2011_aj.pdf, This transmits immediately to the domestic economy and adversely  influences ,14,2011,2011/11/03,0,19,78,2860
548,./Czechia/tk_07sz2011_aj.pdf, Appreciation of the koruna is markedly slower than in the baseline  ,15,2011,2011/11/03,0,19,69,2860
549,./Czechia/tk_07sz2011_aj.pdf, Weaker exchange rate is associated with higher levels of 3M PRIBOR  compared to the baseline ,16,2011,2011/11/03,0,19,94,2860
550,./Czechia/tk_07sz2011_aj.pdf, Inflation remains broadly at the same levels as in the baseline ,17,2011,2011/11/03,0,19,65,2860
552,./Czechia/tk_07sz2011_aj.pdf," Downside:risks   slower wage growth  substantial deterioration in expected foreign economic growth and further  decline in outlook for world commodity prices and 3M EURIBOR Upside:risks   materialization of the “euro area stagnation” alternative,scenario  leading  to fundamentally weaker koruna exchange rate and lower GDP  weaker koruna exchange rate due to market sentiment 19 Thank you for your attention More information about the forecast  can be found at :http //www.cnb.cz/en/monetary_policy/forecast/ and in Inflation Report,IV/2011  to be published 1 November ",19,2011,2011/11/03,0,19,571,2860
553,./Czechia/tk_02sz2010_aj.pdf," Press conference of the  CNB Bank Board 2nd Situation Report on  Economic and Monetary  Developments March,25  2010 The monetary policy decision taken  and the ratio of the votes cast  At the close of the meeting the Board decided by   majority vote to leave the two-week repo rate unchanged  at ",1,2010,2010/03/25,0,8,297,2107
554,./Czechia/tk_02sz2010_aj.pdf," Four members voted in favour of this,decision  and two  members voted for lowering rates by 0.25 percentage  ",2,2010,2010/03/25,0,8,110,2107
555,./Czechia/tk_02sz2010_aj.pdf,  Reasons for the decision  Headline and monetary-policy relevant inflation will be close  to the 2% target at the monetary policy ,3,2010,2010/03/25,0,8,131,2107
556,./Czechia/tk_02sz2010_aj.pdf, Consistent with the forecast is stability of short-term interest    rates close to current levels in 2010 H1 and  gradual rise in   rates ,4,2010,2010/03/25,0,8,139,2107
557,./Czechia/tk_02sz2010_aj.pdf, New information from Czech economy is generally in line  with the ,5,2010,2010/03/25,0,8,67,2107
560,./Czechia/tk_02sz2010_aj.pdf," Despite  drop in export (-5.5  y-o-y) and import prices (-3.9 ,y-o-y)  both exports and ;  imports started to grow y-o-y in nominal terms (9.1  and,   respectively)  Labour market reacts to the economic slump in 2009 with delay as ",7,2010,2010/03/25,0,8,232,2107
561,./Czechia/tk_02sz2010_aj.pdf," Decline  of employment deepened (-2.1  y-o-y in,2009  Q4) and registered unemployment  continues growing (10.2  in ",7,2010,2010/03/25,0,8,116,2107
562,./Czechia/tk_02sz2010_aj.pdf," Nominal wages accelerated (to 5.2  y-o-y  in,2009  Q4) but only;„seemingly“   February drop in industrial producer prices (-2 %) and agricultural producer prices  (-5.6 %) manifest persisting anti-inflationary effects of commodities‘ and food prices.     Comparison of actual data with  the CNB forecast 12 actual data 10.2 9.9 10 forecast   5.2 4.7   0.9 0.6  -2 -2.7 -4 -3.1 GDP,(Q4 2009) inflation (February 2010) average wage   unemployment ,(Q4 2009),(Q1 2010):Note  for unemployment comparison of February data with forecastfor the quarter   Major risks of the forecast Forecast risks are slightly on the ",7,2010,2010/03/25,0,8,612,2107
563,./Czechia/tk_02sz2010_aj.pdf," Major risks on the:downside   outlook for the foreign interest rates  observed inflation and its short-term outlook Major risk on the:upside   no marked asymmetric risks in this direction have been identified Risk to both:sides    nominal wages development  Thank you for your attention Minutes from today‘s  meeting will be released on  April,  2010 at:http:",8,2010,2010/03/25,0,8,360,2107
564,./Czechia/tk_05sz2010_aj.pdf, Press conference of the CNB Bank Board 5th Situation Report on  Economic and Monetary  Developments  August 2010 The monetary policy decision taken and the ratio of the votes cast  At the close of the meeting the Bank Board decided  unanimously to leave the two-week repo rate unchanged  at ,1,2010,2010/08/05,0,11,292,1760
566,./Czechia/tk_05sz2010_aj.pdf,  Reasons for the decision  Headline and monetary-policy relevant inflation will be at  the 2% target over the monetary policy ,3,2010,2010/08/05,0,11,127,1760
568,./Czechia/tk_05sz2010_aj.pdf," Consistent with the forecast is stability of market interest  rates close to their current levels,initially  followed by   gradual rise in rates as from 2011 ",5,2010,2010/08/05,0,11,159,1760
569,./Czechia/tk_05sz2010_aj.pdf,  The message of the forecast  Headline inflation will quickly rise over the forecast and at the end of 2010 it  will temporarily exceed the inflation target ,6,2010,2010/08/05,0,11,158,1760
570,./Czechia/tk_05sz2010_aj.pdf," After the unwinding of these ,impacts  headline inflation will slow slightly and will be close to the inflation  ",6,2010,2010/08/05,0,11,114,1760
571,./Czechia/tk_05sz2010_aj.pdf, Monetary-policy relevant inflation will continuously grow over the forecast  and will be approaching the target in 2011 ,7,2010,2010/08/05,0,11,121,1760
572,./Czechia/tk_05sz2010_aj.pdf," The economy has recovered from the,recession  but the recovery is only  modest and more robust economic growth can be expected only in 2011- 2012  The nominal exchange rate is gradually appreciating over the forecast ",8,2010,2010/08/05,0,11,218,1760
573,./Czechia/tk_05sz2010_aj.pdf," Consistent with the forecast is stability of market interest rates close to their  current levels,initially  followed by  gradual rise in rates as from 2011 ",9,2010,2010/08/05,0,11,158,1760
575,./Czechia/tk_05sz2010_aj.pdf," Downside:risks   current exchange rate developments  planned fiscal consolidation  Upside:risk   commodity prices developments 13 Thank you for your attention More information about the  forecast can be found at :http //www.cnb.cz/en/monetary_policy/forecast/ and in Inflation Report,III/2010   to be published 13 August  ",11,2010,2010/08/05,0,11,323,1760
583,./Czechia/tk_01sz2009_aj.pdf," Press Conference of the CNB Bank Board 1st Situation Report on Economic  and Monetary Developments  February 2009 The  monetary  policy  decision  taken   and  the  ratio  of  the  votes  cast At the close of the meeting the Board decided by   majority vote to decrease the CNB two-week repo  rate by 0.50 percentage point to 1.75,  effective      February ",1,2009,2009/02/05,0,14,358,2251
584,./Czechia/tk_01sz2009_aj.pdf," At the same time it decided to  decrease the discount rate and Lombard rate by the  same,amount  to 0.75  and 2.75  ",1,2009,2009/02/05,0,14,117,2251
585,./Czechia/tk_01sz2009_aj.pdf," Four members voted in favour of this,decision  one  member voted for decreasing rates by 0.25  percentage,point  and one member voted for  decreasing rates by 0.75 percentage ",2,2009,2009/02/05,0,14,176,2251
586,./Czechia/tk_01sz2009_aj.pdf, Message  of  the  forecast  Headline (and monetary-policy relevant) inflation will drop this  year towards zero values but it will start rising at the end of the year  and approach the 2% inflation target in the first half of ,2,2009,2009/02/05,0,14,227,2251
587,./Czechia/tk_01sz2009_aj.pdf," The domestic economic growth will sharply,decelerate  forecasted growth is zero or slightly negative this year and around 1% in the  next ",3,2009,2009/02/05,0,14,139,2251
588,./Czechia/tk_01sz2009_aj.pdf, The nominal exchange rate will initially correct its depreciation  observed at the beginning of 2009 and will be broadly stable  ,4,2009,2009/02/05,0,14,130,2251
589,./Czechia/tk_01sz2009_aj.pdf, Consistent with the forecast is  decline in market interest ,5,2009,2009/02/05,0,14,61,2251
591,./Czechia/tk_01sz2009_aj.pdf," The main aim of this change is to further increase the ,transparency  clarity and predictability of monetary ",6,2009,2009/02/05,0,14,110,2251
592,./Czechia/tk_01sz2009_aj.pdf," Identically to the forecast for other key,variables  the exchange  rate forecast is published as  fan ",7,2009,2009/02/05,0,14,103,2251
593,./Czechia/tk_01sz2009_aj.pdf, The published trajectory is conditional on the assumptions of the  forecast and on information available at the time it was ,8,2009,2009/02/05,0,14,125,2251
594,./Czechia/tk_01sz2009_aj.pdf, It can not be considered  commitment or preferred trajectory  from the CNB's point of ,9,2009,2009/02/05,0,14,87,2251
596,./Czechia/tk_01sz2009_aj.pdf," Forecast of,exports  investment and household consumption is  revised downwards ",10,2009,2009/02/05,0,14,81,2251
597,./Czechia/tk_01sz2009_aj.pdf," Compared to the previous,forecast  the forecast for both headline and  monetary-policy relevant inflation is markedly lower in 2009  whereas in 2010 is roughly the ",11,2009,2009/02/05,0,14,165,2251
598,./Czechia/tk_01sz2009_aj.pdf," Compared to the previous,forecast  the interest rate path lies slightly  higher in 2009,but  on the,contrary  lower in ",12,2009,2009/02/05,0,14,120,2251
599,./Czechia/tk_01sz2009_aj.pdf, The CZK/EUR exchange rate forecast is substantially weaker than in  the previous ,13,2009,2009/02/05,0,14,82,2251
601,./Czechia/tk_01sz2009_aj.pdf, Major risks and:uncertainties   deeper and longer-lasting decline in economic activity  abroad   depreciated exchange ,14,2009,2009/02/05,0,14,119,2251
602,./Czechia/TK_07SZ2007_AJ.pdf," Press Conference of the CNB Bank Board 7th Situation Report on Economic  and Monetary Developments 26 July 2007 The  monetary  policy  decision  taken   and  the  ratio  of  the  votes  cast At the close of the meeting the Board decided by  majority  vote to increase the CNB two-week repo rate by 0.25  percentage points to 3.0,  effective 27 July ",1,2007,2007/07/26,0,6,350,1447
603,./Czechia/TK_07SZ2007_AJ.pdf," At the  same time it decided to increase the discount rate and  Lombard rate by the same,amount  to 2.0  and 4.0   ",1,2007,2007/07/26,0,6,116,1447
604,./Czechia/TK_07SZ2007_AJ.pdf," Six members voted in favour of this,decision   and one member voted for increasing the rates by 0.5  percentage ",1,2007,2007/07/26,0,6,113,1447
606,./Czechia/TK_07SZ2007_AJ.pdf, Comparison  with  the  April  forecast  Compared to the April forecast the rate of growth is higher in 2007  and ,1,2007,2007/07/26,0,6,114,1447
607,./Czechia/TK_07SZ2007_AJ.pdf, The real economy will generate higher inflationary pressures  mainly in 2007 by comparison to the April ,2,2007,2007/07/26,0,6,105,1447
608,./Czechia/TK_07SZ2007_AJ.pdf," Compared to the April,forecast  inflation is higher especially in  ",3,2007,2007/07/26,0,6,68,1447
609,./Czechia/TK_07SZ2007_AJ.pdf, At the monetary policy horizon (2H 2008) inflation lies  slightly above the upper margin of the tolerance band of the  inflation ,3,2007,2007/07/26,0,6,130,1447
610,./Czechia/TK_07SZ2007_AJ.pdf, Inflation adjusted for the first-round effects of indirect taxes ,4,2007,2007/07/26,0,6,66,1447
611,./Czechia/TK_07SZ2007_AJ.pdf, monetary-policy relevant inflation) is also higher than in April and  lies in the upper half of the tolerance band of the inflation ,5,2007,2007/07/26,0,6,133,1447
613,./Czechia/TK_07SZ2007_AJ.pdf, Major risks and:uncertainties   new data from the domestic economy since the forecast elaboration  shift in outlook of external developments  possible lower increase in inflation expectations (an alternative  scenario)   CZK/EUR exchange rate  fiscal ,6,2007,2007/07/26,0,6,252,1447
618,./Czechia/tk_03sz2012_aj.pdf, Press conference of the  CNB Bank Board 3rd Situation Report on  Economic and Monetary  Developments  May 2012 The monetary policy decision taken  and the ratio of the votes cast   At the close of the meeting the Board decided  by  majority vote to leave the two-week repo rate  unchanged at ,1,2012,2012/05/03,0,16,293,2558
619,./Czechia/tk_03sz2012_aj.pdf," Four members voted in favour of this,decision  two  members voted for lowering rates by 0.25 percentage ,point  and one member voted for increasing rates by 0.25  percentage ",2,2012,2012/05/03,0,16,175,2558
620,./Czechia/tk_03sz2012_aj.pdf,  Reasons for the decision   Headline inflation will be close to its current elevated level as   result of  VAT ,3,2012,2012/05/03,0,16,112,2558
621,./Czechia/tk_03sz2012_aj.pdf, Monetary-policy relevant inflation will  be in the upper half of the tolerance band this ,3,2012,2012/05/03,0,16,90,2558
622,./Czechia/tk_03sz2012_aj.pdf, Both  headline and monetary-policy relevant inflation will fall slightly  below the target in ,3,2012,2012/05/03,0,16,95,2558
623,./Czechia/tk_03sz2012_aj.pdf, Consistent with the forecast is  decline in market interest rates  in the remainder of this year followed by  rise in rates as from  2013 ,4,2012,2012/05/03,0,16,139,2558
625,./Czechia/tk_03sz2012_aj.pdf,  The message of the forecast  baseline scenario   Domestic factors (weak domestic demand and moderate wage growth) are currently  curbing ,6,2012,2012/05/03,0,16,139,2558
626,./Czechia/tk_03sz2012_aj.pdf," The VAT,increase  food,prices  administered prices and the gradual  pass-through of the past weaker exchange rate to prices are the main sources of  ",6,2012,2012/05/03,0,16,150,2558
627,./Czechia/tk_03sz2012_aj.pdf," Headline inflation will be close to the current elevated values in,2012  but will fall  below the target in ",7,2012,2012/05/03,0,16,109,2558
628,./Czechia/tk_03sz2012_aj.pdf," Monetary-policy relevant inflation will be in the upper half of  the tolerance band this,year  but will fall slightly below the target in ",7,2012,2012/05/03,0,16,139,2558
629,./Czechia/tk_03sz2012_aj.pdf, The Czech economy will stagnate this year as  result of  marked slowdown in  external demand and continuing domestic fiscal ,8,2012,2012/05/03,0,16,125,2558
630,./Czechia/tk_03sz2012_aj.pdf," Next,year  in  connection with an external demand,recovery  GDP growth will be just below ",8,2012,2012/05/03,0,16,91,2558
632,./Czechia/tk_03sz2012_aj.pdf, Consistent with the forecast is  decline in market interest rates in the remainder of  this year followed by  rise in rates as from 2013 ,10,2012,2012/05/03,0,16,138,2558
634,./Czechia/tk_03sz2012_aj.pdf, Fiscal restriction through  rise in both VAT rates and lower nominal disposable  income of households will reduce household consumption in ,12,2012,2012/05/03,0,16,140,2558
635,./Czechia/tk_03sz2012_aj.pdf, This will  result in slower GDP growth compared to the baseline ,12,2012,2012/05/03,0,16,65,2558
636,./Czechia/tk_03sz2012_aj.pdf, The first-round effects of the increase in both VAT rates will cause headline inflation  to ,13,2012,2012/05/03,0,16,93,2558
637,./Czechia/tk_03sz2012_aj.pdf," In line with past experience and the subdued economic,activity  no significant  second-round effects of the VAT rate hike on inflation are ",14,2012,2012/05/03,0,16,140,2558
638,./Czechia/tk_03sz2012_aj.pdf, The lower interest rates from the end of 2012 onwards are thus reacting only to the  anti-inflationary pressure (visible in monetary-policy relevant inflation) generated by  the slower GDP ,15,2012,2012/05/03,0,16,190,2558
