,filename,sentence,paragraph_index,year,date,paragraphs,num_char_sentence,total_chars
2594,https://www.cnb.cz/en/monetary-policy/bank-board-decisions/CNB-Board-decisions-2015-1450257360000-00001/?tab=statement,"The growth rate of the Czech economy slowed somewhat to 4.5% in Q3, whereas the forecast had expected it to accelerate slightly.",6.0,2015,16/12/2015,13.0,128.0,8186.0
2595,https://www.cnb.cz/en/monetary-policy/bank-board-decisions/CNB-Board-decisions-2015-1450257360000-00001/?tab=statement,The 0.3 percentage point deviation of GDP growth from the forecast was due to a smaller contribution of household consumption.,6.0,2015,16/12/2015,13.0,126.0,8186.0
2596,https://www.cnb.cz/en/monetary-policy/bank-board-decisions/CNB-Board-decisions-2015-1450257360000-00001/?tab=statement,Annual growth in total investment was also slightly below the CNB forecast.,6.0,2015,16/12/2015,13.0,75.0,8186.0
2597,https://www.cnb.cz/en/monetary-policy/bank-board-decisions/CNB-Board-decisions-2015-1450257360000-00001/?tab=statement,"However, fixed investment was a moderately positive surprise and the resulting overall downward deviation was thus due solely to the traditionally volatile inventories.",6.0,2015,16/12/2015,13.0,168.0,8186.0
2598,https://www.cnb.cz/en/monetary-policy/bank-board-decisions/CNB-Board-decisions-2015-1450257360000-00001/?tab=statement,All components of domestic demand contributed to the year-on-year increase in GDP. The contribution of net exports was again slightly negative.,6.0,2015,16/12/2015,13.0,143.0,8186.0
2599,https://www.cnb.cz/en/monetary-policy/bank-board-decisions/CNB-Board-decisions-2015-1450257360000-00001/?tab=statement,New information on developments abroad obtained from the December Consensus Forecasts suggests that demand in the effective euro area will continue to rise at a steady pace close to 2%.,7.0,2015,16/12/2015,13.0,185.0,8186.0
2600,https://www.cnb.cz/en/monetary-policy/bank-board-decisions/CNB-Board-decisions-2015-1450257360000-00001/?tab=statement,"By contrast, the forecast for euro area producer prices has been revised downwards for the rest of this year and the first half of next year.",7.0,2015,16/12/2015,13.0,141.0,8186.0
2601,https://www.cnb.cz/en/monetary-policy/bank-board-decisions/CNB-Board-decisions-2015-1450257360000-00001/?tab=statement,Growth in producer prices is still not expected to resume until next year as the effect of the fall in oil prices unwinds.,7.0,2015,16/12/2015,13.0,122.0,8186.0
2602,https://www.cnb.cz/en/monetary-policy/bank-board-decisions/CNB-Board-decisions-2015-1450257360000-00001/?tab=statement,The outlook for consumer price inflation has been lowered only slightly.,7.0,2015,16/12/2015,13.0,72.0,8186.0
2603,https://www.cnb.cz/en/monetary-policy/bank-board-decisions/CNB-Board-decisions-2015-1450257360000-00001/?tab=statement,Inflation in the effective euro area is thus expected to rise gradually from close to zero this year towards 2% at the close of next year.,7.0,2015,16/12/2015,13.0,138.0,8186.0
2604,https://www.cnb.cz/en/monetary-policy/bank-board-decisions/CNB-Board-decisions-2015-1450257360000-00001/?tab=statement,The market outlook for the three-month Euribor has declined by 0.1 percentage point on average and is slightly negative for the next two years.,7.0,2015,16/12/2015,13.0,143.0,8186.0
2605,https://www.cnb.cz/en/monetary-policy/bank-board-decisions/CNB-Board-decisions-2015-1450257360000-00001/?tab=statement,"The shift of the interest rate outlook compared to the assumptions of the current forecast reflects continued subdued inflation in the euro area and the reaction of the European Central Bank, which lowered its deposit rate to a more negative level and extended its quantitative easing programme at least until the end of March 2017.",7.0,2015,16/12/2015,13.0,332.0,8186.0
2606,https://www.cnb.cz/en/monetary-policy/bank-board-decisions/CNB-Board-decisions-2015-1450257360000-00001/?tab=statement,The market outlook for the Brent crude oil price in the next two years has been lowered significantly.,8.0,2015,16/12/2015,13.0,102.0,8186.0
2607,https://www.cnb.cz/en/monetary-policy/bank-board-decisions/CNB-Board-decisions-2015-1450257360000-00001/?tab=statement,"The Brent price is therefore expected to rise only gradually until the end of 2017, from its current level below USD 40 a barrel to around USD 54 a barrel.",8.0,2015,16/12/2015,13.0,155.0,8186.0
2608,https://www.cnb.cz/en/monetary-policy/bank-board-decisions/CNB-Board-decisions-2015-1450257360000-00001/?tab=statement,"However, this factor represents a positive supply-side shock to the Czech economy and the Bank Board points out that its first-round effects are exempted as a rule.",8.0,2015,16/12/2015,13.0,164.0,8186.0
2609,https://www.cnb.cz/en/monetary-policy/bank-board-decisions/CNB-Board-decisions-2015-1450257360000-00001/?tab=statement,"Compared with the assumptions of the current forecast, the outlook for the euro-dollar exchange rate has shifted to a weaker level.",8.0,2015,16/12/2015,13.0,131.0,8186.0
2610,https://www.cnb.cz/en/monetary-policy/bank-board-decisions/CNB-Board-decisions-2015-1450257360000-00001/?tab=statement,"The rapid domestic economic growth is fostering a further improvement in the labour market situation, broadly in line with the forecast.",9.0,2015,16/12/2015,13.0,136.0,8186.0
2611,https://www.cnb.cz/en/monetary-policy/bank-board-decisions/CNB-Board-decisions-2015-1450257360000-00001/?tab=statement,"Annual growth in total employment again exceeded 1% in 2015 Q3. Growth in labour demand is also documented by a high number of vacancies, which has been above 100,000 for several months, roughly double the level of a year earlier.",9.0,2015,16/12/2015,13.0,230.0,8186.0
2612,https://www.cnb.cz/en/monetary-policy/bank-board-decisions/CNB-Board-decisions-2015-1450257360000-00001/?tab=statement,The general unemployment rate fell further in Q3 and the decline in the seasonally adjusted share of unemployed persons has also continued in Q4 so far.,9.0,2015,16/12/2015,13.0,152.0,8186.0
2613,https://www.cnb.cz/en/monetary-policy/bank-board-decisions/CNB-Board-decisions-2015-1450257360000-00001/?tab=statement,"At the end of November, labour offices registered around 431,000 job applicants, 86,000 fewer than in the same period of last year.",9.0,2015,16/12/2015,13.0,131.0,8186.0
2614,https://www.cnb.cz/en/monetary-policy/bank-board-decisions/CNB-Board-decisions-2015-1450257360000-00001/?tab=statement,"Annual growth in the average wage in the economy accelerated to 3.8% in Q3, driven by the business sector, and was therefore slightly above the forecast.",9.0,2015,16/12/2015,13.0,153.0,8186.0
2615,https://www.cnb.cz/en/monetary-policy/bank-board-decisions/CNB-Board-decisions-2015-1450257360000-00001/?tab=statement,Indicators from the real economy point to continued robust economic growth in 2015 Q4. Industrial production and retail sales are also still rising apace year on year in both the automotive and non-automotive segments.,10.0,2015,16/12/2015,13.0,218.0,8186.0
2616,https://www.cnb.cz/en/monetary-policy/bank-board-decisions/CNB-Board-decisions-2015-1450257360000-00001/?tab=statement,"Only construction output saw a slight year-on-year decline in October for the first time in quite a while, amid continuing growth in civil engineering construction related to government investment in infrastructure.",10.0,2015,16/12/2015,13.0,215.0,8186.0
2617,https://www.cnb.cz/en/monetary-policy/bank-board-decisions/CNB-Board-decisions-2015-1450257360000-00001/?tab=statement,"The price decrease in manufacturing, which had been deepening since June 2015, has moderated somewhat in Q4 so far.",11.0,2015,16/12/2015,13.0,115.0,8186.0
2618,https://www.cnb.cz/en/monetary-policy/bank-board-decisions/CNB-Board-decisions-2015-1450257360000-00001/?tab=statement,"Following more than two years of decline, agricultural producer prices returned to year-on-year growth.",11.0,2015,16/12/2015,13.0,103.0,8186.0
2619,https://www.cnb.cz/en/monetary-policy/bank-board-decisions/CNB-Board-decisions-2015-1450257360000-00001/?tab=statement,"Prices in market services were flat year on year, whereas construction work prices continued to rise moderately.",11.0,2015,16/12/2015,13.0,112.0,8186.0
2620,https://www.cnb.cz/en/monetary-policy/bank-board-decisions/CNB-Board-decisions-2015-1450257360000-00001/?tab=statement,"To sum up the important facts about recent developments in the Czech economy, annual GDP growth was slightly below the forecast in 2015 Q3 and inflation was markedly lower than forecasted in November.",12.0,2015,16/12/2015,13.0,200.0,8186.0
2621,https://www.cnb.cz/en/monetary-policy/bank-board-decisions/CNB-Board-decisions-2015-1450257360000-00001/?tab=statement,"By contrast, the average wage increased slightly faster than expected in Q3, owing to developments in the business sector. Unemployment has been approximately in line with the forecast so far in Q4.",12.0,2015,16/12/2015,13.0,198.0,8186.0
2622,https://www.cnb.cz/en/monetary-policy/bank-board-decisions/CNB-Board-decisions-2015-1450257360000-00001/?tab=statement,"The anti-inflationary risks stemming from the observed year-on-year stagnation in domestic food prices and continued deflation abroad, including a further decline in oil prices, will be offset next year by faster growth in domestic wages and probable non-materialisation of the forecasted decline in administered prices.",13.0,2015,16/12/2015,13.0,320.0,8186.0
2623,https://www.cnb.cz/en/monetary-policy/bank-board-decisions/CNB-Board-decisions-2015-1450257360000-00001/?tab=statement,The Bank Board therefore assessed the risks to the forecast at the monetary policy horizon as being broadly balanced.,13.0,2015,16/12/2015,13.0,117.0,8186.0
2624,https://www.cnb.cz/en/monetary-policy/bank-board-decisions/CNB-Board-decisions-2015-1450257360000-00001/?tab=statement,The Bank Board’s repeated statements that the CNB will not discontinue the use of the exchange rate as a monetary policy instrument before the second half of 2016 remain valid.,13.0,2015,16/12/2015,13.0,176.0,8186.0
2625,https://www.cnb.cz/en/monetary-policy/bank-board-decisions/CNB-Board-decisions-2015-1450257360000-00001/?tab=statement,"At the same time, the Bank Board stated again that the likely timing of the discontinuation of the exchange rate commitment is around the end of 2016.",13.0,2015,16/12/2015,13.0,150.0,8186.0
2626,,,,,,,,
2627,https://www.cnb.cz/en/monetary-policy/bank-board-decisions/CNB-Board-decisions-2015-1446715500000-00001/?tab=statement,"<At its meeting today, the Bank Board of the Czech National Bank decided unanimously to keep interest rates unchanged at technical zero.",2.0,2015,5/11/2015,12.0,136.0,7749.0
2628,https://www.cnb.cz/en/monetary-policy/bank-board-decisions/CNB-Board-decisions-2015-1446715500000-00001/?tab=statement,The Bank Board also decided to continue using the exchange rate as an additional instrument for easing the monetary conditions and confirmed the CNB’s commitment to intervene on the foreign exchange market if needed to weaken the koruna so that the exchange rate of the koruna is kept close to CZK 27 to the euro.,2.0,2015,5/11/2015,12.0,313.0,7749.0
2629,https://www.cnb.cz/en/monetary-policy/bank-board-decisions/CNB-Board-decisions-2015-1446715500000-00001/?tab=statement,"In line with this, the Czech National Bank still stands ready to intervene automatically, i.e. without the need for an additional decision of the Bank Board, and without any time or volume limits.",2.0,2015,5/11/2015,12.0,196.0,7749.0
2630,https://www.cnb.cz/en/monetary-policy/bank-board-decisions/CNB-Board-decisions-2015-1446715500000-00001/?tab=statement,"The asymmetric nature of this exchange rate commitment, i.e. the willingness only to intervene against appreciation of the koruna below the announced level, is unchanged.</",2.0,2015,5/11/2015,12.0,172.0,7749.0
2631,https://www.cnb.cz/en/monetary-policy/bank-board-decisions/CNB-Board-decisions-2015-1446715500000-00001/?tab=statement,This decision is underpinned by a new macroeconomic forecast.,3.0,2015,5/11/2015,12.0,61.0,7749.0
2632,https://www.cnb.cz/en/monetary-policy/bank-board-decisions/CNB-Board-decisions-2015-1446715500000-00001/?tab=statement,The forecast assumes that market interest rates will be flat at their current very low level and the koruna exchange rate will be used as a monetary policy instrument until the end of 2016.,3.0,2015,5/11/2015,12.0,189.0,7749.0
2633,https://www.cnb.cz/en/monetary-policy/bank-board-decisions/CNB-Board-decisions-2015-1446715500000-00001/?tab=statement,Inflation is still well below the CNB’s target of 2%.,3.0,2015,5/11/2015,12.0,53.0,7749.0
2634,https://www.cnb.cz/en/monetary-policy/bank-board-decisions/CNB-Board-decisions-2015-1446715500000-00001/?tab=statement,"According to the forecast, inflation will increase and hit the 2% target at the monetary policy horizon.",3.0,2015,5/11/2015,12.0,104.0,7749.0
2635,https://www.cnb.cz/en/monetary-policy/bank-board-decisions/CNB-Board-decisions-2015-1446715500000-00001/?tab=statement,"In 2017, it will be slightly above the target.",3.0,2015,5/11/2015,12.0,46.0,7749.0
2636,https://www.cnb.cz/en/monetary-policy/bank-board-decisions/CNB-Board-decisions-2015-1446715500000-00001/?tab=statement,"According to the forecast, sustainable fulfilment of the target, which is a condition for a return to conventional monetary policy, will occur from early 2017.",3.0,2015,5/11/2015,12.0,159.0,7749.0
2637,https://www.cnb.cz/en/monetary-policy/bank-board-decisions/CNB-Board-decisions-2015-1446715500000-00001/?tab=statement,The Bank Board assesses the risks to the new forecast as balanced.,3.0,2015,5/11/2015,12.0,66.0,7749.0
2638,https://www.cnb.cz/en/monetary-policy/bank-board-decisions/CNB-Board-decisions-2015-1446715500000-00001/?tab=statement,A need to maintain significantly expansionary monetary conditions persists.,4.0,2015,5/11/2015,12.0,75.0,7749.0
2639,https://www.cnb.cz/en/monetary-policy/bank-board-decisions/CNB-Board-decisions-2015-1446715500000-00001/?tab=statement,The likelihood that it will be necessary to discontinue the exchange rate commitment earlier than assumed in the forecast is decreasing over time.,4.0,2015,5/11/2015,12.0,146.0,7749.0
2640,https://www.cnb.cz/en/monetary-policy/bank-board-decisions/CNB-Board-decisions-2015-1446715500000-00001/?tab=statement,"In this situation, the Bank Board discussed extending the duration of the exchange rate commitment.",4.0,2015,5/11/2015,12.0,99.0,7749.0
2641,https://www.cnb.cz/en/monetary-policy/bank-board-decisions/CNB-Board-decisions-2015-1446715500000-00001/?tab=statement,It agreed that its discontinuation would probably shift to around the end of 2016.,4.0,2015,5/11/2015,12.0,82.0,7749.0
2642,https://www.cnb.cz/en/monetary-policy/bank-board-decisions/CNB-Board-decisions-2015-1446715500000-00001/?tab=statement,"The subsequent return to conventional monetary policy will not imply appreciation of the exchange rate at the monetary policy horizon to the slightly overvalued level recorded before the CNB started intervening, among other things because the weaker exchange rate of the koruna is in the meantime passing through to domestic prices and other nominal variables.",4.0,2015,5/11/2015,12.0,360.0,7749.0
2643,https://www.cnb.cz/en/monetary-policy/bank-board-decisions/CNB-Board-decisions-2015-1446715500000-00001/?tab=statement,"As regards the assumptions of the forecast regarding the external environment, growth in economic activity in the euro area will accelerate slightly further in the near future and fluctuate around 2% over the entire forecast horizon.",5.0,2015,5/11/2015,12.0,233.0,7749.0
2644,https://www.cnb.cz/en/monetary-policy/bank-board-decisions/CNB-Board-decisions-2015-1446715500000-00001/?tab=statement,"Industrial producer prices in the euro area are still falling markedly owing to low energy commodity prices and are not expected to return to year-on-year growth until the second half of next year, i.e. later than assumed in the previous forecast.",5.0,2015,5/11/2015,12.0,247.0,7749.0
2645,https://www.cnb.cz/en/monetary-policy/bank-board-decisions/CNB-Board-decisions-2015-1446715500000-00001/?tab=statement,"The currently low consumer price inflation in the euro area will rise gradually owing to rising demand and the unwinding of the effect of the slump in oil prices, but will not exceed 2% before the end of 2017.",5.0,2015,5/11/2015,12.0,209.0,7749.0
2646,https://www.cnb.cz/en/monetary-policy/bank-board-decisions/CNB-Board-decisions-2015-1446715500000-00001/?tab=statement,The subdued inflation is reflected in accommodative ECB monetary policy.,5.0,2015,5/11/2015,12.0,72.0,7749.0
2647,https://www.cnb.cz/en/monetary-policy/bank-board-decisions/CNB-Board-decisions-2015-1446715500000-00001/?tab=statement,"This is reflected in the outlook for 3M Euribor rates, which remain close to zero over the entire forecast horizon.",5.0,2015,5/11/2015,12.0,115.0,7749.0
2648,https://www.cnb.cz/en/monetary-policy/bank-board-decisions/CNB-Board-decisions-2015-1446715500000-00001/?tab=statement,The Brent crude oil price has declined recently.,6.0,2015,5/11/2015,12.0,48.0,7749.0
2649,https://www.cnb.cz/en/monetary-policy/bank-board-decisions/CNB-Board-decisions-2015-1446715500000-00001/?tab=statement,"According to market outlooks, it should rise slowly.",6.0,2015,5/11/2015,12.0,52.0,7749.0
2650,https://www.cnb.cz/en/monetary-policy/bank-board-decisions/CNB-Board-decisions-2015-1446715500000-00001/?tab=statement,Its outlook has been revised downwards slightly over the entire horizon compared to the previous forecast.,6.0,2015,5/11/2015,12.0,106.0,7749.0
2651,https://www.cnb.cz/en/monetary-policy/bank-board-decisions/CNB-Board-decisions-2015-1446715500000-00001/?tab=statement,Koruna prices of energy will also be affected by the outlook for a gradually weakening exchange rate of the euro against the dollar in 2016.,6.0,2015,5/11/2015,12.0,140.0,7749.0
2652,https://www.cnb.cz/en/monetary-policy/bank-board-decisions/CNB-Board-decisions-2015-1446715500000-00001/?tab=statement,Domestic headline inflation fell in 2015 Q3 as a result of a marked slowdown in annual food price inflation and an acceleration of the decline in fuel prices.,7.0,2015,5/11/2015,12.0,158.0,7749.0
2653,https://www.cnb.cz/en/monetary-policy/bank-board-decisions/CNB-Board-decisions-2015-1446715500000-00001/?tab=statement,"The anti-inflationary effect of import prices stemming from the fall in euro area producer prices and global commodity prices will subside gradually, and import prices will be slightly inflationary in the second half of next year.",7.0,2015,5/11/2015,12.0,230.0,7749.0
2654,https://www.cnb.cz/en/monetary-policy/bank-board-decisions/CNB-Board-decisions-2015-1446715500000-00001/?tab=statement,The growing domestic economy will foster higher costs and consequently higher consumer prices over the entire forecast horizon via accelerating wage growth and rising prices of other inputs.,7.0,2015,5/11/2015,12.0,190.0,7749.0
2655,https://www.cnb.cz/en/monetary-policy/bank-board-decisions/CNB-Board-decisions-2015-1446715500000-00001/?tab=statement,"This will be reflected in a gradual rise in headline inflation, which will hit the 2% target at the monetary policy horizon and exceed it slightly in 2017.",7.0,2015,5/11/2015,12.0,155.0,7749.0
2656,https://www.cnb.cz/en/monetary-policy/bank-board-decisions/CNB-Board-decisions-2015-1446715500000-00001/?tab=statement,"Monetary policy-relevant inflation, i.e. inflation adjusted for the first-round effects of changes to indirect taxes, will follow a similar path to headline inflation.",8.0,2015,5/11/2015,12.0,167.0,7749.0
2657,https://www.cnb.cz/en/monetary-policy/bank-board-decisions/CNB-Board-decisions-2015-1446715500000-00001/?tab=statement,It will be only slightly lower owing to positive contributions from changes to indirect taxes stemming from further increases in excise duty on tobacco products.,8.0,2015,5/11/2015,12.0,161.0,7749.0
2658,https://www.cnb.cz/en/monetary-policy/bank-board-decisions/CNB-Board-decisions-2015-1446715500000-00001/?tab=statement,"It, too, will thus be slightly above the 2% target as from the start of 2017.",8.0,2015,5/11/2015,12.0,77.0,7749.0
2659,https://www.cnb.cz/en/monetary-policy/bank-board-decisions/CNB-Board-decisions-2015-1446715500000-00001/?tab=statement,"Annual growth in the Czech economy picked up further in 2015 Q2. As a result, economic output approached its potential from below.",9.0,2015,5/11/2015,12.0,130.0,7749.0
2660,https://www.cnb.cz/en/monetary-policy/bank-board-decisions/CNB-Board-decisions-2015-1446715500000-00001/?tab=statement,"All expenditure components, in particular fixed investment and household consumption, contributed to the year-on-year growth in GDP. The economy will continue to show robust growth for the rest of this year.",9.0,2015,5/11/2015,12.0,207.0,7749.0
2661,https://www.cnb.cz/en/monetary-policy/bank-board-decisions/CNB-Board-decisions-2015-1446715500000-00001/?tab=statement,"Low oil prices, easy domestic monetary conditions and higher government investment will lead to GDP growth of 4.7% this year.",9.0,2015,5/11/2015,12.0,125.0,7749.0
2662,https://www.cnb.cz/en/monetary-policy/bank-board-decisions/CNB-Board-decisions-2015-1446715500000-00001/?tab=statement,"Next year, economic growth will slow somewhat to just below 3%.",9.0,2015,5/11/2015,12.0,63.0,7749.0
2663,https://www.cnb.cz/en/monetary-policy/bank-board-decisions/CNB-Board-decisions-2015-1446715500000-00001/?tab=statement,This slowdown will be due to a fall in government investment and the unwinding of the effect of the fall in oil prices.,9.0,2015,5/11/2015,12.0,119.0,7749.0
2664,https://www.cnb.cz/en/monetary-policy/bank-board-decisions/CNB-Board-decisions-2015-1446715500000-00001/?tab=statement,"The economy will maintain a similar rate of growth in 2017, with positive contributions from all components of domestic demand.",9.0,2015,5/11/2015,12.0,127.0,7749.0
2665,https://www.cnb.cz/en/monetary-policy/bank-board-decisions/CNB-Board-decisions-2015-1446715500000-00001/?tab=statement,"The rising economic activity will manifest itself in continued employment growth, which will result in a further decrease in the number of unemployed persons.",9.0,2015,5/11/2015,12.0,158.0,7749.0
2666,https://www.cnb.cz/en/monetary-policy/bank-board-decisions/CNB-Board-decisions-2015-1446715500000-00001/?tab=statement,"In this situation, wage growth in the business sector will increase noticeably and wage growth in the non-business sector will slow somewhat from its current high level.",9.0,2015,5/11/2015,12.0,169.0,7749.0
2667,https://www.cnb.cz/en/monetary-policy/bank-board-decisions/CNB-Board-decisions-2015-1446715500000-00001/?tab=statement,The forecast assumes that market interest rates will be flat at their current very low level and the exchange rate will be used as a monetary policy instrument until the end of 2016.,10.0,2015,5/11/2015,12.0,182.0,7749.0
2668,https://www.cnb.cz/en/monetary-policy/bank-board-decisions/CNB-Board-decisions-2015-1446715500000-00001/?tab=statement,Consistent with the forecast is an increase in interest rates amid gradual appreciation of the koruna in 2017.,10.0,2015,5/11/2015,12.0,110.0,7749.0
2669,https://www.cnb.cz/en/monetary-policy/bank-board-decisions/CNB-Board-decisions-2015-1446715500000-00001/?tab=statement,"Compared to the previous forecast, the predictions for headline and monetary policy-relevant inflation are lower until 2016 Q3 owing to lower observed inflation and a lower outlook for foreign producer prices and domestic administered prices.",11.0,2015,5/11/2015,12.0,242.0,7749.0
2670,https://www.cnb.cz/en/monetary-policy/bank-board-decisions/CNB-Board-decisions-2015-1446715500000-00001/?tab=statement,"As from the end of 2016, by contrast, the inflation forecast has been revised upwards slightly, reflecting higher domestic economic activity and related stronger upward pressures on costs, especially wages.",11.0,2015,5/11/2015,12.0,206.0,7749.0
2671,https://www.cnb.cz/en/monetary-policy/bank-board-decisions/CNB-Board-decisions-2015-1446715500000-00001/?tab=statement,The inflation outlook is thus slightly higher at the monetary policy horizon compared to the previous forecast.,11.0,2015,5/11/2015,12.0,111.0,7749.0
2672,https://www.cnb.cz/en/monetary-policy/bank-board-decisions/CNB-Board-decisions-2015-1446715500000-00001/?tab=statement,The unexpectedly strong GDP growth so far has led to a marked increase in the GDP growth forecast for this year.,11.0,2015,5/11/2015,12.0,112.0,7749.0
2673,https://www.cnb.cz/en/monetary-policy/bank-board-decisions/CNB-Board-decisions-2015-1446715500000-00001/?tab=statement,"However, the economic growth outlook for the next two years is virtually unchanged from the previous forecast.",11.0,2015,5/11/2015,12.0,110.0,7749.0
2674,https://www.cnb.cz/en/monetary-policy/bank-board-decisions/CNB-Board-decisions-2015-1446715500000-00001/?tab=statement,The assumption of flat market interest rates at their current very low level and the use of the exchange rate as a monetary policy instrument until the end of 2016 remains unchanged in the forecast.,11.0,2015,5/11/2015,12.0,198.0,7749.0
2675,https://www.cnb.cz/en/monetary-policy/bank-board-decisions/CNB-Board-decisions-2015-1446715500000-00001/?tab=statement,The Bank Board assessed the risks to the forecast at the monetary policy horizon as being balanced.,12.0,2015,5/11/2015,12.0,99.0,7749.0
2676,https://www.cnb.cz/en/monetary-policy/bank-board-decisions/CNB-Board-decisions-2015-1446715500000-00001/?tab=statement,Slowing demand in emerging countries is a downside risk to economic growth and consequently inflation.,12.0,2015,5/11/2015,12.0,102.0,7749.0
