,filename,sentence,paragraph_index,year,date,paragraphs,num_char_sentence,total_chars
835,https://www.cnb.cz/en/monetary-policy/bank-board-decisions/CNB-Board-decisions-1600872480000/?tab=statement,Core inflation was markedly above the forecast.,5.0,2020,23/9/2020,11.0,47.0,5776.0
836,https://www.cnb.cz/en/monetary-policy/bank-board-decisions/CNB-Board-decisions-1600872480000/?tab=statement,"By contrast, slightly weaker food price inflation and a smaller price impact of the March increase in excise duty on cigarettes fostered lower inflation compared with the forecast.",5.0,2020,23/9/2020,11.0,180.0,5776.0
837,https://www.cnb.cz/en/monetary-policy/bank-board-decisions/CNB-Board-decisions-1600872480000/?tab=statement,"In August, these factors were joined by a somewhat bigger-than-expected drop in fuel prices.",5.0,2020,23/9/2020,11.0,92.0,5776.0
838,https://www.cnb.cz/en/monetary-policy/bank-board-decisions/CNB-Board-decisions-1600872480000/?tab=statement,"By contrast, the forecast for administered prices materialised.",5.0,2020,23/9/2020,11.0,63.0,5776.0
839,https://www.cnb.cz/en/monetary-policy/bank-board-decisions/CNB-Board-decisions-1600872480000/?tab=statement,"The current forecast expects inflation to approach the 2% target at the monetary policy horizon, i.e. in the second half of next year.",5.0,2020,23/9/2020,11.0,134.0,5776.0
840,https://www.cnb.cz/en/monetary-policy/bank-board-decisions/CNB-Board-decisions-1600872480000/?tab=statement,"As a result of the coronavirus pandemic, economic activity dropped by 11% year on year and almost 9% quarter on quarter in Q2. This decline was 1 percentage point smaller than forecasted.",6.0,2020,23/9/2020,11.0,187.0,5776.0
841,https://www.cnb.cz/en/monetary-policy/bank-board-decisions/CNB-Board-decisions-1600872480000/?tab=statement,This deviation can nonetheless be considered insignificant given the unprecedented situation the Czech economy was in during the spring months.,6.0,2020,23/9/2020,11.0,143.0,5776.0
842,https://www.cnb.cz/en/monetary-policy/bank-board-decisions/CNB-Board-decisions-1600872480000/?tab=statement,Household consumption was approximately in line with the forecast.,6.0,2020,23/9/2020,11.0,66.0,5776.0
843,https://www.cnb.cz/en/monetary-policy/bank-board-decisions/CNB-Board-decisions-1600872480000/?tab=statement,"The contribution of net exports was roughly as expected, amid a smaller decline in both exports and imports.",6.0,2020,23/9/2020,11.0,108.0,5776.0
844,https://www.cnb.cz/en/monetary-policy/bank-board-decisions/CNB-Board-decisions-1600872480000/?tab=statement,The year-on-year drop in gross capital formation deepened but was weaker than forecasted owing to fixed investment.,6.0,2020,23/9/2020,11.0,115.0,5776.0
845,https://www.cnb.cz/en/monetary-policy/bank-board-decisions/CNB-Board-decisions-1600872480000/?tab=statement,"By contrast, government consumption, which slackened surprisingly, increased more slowly than forecasted. ",6.0,2020,23/9/2020,11.0,106.0,5776.0
846,https://www.cnb.cz/en/monetary-policy/bank-board-decisions/CNB-Board-decisions-1600872480000/?tab=statement,The year-on-year decline in industrial production and total retail sales has been weakening since May.,7.0,2020,23/9/2020,11.0,102.0,5776.0
847,https://www.cnb.cz/en/monetary-policy/bank-board-decisions/CNB-Board-decisions-1600872480000/?tab=statement,Retail sales excluding the automotive segment even rose slightly in July.,7.0,2020,23/9/2020,11.0,73.0,5776.0
848,https://www.cnb.cz/en/monetary-policy/bank-board-decisions/CNB-Board-decisions-1600872480000/?tab=statement,"Construction was hit by the downturn with a lag, so its recovery is only gradual so far according to the latest data. ",7.0,2020,23/9/2020,11.0,118.0,5776.0
849,https://www.cnb.cz/en/monetary-policy/bank-board-decisions/CNB-Board-decisions-1600872480000/?tab=statement,"In Q2, the labour market started to cool in line with the forecast amid the unprecedented drop in economic activity.",8.0,2020,23/9/2020,11.0,116.0,5776.0
850,https://www.cnb.cz/en/monetary-policy/bank-board-decisions/CNB-Board-decisions-1600872480000/?tab=statement,Growth in unemployment during the spring months was broadly in line with expectations.,8.0,2020,23/9/2020,11.0,86.0,5776.0
851,https://www.cnb.cz/en/monetary-policy/bank-board-decisions/CNB-Board-decisions-1600872480000/?tab=statement,"Total employment declined more markedly than forecasted, but on the other hand wage growth in market and non-market sectors was slightly above the forecast in Q2. The wage bill was thus roughly as predicted.",8.0,2020,23/9/2020,11.0,207.0,5776.0
852,https://www.cnb.cz/en/monetary-policy/bank-board-decisions/CNB-Board-decisions-1600872480000/?tab=statement,"According to Q3 data, the unemployment rate is surprisingly not increasing further so far.",8.0,2020,23/9/2020,11.0,90.0,5776.0
853,https://www.cnb.cz/en/monetary-policy/bank-board-decisions/CNB-Board-decisions-1600872480000/?tab=statement,"Following the approval of a joint stabilisation fund in the EU, the koruna appreciated to almost CZK 26 to the euro during the summer holidays.",9.0,2020,23/9/2020,11.0,143.0,5776.0
854,https://www.cnb.cz/en/monetary-policy/bank-board-decisions/CNB-Board-decisions-1600872480000/?tab=statement,"At the start of September, however, it started to depreciate.",9.0,2020,23/9/2020,11.0,61.0,5776.0
855,https://www.cnb.cz/en/monetary-policy/bank-board-decisions/CNB-Board-decisions-1600872480000/?tab=statement,This was probably due to a visible deterioration of the epidemiological situation in the Czech Republic as well as in other European countries.,9.0,2020,23/9/2020,11.0,143.0,5776.0
856,https://www.cnb.cz/en/monetary-policy/bank-board-decisions/CNB-Board-decisions-1600872480000/?tab=statement,"Its exchange rate against the euro is now weaker than the forecast expected for Q3. However, the average koruna exchange rate in Q3 is slightly stronger than forecasted.",9.0,2020,23/9/2020,11.0,169.0,5776.0
857,https://www.cnb.cz/en/monetary-policy/bank-board-decisions/CNB-Board-decisions-1600872480000/?tab=statement,"The current forecast is materialising fairly well so far, in an environment of high uncertainty.",10.0,2020,23/9/2020,11.0,96.0,5776.0
858,https://www.cnb.cz/en/monetary-policy/bank-board-decisions/CNB-Board-decisions-1600872480000/?tab=statement,Inflation was only marginally higher in August compared with the forecast.,10.0,2020,23/9/2020,11.0,74.0,5776.0
859,https://www.cnb.cz/en/monetary-policy/bank-board-decisions/CNB-Board-decisions-1600872480000/?tab=statement,The depth of the year-on-year decline in GDP in 2020 Q2 was broadly in line with expectations.,10.0,2020,23/9/2020,11.0,94.0,5776.0
860,https://www.cnb.cz/en/monetary-policy/bank-board-decisions/CNB-Board-decisions-1600872480000/?tab=statement,The share of unemployed persons has remained somewhat below the forecast in Q3 so far.,10.0,2020,23/9/2020,11.0,86.0,5776.0
861,https://www.cnb.cz/en/monetary-policy/bank-board-decisions/CNB-Board-decisions-1600872480000/?tab=statement,"Growth in the average wage halted in Q2, in line with expectations.",10.0,2020,23/9/2020,11.0,67.0,5776.0
862,https://www.cnb.cz/en/monetary-policy/bank-board-decisions/CNB-Board-decisions-1600872480000/?tab=statement,The Bank Board assessed the risks to the current forecast as remaining substantial.,11.0,2020,23/9/2020,11.0,83.0,5776.0
863,https://www.cnb.cz/en/monetary-policy/bank-board-decisions/CNB-Board-decisions-1600872480000/?tab=statement,The current epidemiological situation is increasing the uncertainty regarding future economic developments.,11.0,2020,23/9/2020,11.0,107.0,5776.0
864,https://www.cnb.cz/en/monetary-policy/bank-board-decisions/CNB-Board-decisions-1600872480000/?tab=statement,"Owing to the high economic costs of the across-the-board restrictive measures introduced in the spring phase of the pandemic, governments of individual countries are now trying to stabilise the current situation using targeted restrictions with only small economic impacts so far.",11.0,2020,23/9/2020,11.0,280.0,5776.0
865,https://www.cnb.cz/en/monetary-policy/bank-board-decisions/CNB-Board-decisions-1600872480000/?tab=statement,"However, given the current situation, the possibility of the re-introduction of more extensive quarantine measures cannot be ruled out completely.",11.0,2020,23/9/2020,11.0,146.0,5776.0
866,https://www.cnb.cz/en/monetary-policy/bank-board-decisions/CNB-Board-decisions-1600872480000/?tab=statement,"A resurgence of the pandemic thus poses the biggest risk to the current forecast, mainly in the direction of lower domestic economic activity.",11.0,2020,23/9/2020,11.0,142.0,5776.0
867,https://www.cnb.cz/en/monetary-policy/bank-board-decisions/CNB-Board-decisions-1600872480000/?tab=statement,"Conversely, the additional budgetary measures currently being considered by the Czech government may have the opposite effect on the domestic economy next year.",11.0,2020,23/9/2020,11.0,160.0,5776.0
868,https://www.cnb.cz/en/monetary-policy/bank-board-decisions/CNB-Board-decisions-1600872480000/?tab=statement,The composition of the supply and demand factors underlying the evolution of domestic inflation remains an uncertainty.,11.0,2020,23/9/2020,11.0,119.0,5776.0
869,https://www.cnb.cz/en/monetary-policy/bank-board-decisions/CNB-Board-decisions-1596725280000/?tab=statement,"At its meeting today, the Bank Board of the Czech National Bank unanimously kept interest rates unchanged.",1.0,2020,6/8/2020,11.0,106.0,6373.0
870,https://www.cnb.cz/en/monetary-policy/bank-board-decisions/CNB-Board-decisions-1596725280000/?tab=statement,"The two-week repo rate thus remains at 0.25%, the discount rate at 0.05% and the Lombard rate at 1%.</",1.0,2020,6/8/2020,11.0,102.0,6373.0
871,https://www.cnb.cz/en/monetary-policy/bank-board-decisions/CNB-Board-decisions-1596725280000/?tab=statement,The decision adopted by the Bank Board is underpinned by a new macroeconomic forecast.,2.0,2020,6/8/2020,11.0,86.0,6373.0
872,https://www.cnb.cz/en/monetary-policy/bank-board-decisions/CNB-Board-decisions-1596725280000/?tab=statement,"Consistent with the forecast is stability of domestic market interest rates until mid-2021, followed by a gradual rise in rates.",2.0,2020,6/8/2020,11.0,128.0,6373.0
873,https://www.cnb.cz/en/monetary-policy/bank-board-decisions/CNB-Board-decisions-1596725280000/?tab=statement,"In the context of the ongoing coronavirus pandemic, it must be stressed that the uncertainty regarding the external and domestic assumptions of the new forecast and the way they are captured by the forecasting system is again high.",2.0,2020,6/8/2020,11.0,231.0,6373.0
874,https://www.cnb.cz/en/monetary-policy/bank-board-decisions/CNB-Board-decisions-1596725280000/?tab=statement,"The world economy is gradually recovering from the quarantine restrictions, although the epidemiological situation is not entirely under control everywhere.",3.0,2020,6/8/2020,11.0,156.0,6373.0
875,https://www.cnb.cz/en/monetary-policy/bank-board-decisions/CNB-Board-decisions-1596725280000/?tab=statement,"Most euro area countries bottomed out in Q2. Fiscal and monetary policy measures are supporting renewed economic growth in the euro area, which is expected from the middle of this year onwards.",3.0,2020,6/8/2020,11.0,193.0,6373.0
876,https://www.cnb.cz/en/monetary-policy/bank-board-decisions/CNB-Board-decisions-1596725280000/?tab=statement,"However, euro area GDP will decline markedly overall this year.",3.0,2020,6/8/2020,11.0,63.0,6373.0
877,https://www.cnb.cz/en/monetary-policy/bank-board-decisions/CNB-Board-decisions-1596725280000/?tab=statement,Producer prices in the euro area will drop this year owing to low oil prices and weak demand pressures in the production sector.,3.0,2020,6/8/2020,11.0,128.0,6373.0
878,https://www.cnb.cz/en/monetary-policy/bank-board-decisions/CNB-Board-decisions-1596725280000/?tab=statement,These anti-inflationary effects will fade out next year.,3.0,2020,6/8/2020,11.0,56.0,6373.0
879,https://www.cnb.cz/en/monetary-policy/bank-board-decisions/CNB-Board-decisions-1596725280000/?tab=statement,Consumer price inflation in euro area countries can also be expected to be subdued this year.,3.0,2020,6/8/2020,11.0,93.0,6373.0
880,https://www.cnb.cz/en/monetary-policy/bank-board-decisions/CNB-Board-decisions-1596725280000/?tab=statement,"The European Central Bank is keeping its monetary policy extremely easy, and short-term euro rates remain negative over the entire forecast horizon.",3.0,2020,6/8/2020,11.0,148.0,6373.0
881,https://www.cnb.cz/en/monetary-policy/bank-board-decisions/CNB-Board-decisions-1596725280000/?tab=statement,The expected trend of the Brent crude oil price is slightly rising.,4.0,2020,6/8/2020,11.0,67.0,6373.0
882,https://www.cnb.cz/en/monetary-policy/bank-board-decisions/CNB-Board-decisions-1596725280000/?tab=statement,The euro will appreciate slightly against the dollar.,4.0,2020,6/8/2020,11.0,53.0,6373.0
883,https://www.cnb.cz/en/monetary-policy/bank-board-decisions/CNB-Board-decisions-1596725280000/?tab=statement,The single European currency should benefit mainly from the massive volumes of fiscal measures aimed at supporting the economy and from a better epidemiological situation compared with the USA.,4.0,2020,6/8/2020,11.0,193.0,6373.0
884,https://www.cnb.cz/en/monetary-policy/bank-board-decisions/CNB-Board-decisions-1596725280000/?tab=statement,Part of the Czech economy was shut down during the spring months due to measures to combat the coronavirus pandemic.,5.0,2020,6/8/2020,11.0,116.0,6373.0
885,https://www.cnb.cz/en/monetary-policy/bank-board-decisions/CNB-Board-decisions-1596725280000/?tab=statement,"Although the quarantine measures have been almost fully lifted, reduced external demand, a marked rise in unemployment and worse overall perceptions of the economic situation among Czech firms and households will have an adverse effect on the economy in the months ahead.",5.0,2020,6/8/2020,11.0,271.0,6373.0
886,https://www.cnb.cz/en/monetary-policy/bank-board-decisions/CNB-Board-decisions-1596725280000/?tab=statement,This will lead to a decline in GDP of around 8% overall this year.,5.0,2020,6/8/2020,11.0,66.0,6373.0
887,https://www.cnb.cz/en/monetary-policy/bank-board-decisions/CNB-Board-decisions-1596725280000/?tab=statement,"The economy will return to growth next year, but it will not reach the pre-pandemic level until the end of 2022.",5.0,2020,6/8/2020,11.0,112.0,6373.0
888,https://www.cnb.cz/en/monetary-policy/bank-board-decisions/CNB-Board-decisions-1596725280000/?tab=statement,The decline in economic activity this year will be due mainly to a drop in private investment.,5.0,2020,6/8/2020,11.0,94.0,6373.0
889,https://www.cnb.cz/en/monetary-policy/bank-board-decisions/CNB-Board-decisions-1596725280000/?tab=statement,The recovery in investment will be hindered by a deep downturn in external demand reflecting significantly worse global economic sentiment.,5.0,2020,6/8/2020,11.0,139.0,6373.0
890,https://www.cnb.cz/en/monetary-policy/bank-board-decisions/CNB-Board-decisions-1596725280000/?tab=statement,"At the same time, the exports of Czech corporations will decrease.",5.0,2020,6/8/2020,11.0,66.0,6373.0
891,https://www.cnb.cz/en/monetary-policy/bank-board-decisions/CNB-Board-decisions-1596725280000/?tab=statement,This will be reflected in a negative contribution of net exports.,5.0,2020,6/8/2020,11.0,65.0,6373.0
892,https://www.cnb.cz/en/monetary-policy/bank-board-decisions/CNB-Board-decisions-1596725280000/?tab=statement,"By contrast, the negative impacts of the coronavirus pandemic are being softened by faster growth in government consumption coupled with stabilising budgetary measures, which are supporting household consumption above all. ",5.0,2020,6/8/2020,11.0,223.0,6373.0
893,https://www.cnb.cz/en/monetary-policy/bank-board-decisions/CNB-Board-decisions-1596725280000/?tab=statement,Inflation will stay above the upper boundary of the tolerance band for the rest of this year.,6.0,2020,6/8/2020,11.0,93.0,6373.0
894,https://www.cnb.cz/en/monetary-policy/bank-board-decisions/CNB-Board-decisions-1596725280000/?tab=statement,The elevated growth in consumer prices is due mainly to buoyant core inflation and rapid growth in food prices.,6.0,2020,6/8/2020,11.0,111.0,6373.0
895,https://www.cnb.cz/en/monetary-policy/bank-board-decisions/CNB-Board-decisions-1596725280000/?tab=statement,"The latter is due, among other things, to still solid consumer demand, international transport restrictions due to the coronavirus pandemic, and also to labour shortages in agriculture.",6.0,2020,6/8/2020,11.0,185.0,6373.0
896,https://www.cnb.cz/en/monetary-policy/bank-board-decisions/CNB-Board-decisions-1596725280000/?tab=statement,The continued price growth in the months ahead will reflect efforts by firms to make up the loss of revenues they suffered during the coronavirus pandemic and for growth in their costs.,6.0,2020,6/8/2020,11.0,185.0,6373.0
897,https://www.cnb.cz/en/monetary-policy/bank-board-decisions/CNB-Board-decisions-1596725280000/?tab=statement,"Over the monetary policy horizon, i.e. in the second half of next year, however, the deep decline in demand and overall economic activity will prevail and inflation will return close to the 2% target.",6.0,2020,6/8/2020,11.0,200.0,6373.0
898,https://www.cnb.cz/en/monetary-policy/bank-board-decisions/CNB-Board-decisions-1596725280000/?tab=statement,"This will be fostered by lower growth in domestic costs, a slightly appreciating koruna and a cooling of the labour market.",6.0,2020,6/8/2020,11.0,123.0,6373.0
899,https://www.cnb.cz/en/monetary-policy/bank-board-decisions/CNB-Board-decisions-1596725280000/?tab=statement,Consumer price inflation will stay close to the target in 2022.,6.0,2020,6/8/2020,11.0,63.0,6373.0
900,https://www.cnb.cz/en/monetary-policy/bank-board-decisions/CNB-Board-decisions-1596725280000/?tab=statement,"Monetary policy-relevant inflation will be slightly lower than headline inflation, as the first-round effects of changes to indirect taxes will be slightly positive overall.",7.0,2020,6/8/2020,11.0,173.0,6373.0
901,https://www.cnb.cz/en/monetary-policy/bank-board-decisions/CNB-Board-decisions-1596725280000/?tab=statement,Monetary policy-relevant inflation will be at the 2% target over the monetary policy horizon.,7.0,2020,6/8/2020,11.0,93.0,6373.0
902,https://www.cnb.cz/en/monetary-policy/bank-board-decisions/CNB-Board-decisions-1596725280000/?tab=statement,The koruna appreciated in late May owing to a change in global sentiment fostered by the easing of the quarantine measures.,8.0,2020,6/8/2020,11.0,123.0,6373.0
903,https://www.cnb.cz/en/monetary-policy/bank-board-decisions/CNB-Board-decisions-1596725280000/?tab=statement,A relatively moderate course of the pandemic in the domestic economy and in Europe will allow the exchange rate to appreciate gradually further over the forecast horizon.,8.0,2020,6/8/2020,11.0,170.0,6373.0
904,https://www.cnb.cz/en/monetary-policy/bank-board-decisions/CNB-Board-decisions-1596725280000/?tab=statement,"This will be due to renewed growth in external demand and, in turn, domestic economic activity.",8.0,2020,6/8/2020,11.0,95.0,6373.0
905,https://www.cnb.cz/en/monetary-policy/bank-board-decisions/CNB-Board-decisions-1596725280000/?tab=statement,"Consistent with the forecast is stability of domestic market interest rates until mid-2021, followed by a gradual rise in rates.",9.0,2020,6/8/2020,11.0,128.0,6373.0
906,https://www.cnb.cz/en/monetary-policy/bank-board-decisions/CNB-Board-decisions-1596725280000/?tab=statement,"Following a sizeable decrease in market interest rates in the first half of this year, which reflected the Czech National Bank’s response to the negative impacts of the coronavirus pandemic, rates will remain stable for a few quarters according to the forecast.",9.0,2020,6/8/2020,11.0,261.0,6373.0
907,https://www.cnb.cz/en/monetary-policy/bank-board-decisions/CNB-Board-decisions-1596725280000/?tab=statement,"The forecast indicates a gradual increase in market interest rates from the second half of next year onwards as domestic economic activity recovers, amid stabilisation of inflation close to the target.",9.0,2020,6/8/2020,11.0,201.0,6373.0
908,https://www.cnb.cz/en/monetary-policy/bank-board-decisions/CNB-Board-decisions-1596725280000/?tab=statement,The inflation outlook for the next four quarters is higher than in the previous forecast.,10.0,2020,6/8/2020,11.0,89.0,6373.0
909,https://www.cnb.cz/en/monetary-policy/bank-board-decisions/CNB-Board-decisions-1596725280000/?tab=statement,"Over the monetary policy horizon (i.e. in the second half of next year), however, the inflation forecast is virtually unchanged.",10.0,2020,6/8/2020,11.0,128.0,6373.0
910,https://www.cnb.cz/en/monetary-policy/bank-board-decisions/CNB-Board-decisions-1596725280000/?tab=statement,The outlook for domestic economic activity and interest rates is slightly lower this year and the next.,10.0,2020,6/8/2020,11.0,103.0,6373.0
911,https://www.cnb.cz/en/monetary-policy/bank-board-decisions/CNB-Board-decisions-1596725280000/?tab=statement,The exchange rate of the koruna against the euro is stronger in both years than in the previous forecast.,10.0,2020,6/8/2020,11.0,105.0,6373.0
912,https://www.cnb.cz/en/monetary-policy/bank-board-decisions/CNB-Board-decisions-1596725280000/?tab=statement,The Bank Board assessed the risks to the forecast as being significant but not tilted in either direction overall.,11.0,2020,6/8/2020,11.0,114.0,6373.0
913,https://www.cnb.cz/en/monetary-policy/bank-board-decisions/CNB-Board-decisions-1596725280000/?tab=statement,The course of the pandemic and the possible reintroduction of quarantine measures remain a risk.,11.0,2020,6/8/2020,11.0,96.0,6373.0
914,https://www.cnb.cz/en/monetary-policy/bank-board-decisions/CNB-Board-decisions-1596725280000/?tab=statement,"However, the uncertainties of the forecast also include the speed of recovery of the European and domestic economies now that the quarantine restrictions imposed during the first wave of the pandemic have been lifted.",11.0,2020,6/8/2020,11.0,217.0,6373.0
915,https://www.cnb.cz/en/monetary-policy/bank-board-decisions/CNB-Board-decisions-1596725280000/?tab=statement,The current evolution of the exchange rate may be a downside risk to inflation.,11.0,2020,6/8/2020,11.0,79.0,6373.0
916,https://www.cnb.cz/en/monetary-policy/bank-board-decisions/CNB-Board-decisions-1596725280000/?tab=statement,"By contrast, fiscal policy support for the domestic economy may be stronger than assumed by the forecast in the years ahead.",11.0,2020,6/8/2020,11.0,124.0,6373.0
917,https://www.cnb.cz/en/monetary-policy/bank-board-decisions/CNB-Board-decisions-1596725280000/?tab=statement,A specific domestic uncertainty is the structure of the supply and demand factors underlying the surprisingly rapid growth in consumer prices in recent months.,11.0,2020,6/8/2020,11.0,159.0,6373.0
918,https://www.cnb.cz/en/monetary-policy/bank-board-decisions/CNB-Board-decisions-1593010080000/?tab=statement,"At its meeting today, the Bank Board of the Czech National Bank unanimously kept interest rates unchanged.",1.0,2020,24/6/2020,11.0,106.0,5240.0
919,https://www.cnb.cz/en/monetary-policy/bank-board-decisions/CNB-Board-decisions-1593010080000/?tab=statement,"The two-week repo rate thus remains at 0.25%, the discount rate at 0.05% and the Lombard rate at 1%.</",1.0,2020,24/6/2020,11.0,102.0,5240.0
920,https://www.cnb.cz/en/monetary-policy/bank-board-decisions/CNB-Board-decisions-1593010080000/?tab=statement,This decision of the Bank Board is underpinned by the May macroeconomic forecast and by an assessment of information obtained since it was prepared.,2.0,2020,24/6/2020,11.0,148.0,5240.0
921,https://www.cnb.cz/en/monetary-policy/bank-board-decisions/CNB-Board-decisions-1593010080000/?tab=statement,The latest forecast was prepared in unprecedented conditions of a peaking coronavirus pandemic and related huge uncertainty.,2.0,2020,24/6/2020,11.0,124.0,5240.0
922,https://www.cnb.cz/en/monetary-policy/bank-board-decisions/CNB-Board-decisions-1593010080000/?tab=statement,"Its baseline scenario is largely materialising so far, although the published data may be subject to an increased degree of uncertainty.",2.0,2020,24/6/2020,11.0,136.0,5240.0
923,https://www.cnb.cz/en/monetary-policy/bank-board-decisions/CNB-Board-decisions-1593010080000/?tab=statement,"After the fall in domestic market interest rates in May, consistent with the forecast is broad stability of rates in the following quarters.",2.0,2020,24/6/2020,11.0,140.0,5240.0
924,https://www.cnb.cz/en/monetary-policy/bank-board-decisions/CNB-Board-decisions-1593010080000/?tab=statement,The Bank Board assessed the risks to the current inflation forecast at the monetary policy horizon as being broadly balanced.,2.0,2020,24/6/2020,11.0,125.0,5240.0
925,https://www.cnb.cz/en/monetary-policy/bank-board-decisions/CNB-Board-decisions-1593010080000/?tab=statement,The decline in GDP in the effective euro area will be somewhat deeper than forecasted this year.,3.0,2020,24/6/2020,11.0,96.0,5240.0
926,https://www.cnb.cz/en/monetary-policy/bank-board-decisions/CNB-Board-decisions-1593010080000/?tab=statement,"Next year, economic activity will recover all the more markedly.",3.0,2020,24/6/2020,11.0,64.0,5240.0
927,https://www.cnb.cz/en/monetary-policy/bank-board-decisions/CNB-Board-decisions-1593010080000/?tab=statement,The outlook for foreign prices has not been revised significantly compared with the assumptions of the current forecast.,3.0,2020,24/6/2020,11.0,120.0,5240.0
